"ID","Pokemon","Family","Shadow","Little_Rank","Great_Rank","Ultra_Rank","Master_Rank","Little_IVs","Great_IVs","Ultra_IVs","Master_IVs","Little_Level","Great_Level","Ultra_Level","Master_Level","Little_CP","Great_CP","Ultra_CP","Master_CP","Little_MoveSet","Great_MoveSet","Ultra_MoveSet","Master_MoveSet","Evo_Fam","Evo_Next"
545,"Scolipede","Venipede",FALSE,516,495,320,469,"0/10/11","1/15/14","0/15/15","15/15/14","8","23","47.5","50",500,1495,2500,2766,"Poison Jab, X-Scissor, Sludge Bomb","Poison Jab, X-Scissor, Sludge Bomb","Poison Jab, X-Scissor, Sludge Bomb","Poison Jab, X-Scissor, Sludge Bomb","543;544;545","545"
546,"Cottonee","Cottonee",FALSE,79,,,,"0/15/15",,,,"30.5",,,,495,,,,"Charm, Grass Knot, Seed Bomb",,,,"546;547","546;547"
547,"Whimsicott","Cottonee",FALSE,413,76,279,,"1/15/13","0/14/15","15/15/14",,"9.5","28.5","50",,500,1490,2277,,"Fairy Wind, Seed Bomb, Moonblast","Fairy Wind, Seed Bomb, Moonblast","Fairy Wind, Grass Knot, Moonblast",,"546;547","547"
548,"Petilil","Petilil",FALSE,1141,,,,"1/15/15",,,,"19",,,,499,,,,"Hidden Power (Grass), Energy Ball, Seed Bomb",,,,"548;549","548;549"
549,"Lilligant","Petilil",FALSE,843,809,638,580,"1/15/13","0/15/15","0/13/14","15/15/15","7.5","22","44.5","50",499,1491,2499,2883,"Charm, Petal Blizzard, Hyper Beam","Charm, Petal Blizzard, Hyper Beam","Charm, Petal Blizzard, Hyper Beam","Magical Leaf, Petal Blizzard, Hyper Beam","548;549","549"
550,"Basculin","Basculin",FALSE,557,501,542,,"2/15/14","0/11/15","15/15/15",,"9","27.5","50",,498,1495,2363,,"Water Gun, Aqua Tail, Muddy Water","Water Gun, Aqua Tail, Muddy Water","Water Gun, Aqua Tail, Muddy Water",,"550;902","550;902"
551,"Sandile","Sandile",FALSE,731,,,,"0/15/11",,,,"19",,,,500,,,,"Mud Slap, Crunch, Dig",,,,"551;552;553","551;552;553"
552,"Krokorok","Sandile",FALSE,759,750,,,"0/15/15","6/15/15",,,"13.5","49",,,498,1492,,,"Mud Slap, Crunch, Earthquake","Mud Slap, Crunch, Earthquake",,,"551;552;553","552;553"
553,"Krookodile","Sandile",FALSE,925,708,492,190,"0/13/5","0/13/14","0/13/15","15/15/15","6.5","18.5","31.5","50",497,1498,2500,3444,"Snarl, Crunch, Earthquake","Snarl, Crunch, Earthquake","Snarl, Crunch, Earthquake","Snarl, Crunch, Earthquake","551;552;553","553"
554,"Darumaka","Darumaka",FALSE,489,621,,,"0/13/14","2/15/14",,,"13.5","50",,,496,1499,,,"Fire Fang, Fire Punch, Flame Charge","Fire Fang, Fire Punch, Flame Charge",,,"554;555","554;555"
554,"Darumaka (Galarian)","Darumaka",FALSE,837,741,,,"0/13/14","2/15/14",,,"13.5","50",,,496,1499,,,"Ice Fang, Ice Punch, Ice Beam","Ice Fang, Ice Punch, Ice Beam",,,"554;555","554;555"
555,"Darmanitan (Galarian)","Darumaka",FALSE,897,834,658,284,"9/15/14","0/15/11","0/13/15","15/15/15","6","18","30","50",496,1497,2488,3511,"Ice Fang, Avalanche, Superpower","Ice Fang, Avalanche, Superpower","Ice Fang, Avalanche, Superpower","Ice Fang, Avalanche, Superpower","554;555","555"
555,"Darmanitan (Standard)","Darumaka",FALSE,751,459,247,178,"9/15/14","0/15/11","0/13/15","15/15/15","6","18","30","50",496,1497,2488,3511,"Incinerate, Rock Slide, Overheat","Incinerate, Rock Slide, Overheat","Incinerate, Rock Slide, Overheat","Incinerate, Rock Slide, Overheat","554;555","555"
555,"Darmanitan (Standard) (Shadow)","Darumaka",TRUE,,491,301,182,,"0/15/11","0/13/15","15/15/15",,"18","30","50",,1497,2488,3511,,"Incinerate, Rock Slide, Overheat","Incinerate, Rock Slide, Overheat","Incinerate, Rock Slide, Overheat","554;555","555"
556,"Maractus","Maractus",FALSE,1095,787,558,581,"0/14/10","0/13/14","9/15/15","15/15/15","8.5","25","50","50",498,1498,2496,2571,"Bullet Seed, Aerial Ace, Petal Blizzard","Bullet Seed, Aerial Ace, Petal Blizzard","Bullet Seed, Aerial Ace, Petal Blizzard","Bullet Seed, Aerial Ace, Petal Blizzard","556","556"
557,"Dwebble","Dwebble",FALSE,525,697,,,"1/15/15","15/15/15",,,"16","50",,,498,1384,,,"Smack Down, X-Scissor, Rock Blast","Smack Down, X-Scissor, Rock Blast",,,"557;558","557;558"
557,"Dwebble (Shadow)","Dwebble",TRUE,418,704,,,"1/15/15","15/15/15",,,"16","50",,,498,1384,,,"Smack Down, X-Scissor, Rock Blast","Smack Down, X-Scissor, Rock Blast",,,"557;558","557;558"
558,"Crustle","Dwebble",FALSE,647,574,377,386,"3/15/13","0/13/13","0/14/15","15/15/15","7.5","22.5","45","50",499,1499,2490,2874,"Smack Down, X-Scissor, Rock Slide","Smack Down, Rock Slide, X-Scissor","Smack Down, X-Scissor, Rock Slide","Fury Cutter, X-Scissor, Rock Slide","557;558","558"
558,"Crustle (Shadow)","Dwebble",TRUE,544,570,401,354,"3/15/13","0/13/13","0/14/15","15/15/15","7.5","22.5","45","50",499,1499,2490,2874,"Smack Down, X-Scissor, Rock Slide","Smack Down, X-Scissor, Rock Slide","Smack Down, X-Scissor, Rock Slide","Fury Cutter, X-Scissor, Rock Slide","557;558","558"
559,"Scraggy","Scraggy",FALSE,800,646,,,"0/15/9","11/15/15",,,"14.5","49.5",,,499,1494,,,"Feint Attack, Foul Play, Brick Break","Feint Attack, Foul Play, Brick Break",,,"559;560","559;560"
560,"Scrafty","Scraggy",FALSE,27,94,52,319,"0/15/13","0/8/15","9/15/15","15/15/15","8.5","25.5","50","50",500,1489,2497,2581,"Counter, Foul Play, Power-Up Punch","Counter, Foul Play, Thunder Punch","Counter, Foul Play, Thunder Punch","Counter, Foul Play, Thunder Punch","559;560","560"
561,"Sigilyph","Sigilyph",FALSE,1099,884,655,579,"0/15/15","1/15/14","0/13/15","15/15/15","7.5","22","44.5","50",498,1500,2489,2883,"Air Slash, Ancient Power, Signal Beam","Air Slash, Ancient Power, Signal Beam","Air Slash, Ancient Power, Signal Beam","Air Slash, Ancient Power, Signal Beam","561","561"
562,"Yamask","Yamask",FALSE,707,,,,"0/10/15",,,,"21",,,,498,,,,"Astonish, Shadow Ball, Dark Pulse",,,,"562;563;867","562;563;867"
562,"Yamask (Galarian)","Yamask",FALSE,947,,,,"0/10/15",,,,"21",,,,498,,,,"Astonish, Rock Tomb, Night Shade",,,,"562;563;867","562;563;867"
563,"Cofagrigus","Cofagrigus",FALSE,393,115,65,397,"0/15/15","0/11/14","10/15/15","15/15/15","8.5","25.5","50","50",497,1500,2492,2570,"Shadow Claw, Shadow Ball, Dark Pulse","Shadow Claw, Shadow Ball, Dark Pulse","Shadow Claw, Shadow Ball, Dark Pulse","Shadow Claw, Shadow Ball, Dark Pulse","562;563","563"
564,"Tirtouga","Tirtouga",FALSE,387,422,,,"1/15/14","0/14/15",,,"13","49.5",,,499,1494,,,"Water Gun, Surf, Body Slam","Water Gun, Surf, Body Slam",,,"564;565","564;565"
565,"Carracosta","Tirtouga",FALSE,457,496,400,363,"0/9/12","1/14/15","1/14/15","15/15/15","7.5","21.5","42","50",499,1497,2486,2964,"Water Gun, Surf, Body Slam","Water Gun, Surf, Body Slam","Water Gun, Surf, Body Slam","Water Gun, Surf, Body Slam","564;565","565"
566,"Archen","Archen",FALSE,624,557,,,"3/15/15","0/15/14",,,"10","31",,,497,1497,,,"Wing Attack, Ancient Power, Dragon Claw","Wing Attack, Ancient Power, Dragon Claw",,,"566;567","566;567"
567,"Archeops","Archen",FALSE,739,565,418,219,"0/9/6","1/15/15","1/15/15","15/15/15","6","16.5","27.5","50",496,1494,2499,3766,"Wing Attack, Ancient Power, Dragon Claw","Wing Attack, Ancient Power, Dragon Claw","Wing Attack, Dragon Claw, Ancient Power","Wing Attack, Dragon Claw, Ancient Power","566;567","567"
568,"Trubbish","Trubbish",FALSE,1187,,,,"0/14/12",,,,"20.5",,,,500,,,,"Take Down, Seed Bomb, Gunk Shot",,,,"568;569","568;569"
569,"Garbodor","Trubbish",FALSE,682,706,547,570,"0/2/14","0/13/13","3/15/15","15/15/15","8.5","24.5","50","50",498,1498,2499,2651,"Infestation, Body Slam, Seed Bomb","Infestation, Body Slam, Seed Bomb","Infestation, Body Slam, Seed Bomb","Infestation, Body Slam, Seed Bomb","568;569","569"
570,"Zorua","Zorua",FALSE,1074,,,,"1/15/11",,,,"16.5",,,,495,,,,"Feint Attack, Foul Play, Aerial Ace",,,,"570;571","570;571"
571,"Zoroark","Zorua",FALSE,1032,767,526,429,"0/13/11","1/15/15","1/15/15","15/15/14","7.5","21.5","42","50",500,1497,2500,2907,"Shadow Claw, Foul Play, Sludge Bomb","Shadow Claw, Foul Play, Sludge Bomb","Shadow Claw, Foul Play, Flamethrower","Shadow Claw, Foul Play, Flamethrower","570;571","571"
572,"Minccino","Minccino",FALSE,629,,,,"0/15/10",,,,"23.5",,,,497,,,,"Charm, Aqua Tail, Thunderbolt",,,,"572;573","572;573"
573,"Cinccino","Minccino",FALSE,787,797,612,563,"0/15/13","2/15/14","12/15/15","15/15/15","8.5","25","50","50",498,1499,2490,2535,"Charm, Aqua Tail, Thunderbolt","Charm, Aqua Tail, Thunderbolt","Charm, Aqua Tail, Thunderbolt","Charm, Aqua Tail, Thunderbolt","572;573","573"
574,"Gothita","Gothita",FALSE,905,,,,"0/15/11",,,,"21.5",,,,500,,,,"Confusion, Psyshock, Psychic",,,,"574;575;576","574;575;576"
575,"Gothorita","Gothita",FALSE,999,738,,,"2/14/14","0/15/14",,,"12","43",,,498,1498,,,"Confusion, Future Sight, Psychic","Confusion, Future Sight, Psychic",,,"574;575;576","575;576"
575,"Gothorita (Shadow)","Gothita",TRUE,,744,,,,"0/15/14",,,,"43",,,,1498,,,,"Confusion, Future Sight, Psychic",,,"574;575;576","575;576"
576,"Gothitelle","Gothita",FALSE,998,662,407,516,"0/13/15","0/15/15","0/14/15","15/15/15","8","23.5","49.5","50",498,1498,2488,2735,"Confusion, Rock Slide, Future Sight","Confusion, Rock Slide, Future Sight","Confusion, Rock Slide, Future Sight","Confusion, Rock Slide, Future Sight","574;575;576","576"
576,"Gothitelle (Shadow)","Gothita",TRUE,,698,504,532,,"0/15/15","0/14/15","15/15/15",,"23.5","49.5","50",,1498,2488,2735,,"Confusion, Rock Slide, Future Sight","Confusion, Rock Slide, Future Sight","Confusion, Rock Slide, Future Sight","574;575;576","576"
577,"Solosis","Solosis",FALSE,1161,948,,,"0/14/15","9/15/15",,,"14","50",,,499,1497,,,"Hidden Power (Psychic), Psyshock, Thunder","Hidden Power (Psychic), Psyshock, Thunder",,,"577;578;579","577;578;579"
577,"Solosis (Shadow)","Solosis",TRUE,,941,,,,"9/15/15",,,,"50",,,,1497,,,,"Hidden Power (Psychic), Psyshock, Thunder",,,"577;578;579","577;578;579"
578,"Duosion","Solosis",FALSE,1162,947,,,"0/11/15","0/15/13",,,"9.5","28",,,500,1493,,,"Hidden Power (Psychic), Psyshock, Thunder","Hidden Power (Psychic), Psyshock, Thunder",,,"577;578;579","578;579"
578,"Duosion (Shadow)","Solosis",TRUE,,944,,,,"0/15/13",,,,"28",,,,1493,,,,"Hidden Power (Psychic), Psyshock, Thunder",,,"577;578;579","578;579"
579,"Reuniclus","Solosis",FALSE,1172,954,689,548,"3/15/15","2/15/14","0/13/14","15/15/14","6.5","19","34.5","50",499,1500,2497,3309,"Hidden Power (Fighting), Future Sight, Shadow Ball","Hidden Power (Fighting), Future Sight, Shadow Ball","Hidden Power (Psychic), Shadow Ball, Future Sight","Hidden Power (Psychic), Shadow Ball, Future Sight","577;578;579","579"
579,"Reuniclus (Shadow)","Solosis",TRUE,,940,695,572,,"2/15/14","0/13/14","15/15/14",,"19","34.5","50",,1500,2497,3309,,"Hidden Power (Psychic), Future Sight, Shadow Ball","Hidden Power (Psychic), Shadow Ball, Future Sight","Hidden Power (Psychic), Shadow Ball, Future Sight","577;578;579","579"
580,"Ducklett","Ducklett",FALSE,55,,,,"0/15/15",,,,"24",,,,500,,,,"Wing Attack, Bubble Beam, Brave Bird",,,,"580;581","580;581"
580,"Ducklett (Shadow)","Ducklett",TRUE,115,,,,"0/15/15",,,,"24",,,,500,,,,"Wing Attack, Bubble Beam, Brave Bird",,,,"580;581","580;581"
581,"Swanna","Ducklett",FALSE,1101,615,443,,"2/15/15","1/15/15","15/15/15",,"9","27","50",,496,1498,2361,,"Air Slash, Hurricane, Ice Beam","Air Slash, Fly, Ice Beam","Water Gun, Fly, Ice Beam",,"580;581","581"
581,"Swanna (Shadow)","Ducklett",TRUE,894,514,543,,"2/15/15","1/15/15","15/15/15",,"9","27","50",,496,1498,2361,,"Water Gun, Hurricane, Ice Beam","Water Gun, Fly, Ice Beam","Air Slash, Fly, Ice Beam",,"580;581","581"
582,"Vanillite","Vanillite",FALSE,738,,,,"0/14/11",,,,"19.5",,,,499,,,,"Powder Snow, Icy Wind, Signal Beam",,,,"582;583;584","582;583;584"
583,"Vanillish","Vanillite",FALSE,976,702,,,"1/15/15","0/14/15",,,"12","43",,,499,1499,,,"Frost Breath, Icy Wind, Signal Beam","Frost Breath, Icy Wind, Signal Beam",,,"582;583;584","583;584"
584,"Vanilluxe","Vanillite",FALSE,1178,956,697,568,"0/9/10","0/15/12","0/15/11","15/15/15","7","20","37","50",500,1497,2493,3190,"Astonish, Blizzard, Signal Beam","Astonish, Blizzard, Signal Beam","Astonish, Blizzard, Signal Beam","Astonish, Blizzard, Signal Beam","582;583;584","584"
585,"Deerling","Deerling",FALSE,795,872,,,"0/14/15","15/15/14",,,"17.5","50",,,500,1283,,,"Tackle, Wild Charge, Trailblaze","Tackle, Wild Charge, Trailblaze",,,"585;586","585;586"
586,"Sawsbuck","Deerling",FALSE,1133,883,605,521,"0/13/13","0/14/14","0/15/11","15/15/15","8","23.5","49.5","50",500,1495,2496,2732,"Feint Attack, Wild Charge, Trailblaze","Feint Attack, Wild Charge, Trailblaze","Feint Attack, Wild Charge, Trailblaze","Feint Attack, Wild Charge, Trailblaze","585;586","586"
587,"Emolga","Emolga",FALSE,399,124,,,"0/15/8","0/13/15",,,"12","41",,,497,1498,,,"Thunder Shock, Acrobatics, Discharge","Thunder Shock, Acrobatics, Discharge",,,"587","587"
588,"Karrablast","Karrablast",FALSE,328,762,,,"0/14/15","15/15/15",,,"16.5","50",,,499,1336,,,"Fury Cutter, X-Scissor, Drill Run","Fury Cutter, X-Scissor, Drill Run",,,"588;589","588;589"
589,"Escavalier","Karrablast",FALSE,479,234,108,137,"7/15/13","0/15/13","1/15/14","15/15/15","6.5","19.5","34.5","50",500,1499,2497,3266,"Counter, Drill Run, Megahorn","Counter, Drill Run, Megahorn","Counter, Megahorn, Drill Run","Counter, Drill Run, Megahorn","588;589","589"
590,"Foongus","Foongus",FALSE,171,,,,"1/15/14",,,,"20.5",,,,499,,,,"Astonish, Body Slam, Grass Knot",,,,"590;591","590;591"
590,"Foongus (Shadow)","Foongus",TRUE,239,,,,"1/15/14",,,,"20.5",,,,499,,,,"Astonish, Body Slam, Grass Knot",,,,"590;591","590;591"
591,"Amoonguss","Foongus",FALSE,910,368,334,525,"0/15/14","0/14/15","15/15/15","15/15/15","9","27","50","50",499,1500,2420,2420,"Astonish, Grass Knot, Sludge Bomb","Astonish, Grass Knot, Foul Play","Astonish, Grass Knot, Foul Play","Astonish, Grass Knot, Foul Play","590;591","591"
591,"Amoonguss (Shadow)","Foongus",TRUE,1018,435,348,530,"0/15/14","0/14/15","15/15/15","15/15/15","9","27","50","50",499,1500,2420,2420,"Astonish, Grass Knot, Sludge Bomb","Astonish, Grass Knot, Foul Play","Astonish, Grass Knot, Foul Play","Astonish, Grass Knot, Foul Play","590;591","591"
592,"Frillish","Frillish",FALSE,829,730,,,"0/10/15","15/15/15",,,"16","50",,,500,1421,,,"Bubble, Ice Beam, Ominous Wind","Bubble, Ice Beam, Ominous Wind",,,"592;593","592;593"
593,"Jellicent","Frillish",FALSE,75,39,26,290,"0/5/15","1/14/14","6/15/15","15/15/15","8.5","24.5","49.5","50",499,1490,2499,2644,"Hex, Surf, Shadow Ball","Hex, Surf, Shadow Ball","Hex, Surf, Shadow Ball","Bubble, Surf, Shadow Ball","592;593","593"
594,"Alomomola","Alomomola",FALSE,710,524,405,533,"0/15/15","0/15/11","15/15/15","15/15/15","9","27","50","50",500,1490,2452,2452,"Waterfall, Hydro Pump, Blizzard","Waterfall, Hydro Pump, Blizzard","Waterfall, Hydro Pump, Blizzard","Waterfall, Hydro Pump, Blizzard","594","594"
595,"Joltik","Joltik",FALSE,526,,,,"0/15/14",,,,"19.5",,,,500,,,,"Sucker Punch, Cross Poison, Discharge",,,,"595;596","595;596"
595,"Joltik (Shadow)","Joltik",TRUE,436,,,,"0/15/14",,,,"19.5",,,,500,,,,"Sucker Punch, Cross Poison, Discharge",,,,"595;596","595;596"
596,"Galvantula","Joltik",FALSE,637,219,160,,"3/15/14","0/15/15","15/15/15",,"8.5","25.5","50",,498,1499,2494,,"Volt Switch, Discharge, Lunge","Volt Switch, Discharge, Lunge","Volt Switch, Discharge, Lunge",,"595;596","596"
596,"Galvantula (Shadow)","Joltik",TRUE,778,231,145,,"3/15/14","0/15/15","15/15/15",,"8.5","25.5","50",,498,1499,2494,,"Volt Switch, Discharge, Lunge","Volt Switch, Discharge, Lunge","Volt Switch, Discharge, Lunge",,"595;596","596"
597,"Ferroseed","Ferroseed",FALSE,396,921,,,"1/15/12","15/15/15",,,"22","50",,,496,1064,,,"Tackle, Iron Head, Flash Cannon","Tackle, Iron Head, Return",,,"597;598","597;598"
597,"Ferroseed (Shadow)","Ferroseed",TRUE,528,935,,,"1/15/12","15/15/15",,,"22","50",,,496,1064,,,"Tackle, Iron Head, Flash Cannon","Tackle, Iron Head, Flash Cannon",,,"597;598","597;598"
598,"Ferrothorn","Ferroseed",FALSE,407,112,126,430,"0/10/12","0/13/13","7/14/15","15/15/15","8.5","25","50","50",497,1498,2495,2624,"Bullet Seed, Power Whip, Thunder","Bullet Seed, Power Whip, Thunder","Bullet Seed, Power Whip, Flash Cannon","Bullet Seed, Power Whip, Mirror Shot","597;598","598"
598,"Ferrothorn (Shadow)","Ferroseed",TRUE,490,146,130,460,"0/10/12","0/13/13","7/14/15","15/15/15","8.5","25","50","50",497,1498,2495,2624,"Bullet Seed, Power Whip, Thunder","Bullet Seed, Power Whip, Thunder","Bullet Seed, Power Whip, Flash Cannon","Bullet Seed, Power Whip, Mirror Shot","597;598","598"
599,"Klink","Klink",FALSE,591,,,,"1/15/14",,,,"21",,,,499,,,,"Volt Switch, Discharge, Vise Grip",,,,"599;600;601","599;600;601"
600,"Klang","Klink",FALSE,873,641,686,,"0/13/14","0/15/14","15/15/14",,"10.5","32.5","50",,499,1494,2088,,"Thunder Shock, Thunderbolt, Vise Grip","Thunder Shock, Thunderbolt, Vise Grip","Thunder Shock, Thunderbolt, Vise Grip",,"599;600;601","600;601"
601,"Klinklang","Klink",FALSE,995,602,415,454,"0/11/8","0/13/15","0/12/15","15/15/14","7.5","21.5","42","50",498,1494,2488,2981,"Thunder Shock, Mirror Shot, Zap Cannon","Thunder Shock, Mirror Shot, Zap Cannon","Thunder Shock, Mirror Shot, Zap Cannon","Thunder Shock, Mirror Shot, Zap Cannon","599;600;601","601"
602,"Tynamo","Tynamo",FALSE,1142,,,,"0/15/15",,,,"24.5",,,,498,,,,"Spark, Struggle, NA",,,,"602;603;604","602;603;604"
603,"Eelektrik","Tynamo",FALSE,822,617,,,"0/8/14","0/13/15",,,"11.5","37.5",,,500,1498,,,"Spark, Crunch, Discharge","Spark, Crunch, Discharge",,,"602;603;604","603;604"
604,"Eelektross","Tynamo",FALSE,406,485,353,473,"1/15/14","1/15/14","2/15/14","15/15/14","7","20.5","38","50",498,1500,2499,3089,"Spark, Dragon Claw, Thunderbolt","Spark, Dragon Claw, Thunderbolt","Spark, Dragon Claw, Thunderbolt","Spark, Dragon Claw, Liquidation","602;603;604","604"
605,"Elgyem","Elgyem",FALSE,1009,894,,,"0/14/15","8/15/15",,,"14","50",,,499,1500,,,"Confusion, Dark Pulse, Psychic","Confusion, Dark Pulse, Psychic",,,"605;606","605;606"
606,"Beheeyem","Elgyem",FALSE,1035,848,620,495,"0/14/14","0/14/13","1/15/15","15/15/15","7","20.5","37.5","50",500,1491,2497,3112,"Confusion, Rock Slide, Dark Pulse","Confusion, Rock Slide, Dark Pulse","Confusion, Rock Slide, Dark Pulse","Confusion, Rock Slide, Dark Pulse","605;606","606"
607,"Litwick","Litwick",FALSE,420,,,,"0/15/12",,,,"20",,,,497,,,,"Astonish, Flame Charge, Mystical Fire",,,,"607;608;609","607;608;609"
607,"Litwick (Shadow)","Litwick",TRUE,426,,,,"0/15/12",,,,"20",,,,497,,,,"Astonish, Mystical Fire, Flame Charge",,,,"607;608;609","607;608;609"
608,"Lampent","Litwick",FALSE,789,862,,,"2/15/15","0/15/14",,,"11","37",,,499,1497,,,"Ember, Energy Ball, Flame Burst","Ember, Energy Ball, Flame Burst",,,"607;608;609","608;609"
608,"Lampent (Shadow)","Litwick",TRUE,562,808,,,"2/15/15","0/15/14",,,"11","37",,,499,1497,,,"Ember, Energy Ball, Flame Burst","Ember, Energy Ball, Flame Burst",,,"607;608;609","608;609"
609,"Chandelure","Litwick",FALSE,616,468,575,179,"1/15/7","0/15/14","0/15/12","15/15/14","6","17","28.5","50",499,1498,2490,3695,"Incinerate, Flame Charge, Shadow Ball","Incinerate, Shadow Ball, Flame Charge","Fire Spin, Shadow Ball, Flame Charge","Incinerate, Shadow Ball, Flame Charge","607;608;609","609"
609,"Chandelure (Shadow)","Litwick",TRUE,584,455,337,175,"1/15/7","0/15/14","0/15/12","15/15/14","6","17","28.5","50",499,1498,2490,3695,"Incinerate, Flame Charge, Shadow Ball","Incinerate, Shadow Ball, Flame Charge","Incinerate, Shadow Ball, Flame Charge","Incinerate, Shadow Ball, Flame Charge","607;608;609","609"
610,"Axew","Axew",FALSE,1013,922,,,"0/15/15","10/15/14",,,"14","50",,,500,1498,,,"Scratch, Dragon Claw, Aqua Tail","Scratch, Dragon Claw, Aqua Tail",,,"610;611;612","610;611;612"
611,"Fraxure","Axew",FALSE,346,209,257,,"0/15/14","1/15/15","12/15/15",,"8.5","25","50",,498,1499,2497,,"Dragon Tail, Dragon Claw, Aqua Tail","Dragon Tail, Dragon Claw, Aqua Tail","Dragon Tail, Dragon Claw, Aqua Tail",,"610;611;612","611;612"
612,"Haxorus","Axew",FALSE,286,334,359,108,"0/8/14","0/14/13","1/15/15","15/15/15","5.5","15.5","25.5","50",498,1496,2500,4062,"Counter, Breaking Swipe, Surf","Counter, Breaking Swipe, Surf","Counter, Breaking Swipe, Night Slash","Counter, Breaking Swipe, Night Slash","610;611;612","612"
613,"Cubchoo","Cubchoo",FALSE,560,,,,"0/15/11",,,,"18.5",,,,500,,,,"Powder Snow, Icy Wind, Ice Punch",,,,"613;614","613;614"
614,"Beartic","Cubchoo",FALSE,612,525,495,165,"0/11/8","0/15/12","0/15/13","15/15/15","6.5","18.5","31.5","50",499,1491,2484,3439,"Powder Snow, Ice Punch, Surf","Powder Snow, Ice Punch, Surf","Powder Snow, Ice Punch, Surf","Powder Snow, Ice Punch, Surf","613;614","614"
615,"Cryogonal","Cryogonal",FALSE,577,416,327,191,"0/11/14","0/14/11","0/15/15","15/15/15","7","20.5","37.5","50",500,1497,2500,3163,"Ice Shard, Triple Axel, Night Slash","Ice Shard, Triple Axel, Night Slash","Ice Shard, Night Slash, Triple Axel","Ice Shard, Triple Axel, Night Slash","615","615"
616,"Shelmet","Shelmet",FALSE,43,,,,"0/15/13",,,,"25.5",,,,496,,,,"Infestation, Body Slam, Bug Buzz",,,,"616;617","616;617"
617,"Accelgor","Shelmet",FALSE,1154,897,652,587,"0/14/5","0/14/15","0/15/13","15/15/15","8","23","47.5","50",493,1498,2488,2760,"Water Shuriken, Bug Buzz, Acid Spray","Water Shuriken, Bug Buzz, Acid Spray","Water Shuriken, Bug Buzz, Signal Beam","Water Shuriken, Bug Buzz, Signal Beam","616;617","617"
618,"Stunfisk","Stunfisk",FALSE,67,89,86,395,"1/14/13","0/12/15","15/15/15","15/15/15","9","27","50","50",500,1497,2445,2445,"Thunder Shock, Mud Bomb, Discharge","Thunder Shock, Mud Bomb, Discharge","Mud Shot, Mud Bomb, Discharge","Mud Shot, Mud Bomb, Discharge","618","618"
618,"Stunfisk (Galarian)","Stunfisk",FALSE,29,24,48,385,"1/14/13","0/12/15","15/15/15","15/15/15","9","27","50","50",500,1497,2445,2445,"Mud Shot, Rock Slide, Earthquake","Mud Shot, Rock Slide, Earthquake","Mud Shot, Rock Slide, Earthquake","Mud Shot, Rock Slide, Earthquake","618","618"
619,"Mienfoo","Mienfoo",FALSE,1177,958,,,"3/15/15","7/15/15",,,"13.5","50",,,499,1500,,,"Low Kick, Brick Break, Focus Blast","Low Kick, Brick Break, Focus Blast",,,"619;620","619;620"
620,"Mienshao","Mienfoo",FALSE,1085,778,644,483,"0/15/15","0/15/14","0/14/15","15/15/15","7","20.5","38.5","50",499,1486,2490,3064,"Poison Jab, Brick Break, Grass Knot","Poison Jab, Brick Break, Grass Knot","Poison Jab, Blaze Kick, Stone Edge","Poison Jab, Blaze Kick, Brick Break","619;620","620"
621,"Druddigon","Druddigon",FALSE,168,189,185,279,"1/15/14","0/15/15","0/15/15","15/15/15","7","20.5","38.5","50",500,1498,2500,3088,"Dragon Tail, Dragon Claw, Night Slash","Dragon Tail, Dragon Claw, Night Slash","Dragon Tail, Dragon Claw, Night Slash","Dragon Tail, Dragon Claw, Night Slash","621","621"
622,"Golett","Golett",FALSE,134,572,,,"0/14/15","15/15/15",,,"16.5","50",,,499,1344,,,"Mud Slap, Shadow Punch, Brick Break","Mud Slap, Shadow Punch, Brick Break",,,"622;623","622;623"
622,"Golett (Shadow)","Golett",TRUE,118,527,,,"0/14/15","15/15/15",,,"16.5","50",,,499,1344,,,"Mud Slap, Shadow Punch, Brick Break","Mud Slap, Shadow Punch, Brick Break",,,"622;623","622;623"
623,"Golurk","Golett",FALSE,419,453,419,280,"0/3/13","2/15/14","0/13/14","15/15/14","7","19.5","36","50",500,1500,2496,3226,"Mud Slap, Shadow Punch, Earth Power","Mud Slap, Shadow Punch, Earth Power","Mud Slap, Shadow Punch, Earth Power","Mud Slap, Shadow Punch, Earth Power","622;623","623"
623,"Golurk (Shadow)","Golett",TRUE,379,418,342,240,"0/3/13","2/15/14","0/13/14","15/15/14","7","19.5","36","50",500,1500,2496,3226,"Mud Slap, Shadow Punch, Earth Power","Mud Slap, Shadow Punch, Earth Power","Mud Slap, Shadow Punch, Dynamic Punch","Mud Slap, Shadow Punch, Dynamic Punch","622;623","623"
624,"Pawniard","Pawniard",FALSE,103,536,,,"0/15/13","2/15/15",,,"13.5","50",,,500,1492,,,"Fury Cutter, Night Slash, Iron Head","Fury Cutter, Night Slash, X-Scissor",,,"624;625;983","624;625;983"
625,"Bisharp","Pawniard",FALSE,552,600,456,275,"0/6/9","1/15/15","0/15/15","15/15/15","7","19.5","35.5","50",496,1497,2494,3215,"Snarl, Dark Pulse, X-Scissor","Snarl, Dark Pulse, X-Scissor","Snarl, Dark Pulse, Iron Head","Snarl, Dark Pulse, X-Scissor","624;625;983","625;983"
626,"Bouffalant","Bouffalant",FALSE,523,591,406,332,"0/13/11","0/13/11","0/14/15","15/15/15","7","20.5","37.5","50",498,1496,2495,3163,"Mud Shot, Stomp, Megahorn","Mud Shot, Stomp, Megahorn","Mud Shot, Stomp, Megahorn","Mud Shot, Stomp, Megahorn","626","626"
627,"Rufflet","Rufflet",FALSE,427,123,,,"0/15/13","0/15/15",,,"13","48",,,499,1492,,,"Wing Attack, Brave Bird, Fly","Wing Attack, Brave Bird, Fly",,,"627;628","627;628"
628,"Braviary","Rufflet",FALSE,948,436,293,278,"0/6/8","1/15/15","0/14/15","15/15/15","6.5","18","30.5","50",499,1497,2500,3491,"Steel Wing, Fly, Close Combat","Steel Wing, Fly, Close Combat","Steel Wing, Fly, Close Combat","Steel Wing, Brave Bird, Close Combat","627;628","628"
628,"Braviary (Hisuian)","Rufflet",FALSE,,,499,466,,,"0/14/13","15/15/14",,,"37","50",,,2495,3181,,,"Air Slash, Brave Bird, Fly","Air Slash, Brave Bird, Fly","627;628","628"
629,"Vullaby","Vullaby",FALSE,412,269,,,"0/11/14","15/15/15",,,"16","50",,,498,1437,,,"Feint Attack, Brave Bird, Foul Play","Feint Attack, Brave Bird, Foul Play",,,"629;630","629;630"
630,"Mandibuzz","Vullaby",FALSE,13,11,14,330,"3/15/14","0/13/15","15/15/14","15/15/14","9","27.5","50","50",499,1497,2417,2417,"Snarl, Dark Pulse, Aerial Ace","Snarl, Dark Pulse, Aerial Ace","Snarl, Dark Pulse, Aerial Ace","Snarl, Aerial Ace, Foul Play","629;630","630"
631,"Heatmor","Heatmor",FALSE,570,586,438,535,"0/15/13","0/15/14","1/15/14","15/15/14","8","23.5","49","50",499,1489,2490,2708,"Fire Spin, Flamethrower, Thunder Punch","Fire Spin, Flamethrower, Thunder Punch","Fire Spin, Thunder Punch, Flamethrower","Fire Spin, Flamethrower, Thunder Punch","631","631"
632,"Durant","Durant",FALSE,758,635,447,375,"0/15/1","1/15/14","0/12/15","15/15/15","7.5","21","41","50",500,1499,2494,3007,"Bug Bite, X-Scissor, Stone Edge","Bug Bite, X-Scissor, Stone Edge","Bug Bite, X-Scissor, Stone Edge","Bug Bite, X-Scissor, Stone Edge","632","632"
