"ID","Pokemon","Family","Shadow","Little_Rank","Great_Rank","Ultra_Rank","Master_Rank","Little_IVs","Great_IVs","Ultra_IVs","Master_IVs","Little_Level","Great_Level","Ultra_Level","Master_Level","Little_CP","Great_CP","Ultra_CP","Master_CP","Little_MoveSet","Great_MoveSet","Ultra_MoveSet","Master_MoveSet","Evo_Fam","Evo_Next"
392,"Infernape","Chimchar",FALSE,906,630,428,405,"4/15/15","0/13/15","1/15/14","15/15/15","7","21","39.5","50",500,1491,2500,3033,"Fire Spin, Close Combat, Blast Burn","Fire Spin, Close Combat, Blast Burn","Fire Spin, Close Combat, Blast Burn","Fire Spin, Close Combat, Blast Burn","390;391;392","392"
392,"Infernape (Shadow)","Chimchar",TRUE,870,690,505,416,"4/15/15","0/13/15","1/15/14","15/15/15","7","21","39.5","50",500,1491,2500,3033,"Fire Spin, Close Combat, Blast Burn","Fire Spin, Close Combat, Blast Burn","Fire Spin, Close Combat, Blast Burn","Fire Spin, Close Combat, Blast Burn","390;391;392","392"
393,"Piplup","Piplup",FALSE,385,877,,,"0/14/15","15/15/14",,,"18.5","50",,,500,1215,,,"Bubble, Drill Peck, Icy Wind","Bubble, Drill Peck, Icy Wind",,,"393;394;395","393;394;395"
393,"Piplup (Shadow)","Piplup",TRUE,460,865,,,"0/14/15","15/15/14",,,"18.5","50",,,500,1215,,,"Bubble, Drill Peck, Icy Wind","Bubble, Drill Peck, Icy Wind",,,"393;394;395","393;394;395"
394,"Prinplup","Piplup",FALSE,1048,503,,,"0/14/11","0/15/14",,,"11.5","38",,,500,1500,,,"Bubble, Icy Wind, Hydro Pump","Bubble, Icy Wind, Hydro Pump",,,"393;394;395","394;395"
394,"Prinplup (Shadow)","Piplup",TRUE,1042,611,,,"0/14/11","0/15/14",,,"11.5","38",,,500,1500,,,"Bubble, Icy Wind, Hydro Pump","Bubble, Icy Wind, Hydro Pump",,,"393;394;395","394;395"
395,"Empoleon","Piplup",FALSE,63,20,29,133,"5/15/15","0/13/15","1/15/14","15/15/15","6.5","19.5","34.5","50",497,1500,2488,3279,"Steel Wing, Hydro Cannon, Drill Peck","Steel Wing, Hydro Cannon, Drill Peck","Steel Wing, Hydro Cannon, Drill Peck","Steel Wing, Hydro Cannon, Flash Cannon","393;394;395","395"
395,"Empoleon (Shadow)","Piplup",TRUE,59,16,12,111,"5/15/15","0/13/15","1/15/14","15/15/15","6.5","19.5","34.5","50",497,1500,2488,3279,"Steel Wing, Hydro Cannon, Drill Peck","Steel Wing, Hydro Cannon, Drill Peck","Steel Wing, Hydro Cannon, Drill Peck","Steel Wing, Hydro Cannon, Drill Peck","393;394;395","395"
396,"Starly","Starly",FALSE,474,,,,"0/14/12",,,,"28.5",,,,497,,,,"Quick Attack, Brave Bird, Fly",,,,"396;397;398","396;397;398"
396,"Starly (Shadow)","Starly",TRUE,686,,,,"0/14/12",,,,"28.5",,,,497,,,,"Quick Attack, Brave Bird, Fly",,,,"396;397;398","396;397;398"
397,"Staravia","Starly",FALSE,456,203,,,"0/15/13","15/15/15",,,"15","50",,,497,1468,,,"Wing Attack, Brave Bird, Fly","Wing Attack, Brave Bird, Fly",,,"396;397;398","397;398"
397,"Staravia (Shadow)","Starly",TRUE,623,204,,,"0/15/13","15/15/15",,,"15","50",,,497,1468,,,"Wing Attack, Brave Bird, Fly","Wing Attack, Brave Bird, Fly",,,"396;397;398","397;398"
398,"Staraptor","Starly",FALSE,665,202,121,301,"0/5/14","0/13/13","2/15/14","15/15/14","7","20","35.5","50",498,1492,2498,3194,"Wing Attack, Fly, Close Combat","Wing Attack, Fly, Close Combat","Wing Attack, Fly, Close Combat","Wing Attack, Brave Bird, Close Combat","396;397;398","398"
398,"Staraptor (Shadow)","Starly",TRUE,725,207,36,305,"0/5/14","0/13/13","2/15/14","15/15/14","7","20","35.5","50",498,1492,2498,3194,"Wing Attack, Fly, Close Combat","Wing Attack, Fly, Close Combat","Wing Attack, Fly, Close Combat","Wing Attack, Brave Bird, Close Combat","396;397;398","398"
399,"Bidoof","Bidoof",FALSE,446,,,,"0/15/13",,,,"29",,,,499,,,,"Tackle, Superpower, Crunch",,,,"399;400","399;400"
399,"Bidoof (Shadow)","Bidoof",TRUE,573,,,,"0/15/13",,,,"29",,,,499,,,,"Tackle, Superpower, Crunch",,,,"399;400","399;400"
400,"Bibarel","Bidoof",FALSE,590,473,642,,"0/15/13","0/14/13","15/15/15",,"10.5","33.5","50",,500,1499,2061,,"Water Gun, Surf, Hyper Fang","Water Gun, Surf, Hyper Fang","Water Gun, Surf, Hyper Fang",,"399;400","400"
400,"Bibarel (Shadow)","Bidoof",TRUE,558,462,648,,"0/15/13","0/14/13","15/15/15",,"10.5","33.5","50",,500,1499,2061,,"Water Gun, Surf, Hyper Fang","Water Gun, Surf, Hyper Fang","Water Gun, Surf, Hyper Fang",,"399;400","400"
401,"Kricketot","Kricketot",FALSE,1124,,,,"15/15/15",,,,"50",,,,453,,,,"Bug Bite, Struggle, NA",,,,"401;402","401;402"
402,"Kricketune","Kricketot",FALSE,357,532,,,"1/15/15","0/15/15",,,"11.5","39.5",,,499,1492,,,"Fury Cutter, X-Scissor, Aerial Ace","Fury Cutter, X-Scissor, Aerial Ace",,,"401;402","402"
403,"Shinx","Shinx",FALSE,958,,,,"0/15/15",,,,"22.5",,,,498,,,,"Spark, Discharge, Return",,,,"403;404;405","403;404;405"
403,"Shinx (Shadow)","Shinx",TRUE,907,,,,"0/15/15",,,,"22.5",,,,498,,,,"Spark, Discharge, Thunderbolt",,,,"403;404;405","403;404;405"
404,"Luxio","Shinx",FALSE,929,535,,,"0/14/14","0/15/15",,,"13","48",,,500,1500,,,"Spark, Wild Charge, Crunch","Spark, Wild Charge, Crunch",,,"403;404;405","404;405"
404,"Luxio (Shadow)","Shinx",TRUE,915,593,,,"0/14/14","0/15/15",,,"13","48",,,500,1500,,,"Spark, Wild Charge, Crunch","Spark, Wild Charge, Crunch",,,"403;404;405","404;405"
405,"Luxray","Shinx",FALSE,505,350,306,304,"6/15/13","0/15/12","0/15/15","15/15/15","6.5","19.5","34.5","50",499,1496,2498,3265,"Spark, Wild Charge, Psychic Fangs","Spark, Wild Charge, Psychic Fangs","Snarl, Wild Charge, Psychic Fangs","Snarl, Wild Charge, Psychic Fangs","403;404;405","405"
405,"Luxray (Shadow)","Shinx",TRUE,546,409,297,261,"6/15/13","0/15/12","0/15/15","15/15/15","6.5","19.5","34.5","50",499,1496,2498,3265,"Spark, Wild Charge, Psychic Fangs","Spark, Wild Charge, Psychic Fangs","Snarl, Wild Charge, Psychic Fangs","Snarl, Wild Charge, Psychic Fangs","403;404;405","405"
406,"Budew","Roselia",FALSE,158,,,,"0/15/13",,,,"24",,,,500,,,,"Razor Leaf, Grass Knot, Energy Ball",,,,"315;406;407",""
407,"Roserade","Roselia",FALSE,824,359,176,203,"0/12/15","0/11/14","0/12/15","15/15/14","6.5","19","33","50",500,1497,2491,3359,"Bullet Seed, Weather Ball (Fire), Leaf Storm","Bullet Seed, Weather Ball (Fire), Leaf Storm","Poison Jab, Weather Ball (Fire), Grass Knot","Poison Jab, Weather Ball (Fire), Leaf Storm","315;406;407","406;407"
408,"Cranidos","Cranidos",FALSE,1195,,,,"0/12/14",,,,"10.5",,,,499,,,,"Take Down, Ancient Power, Bulldoze",,,,"408;409","408;409"
408,"Cranidos (Shadow)","Cranidos",TRUE,1194,,,,"0/12/14",,,,"10.5",,,,499,,,,"Take Down, Ancient Power, Bulldoze",,,,"408;409","408;409"
409,"Rampardos","Cranidos",FALSE,896,858,664,443,"0/10/9","1/14/8","0/14/15","15/15/15","6","17","28","50",500,1498,2495,3728,"Smack Down, Rock Slide, Flamethrower","Smack Down, Rock Slide, Flamethrower","Smack Down, Rock Slide, Flamethrower","Smack Down, Rock Slide, Flamethrower","408;409","409"
409,"Rampardos (Shadow)","Cranidos",TRUE,815,765,631,378,"0/10/9","1/14/8","0/14/15","15/15/15","6","17","28","50",500,1498,2495,3728,"Smack Down, Rock Slide, Flamethrower","Smack Down, Rock Slide, Flamethrower","Smack Down, Rock Slide, Flamethrower","Smack Down, Rock Slide, Flamethrower","408;409","409"
410,"Shieldon","Shieldon",FALSE,532,,,,"0/11/13",,,,"24",,,,499,,,,"Tackle, Ancient Power, Heavy Slam",,,,"410;411","410;411"
410,"Shieldon (Shadow)","Shieldon",TRUE,615,,,,"0/11/13",,,,"24",,,,499,,,,"Tackle, Ancient Power, Heavy Slam",,,,"410;411","410;411"
411,"Bastiodon","Shieldon",FALSE,303,6,628,,"0/14/8","0/15/14","15/15/14",,"13.5","50","50",,499,1498,1741,,"Smack Down, Stone Edge, Flamethrower","Smack Down, Stone Edge, Flamethrower","Smack Down, Stone Edge, Flamethrower",,"410;411","411"
411,"Bastiodon (Shadow)","Shieldon",TRUE,205,15,640,,"0/14/8","0/15/14","15/15/14",,"13.5","50","50",,499,1498,1741,,"Smack Down, Stone Edge, Flamethrower","Smack Down, Stone Edge, Flamethrower","Smack Down, Stone Edge, Flamethrower",,"410;411","411"
412,"Burmy (Plant)","Burmy",FALSE,1036,,,,"9/15/15",,,,"49.5",,,,500,,,,"Bug Bite, Struggle, NA",,,,"412;413","412;413"
412,"Burmy (Sandy)","Burmy",FALSE,1037,,,,"9/15/15",,,,"49.5",,,,500,,,,"Bug Bite, Struggle, NA",,,,"412;413","412;413"
412,"Burmy (Trash)","Burmy",FALSE,1038,,,,"9/15/15",,,,"49.5",,,,500,,,,"Bug Bite, Struggle, NA",,,,"412;413","412;413"
413,"Wormadam (Plant)","Burmy",FALSE,1023,790,690,,"0/12/15","0/15/14","15/15/14",,"11","35.5","50",,500,1497,2005,,"Bug Bite, Energy Ball, Bug Buzz","Confusion, Energy Ball, Bug Buzz","Confusion, Energy Ball, Bug Buzz",,"412;413","413"
413,"Wormadam (Sandy)","Burmy",FALSE,1064,819,694,,"0/12/15","0/15/14","15/15/14",,"11","35.5","50",,500,1497,2005,,"Bug Bite, Bug Buzz, Bulldoze","Confusion, Bug Buzz, Bulldoze","Confusion, Bug Buzz, Bulldoze",,"412;413","413"
413,"Wormadam (Trash)","Burmy",FALSE,950,394,,,"0/12/15","0/10/0",,,"11","39.5",,,497,1500,,,"Confusion, Bug Buzz, Iron Head","Confusion, Bug Buzz, Iron Head",,,"412;413","413"
414,"Mothim","Mothim",FALSE,1057,868,,,"0/14/13","0/15/15",,,"10.5","32.5",,,498,1496,,,"Air Slash, Aerial Ace, Bug Buzz","Air Slash, Aerial Ace, Bug Buzz",,,"412;414","414"
415,"Combee","Combee",FALSE,938,,,,"7/15/15",,,,"50",,,,498,,,,"Bug Bite, Bug Buzz, NA",,,,"415;416","415;416"
416,"Vespiquen","Combee",FALSE,162,472,523,556,"3/15/13","0/14/13","15/15/15","15/15/15","9.5","29","50","50",500,1500,2267,2267,"Fury Cutter, X-Scissor, Power Gem","Fury Cutter, X-Scissor, Power Gem","Fury Cutter, X-Scissor, Power Gem","Fury Cutter, X-Scissor, Power Gem","415;416","416"
417,"Pachirisu","Pachirisu",FALSE,33,83,,,"0/10/14","15/15/14",,,"17","50",,,500,1372,,,"Volt Switch, Thunder Punch, Thunderbolt","Volt Switch, Thunder Punch, Thunderbolt",,,"417","417"
418,"Buizel","Buizel",FALSE,1072,,,,"0/15/15",,,,"18.5",,,,495,,,,"Quick Attack, Water Pulse, Aqua Jet",,,,"418;419","418;419"
419,"Floatzel","Buizel",FALSE,868,749,572,523,"0/15/2","0/15/13","0/14/15","15/15/14","8","23","47.5","50",500,1494,2488,2762,"Waterfall, Liquidation, Swift","Water Gun, Liquidation, Swift","Water Gun, Liquidation, Swift","Waterfall, Liquidation, Swift","418;419","419"
420,"Cherubi","Cherubi",FALSE,997,,,,"0/15/15",,,,"21",,,,499,,,,"Bullet Seed, Seed Bomb, Dazzling Gleam",,,,"420;421","420;421"
421,"Cherrim (Overcast)","Cherubi",FALSE,1185,932,693,,"0/11/13","0/13/15","15/15/15",,"9.5","28","50",,499,1498,2315,,"Bullet Seed, Solar Beam, Dazzling Gleam","Bullet Seed, Solar Beam, Dazzling Gleam","Bullet Seed, Solar Beam, Dazzling Gleam",,"420;421","421"
421,"Cherrim (Sunshine)","Cherubi",FALSE,886,469,515,,"0/11/13","0/13/15","15/15/15",,"9.5","28","50",,499,1498,2315,,"Bullet Seed, Weather Ball (Fire), Solar Beam","Bullet Seed, Weather Ball (Fire), Solar Beam","Bullet Seed, Weather Ball (Fire), Solar Beam",,"420;421","421"
422,"Shellos","Shellos",FALSE,201,800,,,"0/15/8","15/15/15",,,"18","50",,,497,1284,,,"Mud Slap, Body Slam, Mud Bomb","Mud Slap, Body Slam, Mud Bomb",,,"422;423","422;423"
423,"Gastrodon","Shellos",FALSE,127,157,118,325,"0/14/4","1/15/14","6/15/15","15/15/15","8.5","24.5","50","50",499,1497,2499,2628,"Mud Slap, Body Slam, Earth Power","Mud Slap, Body Slam, Earth Power","Mud Slap, Body Slam, Earth Power","Mud Slap, Body Slam, Earth Power","422;423","423"
424,"Ambipom","Aipom",FALSE,1017,889,609,576,"0/11/14","0/13/14","0/15/14","15/15/15","8","23.5","48.5","50",500,1496,2500,2733,"Astonish, Aerial Ace, Low Sweep","Astonish, Aerial Ace, Return","Astonish, Aerial Ace, Return","Astonish, Aerial Ace, Return","190;424","424"
424,"Ambipom (Shadow)","Aipom",TRUE,1030,861,629,547,"0/11/14","0/13/14","0/15/14","15/15/15","8","23.5","48.5","50",500,1496,2500,2733,"Astonish, Aerial Ace, Low Sweep","Astonish, Aerial Ace, Low Sweep","Astonish, Aerial Ace, Low Sweep","Astonish, Aerial Ace, Low Sweep","190;424","424"
425,"Drifloon","Drifloon",FALSE,320,568,,,"0/15/15","15/15/15",,,"16.5","50",,,500,1353,,,"Hex, Icy Wind, Shadow Ball","Hex, Icy Wind, Shadow Ball",,,"425;426","425;426"
425,"Drifloon (Shadow)","Drifloon",TRUE,351,531,,,"0/15/15","15/15/15",,,"16.5","50",,,500,1353,,,"Hex, Icy Wind, Shadow Ball","Hex, Icy Wind, Shadow Ball",,,"425;426","425;426"
426,"Drifblim","Drifloon",FALSE,404,340,205,364,"2/15/14","0/15/12","1/15/15","15/15/15","8","24","50","50",499,1498,2499,2693,"Hex, Icy Wind, Shadow Ball","Hex, Icy Wind, Shadow Ball","Hex, Shadow Ball, Icy Wind","Hex, Icy Wind, Shadow Ball","425;426","426"
426,"Drifblim (Shadow)","Drifloon",TRUE,448,264,197,367,"2/15/14","0/15/12","1/15/15","15/15/15","8","24","50","50",499,1498,2499,2693,"Hex, Icy Wind, Shadow Ball","Hex, Icy Wind, Shadow Ball","Hex, Shadow Ball, Icy Wind","Hex, Icy Wind, Shadow Ball","425;426","426"
427,"Buneary","Buneary",FALSE,466,711,,,"0/15/14","15/15/15",,,"15.5","50",,,498,1423,,,"Quick Attack, Fire Punch, Swift","Quick Attack, Swift, Fire Punch",,,"427;428","427;428"
428,"Lopunny","Buneary",FALSE,818,413,494,500,"0/14/10","0/15/14","15/15/15","15/15/15","9.5","28","50","50",494,1493,2328,2328,"Double Kick, Triple Axel, Focus Blast","Double Kick, Triple Axel, Focus Blast","Double Kick, Triple Axel, Fire Punch","Double Kick, Triple Axel, Fire Punch","427;428","428"
429,"Mismagius","Misdreavus",FALSE,1155,784,530,488,"0/13/8","0/15/15","0/14/15","15/15/14","7.5","21.5","42","50",499,1499,2489,2957,"Hex, Shadow Ball, Dark Pulse","Hex, Shadow Ball, Dark Pulse","Hex, Shadow Ball, Dark Pulse","Hex, Shadow Ball, Dark Pulse","200;429","429"
429,"Mismagius (Shadow)","Misdreavus",TRUE,1152,873,532,489,"0/13/8","0/15/15","0/14/15","15/15/14","7.5","21.5","42","50",499,1499,2489,2957,"Hex, Shadow Ball, Dark Pulse","Hex, Shadow Ball, Dark Pulse","Hex, Shadow Ball, Dark Pulse","Hex, Shadow Ball, Dark Pulse","200;429","429"
430,"Honchkrow","Murkrow",FALSE,1046,655,387,359,"2/15/13","0/15/15","0/15/15","15/15/15","7","20.5","38.5","50",500,1500,2499,3065,"Snarl, Brave Bird, Dark Pulse","Snarl, Brave Bird, Dark Pulse","Snarl, Brave Bird, Dark Pulse","Snarl, Brave Bird, Dark Pulse","198;430","430"
430,"Honchkrow (Shadow)","Murkrow",TRUE,1114,707,392,347,"2/15/13","0/15/15","0/15/15","15/15/15","7","20.5","38.5","50",500,1500,2499,3065,"Snarl, Brave Bird, Dark Pulse","Snarl, Brave Bird, Dark Pulse","Snarl, Brave Bird, Dark Pulse","Snarl, Brave Bird, Dark Pulse","198;430","430"
431,"Glameow","Glameow",FALSE,317,,,,"0/14/14",,,,"21.5",,,,497,,,,"Quick Attack, Aerial Ace, Thunderbolt",,,,"431;432","431;432"
431,"Glameow (Shadow)","Glameow",TRUE,388,,,,"0/14/14",,,,"21.5",,,,497,,,,"Quick Attack, Aerial Ace, Thunderbolt",,,,"431;432","431;432"
432,"Purugly","Glameow",FALSE,514,441,583,,"0/9/13","0/12/15","15/15/15",,"10","29.5","50",,499,1489,2208,,"Shadow Claw, Aerial Ace, Thunder","Shadow Claw, Aerial Ace, Thunder","Shadow Claw, Aerial Ace, Thunder",,"431;432","432"
432,"Purugly (Shadow)","Glameow",TRUE,472,397,533,,"0/9/13","0/12/15","15/15/15",,"10","29.5","50",,499,1489,2208,,"Shadow Claw, Aerial Ace, Thunder","Shadow Claw, Aerial Ace, Thunder","Shadow Claw, Aerial Ace, Thunder",,"431;432","432"
433,"Chingling","Chimecho",FALSE,1121,,,,"0/15/11",,,,"20",,,,500,,,,"Astonish, Psyshock, Shadow Ball",,,,"358;433",""
434,"Stunky","Stunky",FALSE,315,857,,,"0/11/14","15/15/15",,,"17.5","50",,,500,1301,,,"Bite, Crunch, Sludge Bomb","Bite, Crunch, Sludge Bomb",,,"434;435","434;435"
434,"Stunky (Shadow)","Stunky",TRUE,99,801,,,"0/11/14","15/15/15",,,"17.5","50",,,500,1301,,,"Bite, Crunch, Sludge Bomb","Bite, Crunch, Sludge Bomb",,,"434;435","434;435"
435,"Skuntank","Stunky",FALSE,422,254,120,428,"4/15/13","0/15/15","3/15/14","15/15/14","8","24","50","50",499,1490,2490,2666,"Poison Jab, Crunch, Trailblaze","Poison Jab, Crunch, Trailblaze","Poison Jab, Crunch, Trailblaze","Poison Jab, Crunch, Sludge Bomb","434;435","435"
435,"Skuntank (Shadow)","Stunky",TRUE,429,250,79,384,"4/15/13","0/15/15","3/15/14","15/15/14","8","24","50","50",499,1490,2490,2666,"Poison Jab, Crunch, Trailblaze","Poison Jab, Crunch, Trailblaze","Poison Jab, Crunch, Trailblaze","Poison Jab, Crunch, Sludge Bomb","434;435","435"
436,"Bronzor","Bronzor",FALSE,5,,,,"2/15/15",,,,"45",,,,498,,,,"Tackle, Heavy Slam, Payback",,,,"436;437","436;437"
437,"Bronzong","Bronzor",FALSE,711,339,263,507,"3/15/14","1/15/14","13/15/14","15/15/14","8.5","25.5","50","50",498,1498,2488,2531,"Confusion, Psyshock, Payback","Confusion, Psyshock, Payback","Confusion, Psyshock, Payback","Confusion, Psyshock, Payback","436;437","437"
438,"Bonsly","Sudowoodo",FALSE,548,467,,,"1/15/14","15/15/15",,,"15","50",,,500,1472,,,"Counter, Rock Slide, Earthquake","Counter, Rock Slide, Earthquake",,,"185;438",""
439,"Mime (Jr)","Mr-mime",FALSE,957,,,,"0/15/14",,,,"18",,,,499,,,,"Confusion, Psyshock, Psychic",,,,"122;439;866",""
440,"Happiny","Chansey",FALSE,1147,,,,"15/15/15",,,,"50",,,,419,,,,"Zen Headbutt, Psychic, NA",,,,"113;242;440",""
441,"Chatot","Chatot",FALSE,1126,887,,,"1/15/14","0/15/14",,,"10.5","33.5",,,499,1500,,,"Steel Wing, Sky Attack, Night Shade","Steel Wing, Sky Attack, Night Shade",,,"441","441"
442,"Spiritomb","Spiritomb",FALSE,881,609,541,551,"0/11/9","0/15/15","15/15/15","15/15/15","9.5","27.5","50","50",496,1498,2343,2343,"Sucker Punch, Shadow Ball, Shadow Sneak","Sucker Punch, Shadow Ball, Shadow Sneak","Sucker Punch, Shadow Ball, Shadow Sneak","Sucker Punch, Shadow Ball, Shadow Sneak","442","442"
443,"Gible","Gible",FALSE,151,,,,"0/11/15",,,,"18",,,,495,,,,"Mud Shot, Body Slam, Dig",,,,"443;444;445","443;444;445"
443,"Gible (Shadow)","Gible",TRUE,116,,,,"0/11/15",,,,"18",,,,495,,,,"Mud Shot, Body Slam, Dig",,,,"443;444;445","443;444;445"
444,"Gabite","Gible",FALSE,891,605,667,,"3/15/14","0/15/14","15/15/15",,"10","31","50",,499,1497,2119,,"Mud Shot, Dig, Flamethrower","Mud Shot, Dig, Flamethrower","Mud Shot, Dig, Flamethrower",,"443;444;445","444;445"
444,"Gabite (Shadow)","Gible",TRUE,993,632,668,,"3/15/14","0/15/14","15/15/15",,"10","31","50",,499,1497,2119,,"Mud Shot, Dig, Flamethrower","Mud Shot, Dig, Flamethrower","Mud Shot, Dig, Flamethrower",,"443;444;445","444;445"
445,"Garchomp","Gible",FALSE,600,636,473,42,"0/13/13","0/15/14","0/14/13","15/15/15","5","14","23.5","50",499,1495,2496,4479,"Dragon Tail, Sand Tomb, Outrage","Dragon Tail, Sand Tomb, Outrage","Dragon Tail, Sand Tomb, Outrage","Mud Shot, Outrage, Earth Power","443;444;445","445"
445,"Garchomp (Shadow)","Gible",TRUE,496,571,465,77,"0/13/13","0/15/14","0/14/13","15/15/15","5","14","23.5","50",499,1495,2496,4479,"Dragon Tail, Sand Tomb, Outrage","Dragon Tail, Sand Tomb, Outrage","Dragon Tail, Sand Tomb, Outrage","Dragon Tail, Outrage, Sand Tomb","443;444;445","445"
446,"Munchlax","Snorlax",FALSE,117,141,568,574,"0/11/10","0/14/13","15/15/14","15/15/14","10.5","32","50","50",500,1499,2139,2139,"Tackle, Body Slam, Bulldoze","Tackle, Body Slam, Bulldoze","Tackle, Body Slam, Bulldoze","Tackle, Body Slam, Bulldoze","143;446",""
447,"Riolu","Riolu",FALSE,26,,,,"0/13/14",,,,"20",,,,497,,,,"Counter, Cross Chop, Blaze Kick",,,,"447;448","447;448"
448,"Lucario","Riolu",FALSE,98,240,180,241,"2/15/15","1/15/15","1/15/15","15/15/15","7","20.5","38.5","50",498,1494,2496,3056,"Counter, Blaze Kick, Shadow Ball","Counter, Blaze Kick, Shadow Ball","Counter, Blaze Kick, Shadow Ball","Counter, Power-Up Punch, Shadow Ball","447;448","448"
449,"Hippopotas","Hippopotas",FALSE,42,187,,,"0/15/14","13/15/14",,,"14.5","49.5",,,499,1498,,,"Sand Attack, Body Slam, Dig","Sand Attack, Body Slam, Dig",,,"449;450","449;450"
449,"Hippopotas (Shadow)","Hippopotas",TRUE,32,132,,,"0/15/14","13/15/14",,,"14.5","49.5",,,499,1498,,,"Sand Attack, Body Slam, Dig","Sand Attack, Body Slam, Dig",,,"449;450","449;450"
450,"Hippowdon","Hippopotas",FALSE,65,167,92,82,"0/2/15","0/14/10","0/14/15","15/15/15","6.5","18.5","31","50",500,1494,2500,3488,"Sand Attack, Weather Ball (Rock), Scorching Sands","Sand Attack, Weather Ball (Rock), Scorching Sands","Sand Attack, Weather Ball (Rock), Scorching Sands","Sand Attack, Weather Ball (Rock), Earth Power","449;450","450"
450,"Hippowdon (Shadow)","Hippopotas",TRUE,53,101,71,74,"0/2/15","0/14/10","0/14/15","15/15/15","6.5","18.5","31","50",500,1494,2500,3488,"Sand Attack, Weather Ball (Rock), Scorching Sands","Sand Attack, Weather Ball (Rock), Scorching Sands","Sand Attack, Weather Ball (Rock), Scorching Sands","Sand Attack, Weather Ball (Rock), Earth Power","449;450","450"
451,"Skorupi","Skorupi",FALSE,40,847,,,"1/15/14","15/15/15",,,"20","50",,,499,1141,,,"Poison Sting, Cross Poison, Aqua Tail","Poison Sting, Aqua Tail, Cross Poison",,,"451;452","451;452"
451,"Skorupi (Shadow)","Skorupi",TRUE,28,844,,,"1/15/14","15/15/15",,,"20","50",,,499,1141,,,"Poison Sting, Cross Poison, Aqua Tail","Poison Sting, Aqua Tail, Cross Poison",,,"451;452","451;452"
452,"Drapion","Skorupi",FALSE,22,179,110,349,"0/10/12","2/15/14","0/15/15","15/15/15","8","23","48","50",500,1499,2499,2773,"Poison Sting, Crunch, Aqua Tail","Poison Sting, Crunch, Aqua Tail","Poison Sting, Crunch, Aqua Tail","Poison Sting, Aqua Tail, Crunch","451;452","452"
452,"Drapion (Shadow)","Skorupi",TRUE,45,126,81,324,"0/10/12","2/15/14","0/15/15","15/15/15","8","23","48","50",500,1499,2499,2773,"Poison Sting, Crunch, Aqua Tail","Poison Sting, Crunch, Aqua Tail","Poison Sting, Crunch, Aqua Tail","Poison Sting, Aqua Tail, Crunch","451;452","452"
453,"Croagunk","Croagunk",FALSE,270,,,,"0/13/15",,,,"21",,,,499,,,,"Poison Jab, Sludge Bomb, Brick Break",,,,"453;454","453;454"
453,"Croagunk (Shadow)","Croagunk",TRUE,345,,,,"0/13/15",,,,"21",,,,499,,,,"Poison Jab, Sludge Bomb, Brick Break",,,,"453;454","453;454"
454,"Toxicroak","Croagunk",FALSE,141,151,103,312,"5/15/15","1/15/15","0/15/12","15/15/15","7.5","22.5","46.5","50",496,1498,2499,2813,"Counter, Mud Bomb, Shadow Ball","Counter, Mud Bomb, Shadow Ball","Counter, Mud Bomb, Shadow Ball","Counter, Dynamic Punch, Mud Bomb","453;454","454"
454,"Toxicroak (Shadow)","Croagunk",TRUE,119,118,60,306,"5/15/15","1/15/15","0/15/12","15/15/15","7.5","22.5","46.5","50",496,1498,2499,2813,"Counter, Mud Bomb, Shadow Ball","Counter, Mud Bomb, Shadow Ball","Counter, Mud Bomb, Shadow Ball","Counter, Dynamic Punch, Mud Bomb","453;454","454"
455,"Carnivine","Carnivine",FALSE,811,424,420,531,"0/13/9","0/14/13","15/15/15","15/15/15","9","26.5","50","50",500,1498,2441,2441,"Vine Whip, Crunch, Power Whip","Vine Whip, Power Whip, Crunch","Vine Whip, Crunch, Power Whip","Vine Whip, Crunch, Power Whip","455","455"
456,"Finneon","Finneon",FALSE,762,,,,"0/14/14",,,,"21",,,,499,,,,"Water Gun, Water Pulse, Ice Beam",,,,"456;457","456;457"
457,"Lumineon","Finneon",FALSE,728,528,645,,"2/15/15","0/15/12","15/15/15",,"10.5","34.5","50",,500,1497,2050,,"Water Gun, Water Pulse, Silver Wind","Water Gun, Water Pulse, Silver Wind","Water Gun, Water Pulse, Silver Wind",,"456;457","457"
458,"Mantyke","Mantine",FALSE,190,262,,,"0/15/15","15/15/15",,,"16","50",,,500,1411,,,"Bubble, Aerial Ace, Water Pulse","Bubble, Aerial Ace, Water Pulse",,,"226;458",""
459,"Snover","Snover",FALSE,874,740,,,"1/14/14","15/15/14",,,"17","50",,,496,1311,,,"Powder Snow, Ice Beam, Energy Ball","Powder Snow, Ice Beam, Energy Ball",,,"459;460","459;460"
459,"Snover (Shadow)","Snover",TRUE,959,802,,,"1/14/14","15/15/14",,,"17","50",,,496,1311,,,"Powder Snow, Ice Beam, Energy Ball","Powder Snow, Ice Beam, Energy Ball",,,"459;460","459;460"
460,"Abomasnow","Snover",FALSE,433,113,75,259,"3/15/15","0/15/15","3/15/14","15/15/15","8","24","50","50",500,1491,2495,2670,"Powder Snow, Icy Wind, Energy Ball","Powder Snow, Icy Wind, Energy Ball","Powder Snow, Icy Wind, Energy Ball","Powder Snow, Weather Ball (Ice), Energy Ball","459;460","460"
460,"Abomasnow (Shadow)","Snover",TRUE,186,41,70,231,"3/15/15","0/15/15","3/15/14","15/15/15","8","24","50","50",500,1491,2495,2670,"Powder Snow, Weather Ball (Ice), Energy Ball","Powder Snow, Weather Ball (Ice), Energy Ball","Powder Snow, Icy Wind, Energy Ball","Powder Snow, Weather Ball (Ice), Energy Ball","459;460","460"
461,"Weavile","Sneasel",FALSE,1055,653,436,151,"0/13/10","0/15/15","0/14/15","15/15/15","6.5","18.5","32","50",500,1500,2499,3397,"Snarl, Avalanche, Foul Play","Snarl, Avalanche, Foul Play","Snarl, Avalanche, Foul Play","Snarl, Avalanche, Focus Blast","215;461","461"
461,"Weavile (Shadow)","Sneasel",TRUE,1097,650,430,152,"0/13/10","0/15/15","0/14/15","15/15/15","6.5","18.5","32","50",500,1500,2499,3397,"Snarl, Avalanche, Foul Play","Snarl, Avalanche, Foul Play","Snarl, Avalanche, Foul Play","Snarl, Avalanche, Focus Blast","215;461","461"
462,"Magnezone","Magnemite",FALSE,437,93,181,160,"1/15/15","0/13/15","0/15/15","15/15/15","6","17.5","29","50",498,1496,2497,3623,"Volt Switch, Wild Charge, Mirror Shot","Volt Switch, Wild Charge, Mirror Shot","Volt Switch, Wild Charge, Mirror Shot","Volt Switch, Wild Charge, Mirror Shot","81;82;462","462"
462,"Magnezone (Shadow)","Magnemite",TRUE,493,144,139,130,"1/15/15","0/13/15","0/15/15","15/15/15","6","17.5","29","50",498,1496,2497,3623,"Volt Switch, Wild Charge, Mirror Shot","Volt Switch, Wild Charge, Mirror Shot","Volt Switch, Wild Charge, Mirror Shot","Volt Switch, Wild Charge, Mirror Shot","81;82;462","462"
463,"Lickilicky","Lickitung",FALSE,296,261,96,326,"0/9/14","0/15/10","0/14/15","15/15/14","8","23.5","48.5","50",500,1498,2498,2789,"Lick, Body Slam, Shadow Ball","Lick, Body Slam, Shadow Ball","Lick, Body Slam, Shadow Ball","Lick, Body Slam, Shadow Ball","108;463","463"
464,"Rhyperior","Rhyhorn",FALSE,684,643,470,81,"0/3/4","0/14/14","0/14/14","15/15/15","5.5","15","25","50",500,1498,2499,4221,"Mud Slap, Breaking Swipe, Rock Wrecker","Mud Slap, Breaking Swipe, Rock Wrecker","Mud Slap, Breaking Swipe, Rock Wrecker","Mud Slap, Breaking Swipe, Rock Wrecker","111;112;464","464"
464,"Rhyperior (Shadow)","Rhyhorn",TRUE,554,599,467,90,"0/3/4","0/14/14","0/14/14","15/15/15","5.5","15","25","50",500,1498,2499,4221,"Mud Slap, Breaking Swipe, Rock Wrecker","Mud Slap, Breaking Swipe, Rock Wrecker","Mud Slap, Rock Wrecker, Breaking Swipe","Mud Slap, Rock Wrecker, Breaking Swipe","111;112;464","464"
