"ID","Pokemon","Family","Shadow","Little_Rank","Great_Rank","Ultra_Rank","Master_Rank","Little_IVs","Great_IVs","Ultra_IVs","Master_IVs","Little_Level","Great_Level","Ultra_Level","Master_Level","Little_CP","Great_CP","Ultra_CP","Master_CP","Little_MoveSet","Great_MoveSet","Ultra_MoveSet","Master_MoveSet","Evo_Fam","Evo_Next"
"499","Pignite","Tepig","FALSE","784","754","674",,"0/13/14","0/15/15","15/15/15",,"10","29.5","50",,"499","1495","2175",,"Ember, Flame Charge, Rock Tomb","Ember, Flame Charge, Rock Tomb","Ember, Flame Charge, Rock Tomb",,"498;499;500","499;500"
"500","Emboar","Tepig","FALSE","839","777","549","335","0/14/12","0/14/9","0/15/14","15/15/15","6.5","19","32.5","50","499","1494","2498","3372","Ember, Blast Burn, Rock Slide","Ember, Blast Burn, Rock Slide","Ember, Blast Burn, Rock Slide","Ember, Blast Burn, Rock Slide","498;499;500","500"
"501","Oshawott","Oshawott","FALSE","258",,,,"0/14/14",,,,"19",,,,"500",,,,"Water Gun, Aqua Tail, Night Slash",,,,"501;502;503","501;502;503"
"502","Dewott","Oshawott","FALSE","109","354",,,"0/15/14","0/15/15",,,"11","36",,,"497","1498",,,"Fury Cutter, Aqua Tail, X-Scissor","Fury Cutter, Aqua Tail, X-Scissor",,,"501;502;503","502;503"
"503","Samurott","Oshawott","FALSE","192","157","323","232","0/15/2","0/14/14","1/15/15","15/15/15","7","20","36","50","500","1498","2496","3194","Fury Cutter, Hydro Cannon, Megahorn","Fury Cutter, Hydro Cannon, Megahorn","Fury Cutter, Hydro Cannon, Razor Shell","Fury Cutter, Hydro Cannon, Razor Shell","501;502;503","503"
"503","Samurott (Hisuian)","Oshawott","FALSE","724","497","344","213","0/13/8","0/15/14","0/15/13","15/15/15","7","20","37","50","499","1496","2499","3167","Fury Cutter, Dark Pulse, Icy Wind","Fury Cutter, Dark Pulse, Icy Wind","Fury Cutter, Icy Wind, Dark Pulse","Snarl, Icy Wind, Razor Shell","501;502;503","503"
"504","Patrat","Patrat","FALSE","1047",,,,"0/15/15",,,,"25.5",,,,"500",,,,"Tackle, Hyper Fang, Dig",,,,"504;505","504;505"
"504","Patrat (Shadow)","Patrat","TRUE","974",,,,"0/15/15",,,,"25.5",,,,"500",,,,"Tackle, Hyper Fang, Dig",,,,"504;505","504;505"
"505","Watchog","Patrat","FALSE","903","901",,,"0/15/14","0/15/15",,,"10.5","33",,,"497","1497",,,"Bite, Crunch, Hyper Fang","Bite, Crunch, Hyper Fang",,,"504;505","505"
"505","Watchog (Shadow)","Patrat","TRUE","806","882",,,"0/15/14","0/15/15",,,"10.5","33",,,"497","1497",,,"Bite, Crunch, Hyper Fang","Bite, Crunch, Hyper Fang",,,"504;505","505"
"506","Lillipup","Lillipup","FALSE","848",,,,"0/13/15",,,,"22",,,,"497",,,,"Sand Attack, Dig, Thunderbolt",,,,"506;507;508","506;507;508"
"507","Herdier","Lillipup","FALSE","902","547",,,"0/10/13","1/15/15",,,"12.5","43",,,"496","1497",,,"Sand Attack, Dig, Thunderbolt","Sand Attack, Dig, Thunderbolt",,,"506;507;508","507;508"
"508","Stoutland","Lillipup","FALSE","642","447","313","262","0/5/14","0/15/13","0/14/15","15/15/15","7","20","36.5","50","495","1500","2496","3196","Sand Attack, Wild Charge, Crunch","Sand Attack, Wild Charge, Crunch","Sand Attack, Wild Charge, Crunch","Sand Attack, Wild Charge, Crunch","506;507;508","508"
"509","Purrloin","Purrloin","FALSE","353",,,,"0/14/13",,,,"26.5",,,,"499",,,,"Sucker Punch, Night Slash, Play Rough",,,,"509;510","509;510"
"509","Purrloin (Shadow)","Purrloin","TRUE","252",,,,"0/14/13",,,,"26.5",,,,"499",,,,"Sucker Punch, Night Slash, Play Rough",,,,"509;510","509;510"
"510","Liepard","Purrloin","FALSE","1094","832",,,"0/10/14","0/15/14",,,"10.5","31.5",,,"498","1499",,,"Snarl, Dark Pulse, Play Rough","Snarl, Dark Pulse, Play Rough",,,"509;510","510"
"510","Liepard (Shadow)","Purrloin","TRUE","1108","796",,,"0/10/14","0/15/14",,,"10.5","31.5",,,"498","1499",,,"Snarl, Dark Pulse, Play Rough","Snarl, Dark Pulse, Play Rough",,,"509;510","510"
"511","Pansage","Pansage","FALSE","543",,,,"0/14/15",,,,"21",,,,"499",,,,"Vine Whip, Crunch, Energy Ball",,,,"511;512","511;512"
"512","Simisage","Pansage","FALSE","880","476","386","503","3/15/14","0/14/15","3/15/15","15/15/15","8","24","49.5","50","498","1496","2495","2657","Vine Whip, Grass Knot, Crunch","Vine Whip, Grass Knot, Crunch","Vine Whip, Grass Knot, Crunch","Vine Whip, Crunch, Grass Knot","511;512","512"
"513","Pansear","Pansear","FALSE","550",,,,"0/14/15",,,,"21",,,,"499",,,,"Fire Spin, Flame Charge, Crunch",,,,"513;514","513;514"
"514","Simisear","Pansear","FALSE","901","757","514","545","3/15/14","0/14/15","3/15/15","15/15/15","8","24","49.5","50","498","1496","2495","2657","Fire Spin, Crunch, Flamethrower","Fire Spin, Crunch, Flamethrower","Fire Spin, Crunch, Flamethrower","Fire Spin, Crunch, Flamethrower","513;514","514"
"515","Panpour","Panpour","FALSE","498",,,,"0/14/15",,,,"21",,,,"499",,,,"Water Gun, Surf, Crunch",,,,"515;516","515;516"
"516","Simipour","Panpour","FALSE","855","646","508","512","3/15/14","0/14/15","3/15/15","15/15/15","8","24","49.5","50","498","1496","2495","2657","Water Gun, Surf, Crunch","Water Gun, Surf, Crunch","Water Gun, Surf, Crunch","Water Gun, Surf, Crunch","515;516","516"
"517","Munna","Munna","FALSE","1164","955",,,"0/14/14","15/15/15",,,"17.5","50",,,"500","1294",,,"Charge Beam, Psyshock, Dazzling Gleam","Charge Beam, Psyshock, Dazzling Gleam",,,"517;518","517;518"
"518","Musharna","Munna","FALSE","1173","924","643","535","3/15/14","0/12/15","0/15/15","15/15/15","7","21","39.5","50","500","1499","2498","3079","Charge Beam, Psyshock, Dazzling Gleam","Charge Beam, Psyshock, Dazzling Gleam","Charge Beam, Psyshock, Dazzling Gleam","Charge Beam, Psyshock, Dazzling Gleam","517;518","518"
"519","Pidove","Pidove","FALSE","132",,,,"0/15/12",,,,"24",,,,"499",,,,"Quick Attack, Aerial Ace, Heat Wave",,,,"519;520;521","519;520;521"
"520","Tranquill","Pidove","FALSE","537","490",,,"0/14/14","2/15/15",,,"13.5","50",,,"497","1494",,,"Steel Wing, Aerial Ace, Sky Attack","Steel Wing, Aerial Ace, Return",,,"519;520;521","520;521"
"520","Tranquill (Shadow)","Pidove","TRUE",,"400",,,,"2/15/15",,,,"50",,,,"1494",,,,"Steel Wing, Aerial Ace, Sky Attack",,,"519;520;521","520;521"
"521","Unfezant","Pidove","FALSE","1139","908","590","491","0/15/14","0/15/14","2/15/13","15/15/15","7","20.5","38","50","499","1495","2495","3091","Steel Wing, Sky Attack, Hyper Beam","Steel Wing, Sky Attack, Hyper Beam","Steel Wing, Sky Attack, Return","Steel Wing, Sky Attack, Return","519;520;521","521"
"521","Unfezant (Shadow)","Pidove","TRUE",,"929","650","521",,"0/15/14","2/15/13","15/15/15",,"20.5","38","50",,"1495","2495","3091",,"Steel Wing, Sky Attack, Hyper Beam","Steel Wing, Sky Attack, Hyper Beam","Steel Wing, Sky Attack, Hyper Beam","519;520;521","521"
"522","Blitzle","Blitzle","FALSE","904",,,,"0/15/13",,,,"22.5",,,,"498",,,,"Spark, Discharge, Flame Charge",,,,"522;523","522;523"
"522","Blitzle (Shadow)","Blitzle","TRUE","869",,,,"0/15/13",,,,"22.5",,,,"498",,,,"Spark, Discharge, Flame Charge",,,,"522;523","522;523"
"523","Zebstrika","Blitzle","FALSE","1005","615","340","492","0/12/11","0/15/9","0/13/15","15/15/15","8","23.5","48.5","50","499","1496","2495","2745","Spark, Wild Charge, Flame Charge","Spark, Wild Charge, Flame Charge","Spark, Wild Charge, Flame Charge","Spark, Wild Charge, Flame Charge","522;523","523"
"523","Zebstrika (Shadow)","Blitzle","TRUE","977","662","417","504","0/12/11","0/15/9","0/13/15","15/15/15","8","23.5","48.5","50","499","1496","2495","2745","Spark, Wild Charge, Flame Charge","Spark, Wild Charge, Flame Charge","Spark, Wild Charge, Flame Charge","Spark, Wild Charge, Flame Charge","522;523","523"
"524","Roggenrola","Roggenrola","FALSE","772","853",,,"0/14/13","15/15/15",,,"16.5","50",,,"500","1362",,,"Smack Down, Stone Edge, Rock Blast","Smack Down, Stone Edge, Rock Blast",,,"524;525;526","524;525;526"
"525","Boldore","Roggenrola","FALSE","826","810","664",,"0/13/13","0/15/15","15/15/15",,"9.5","28","50",,"499","1500","2293",,"Smack Down, Rock Slide, Bulldoze","Smack Down, Rock Slide, Bulldoze","Smack Down, Rock Slide, Stone Edge",,"524;525;526","525;526"
"526","Gigalith","Roggenrola","FALSE","812","752","537","227","1/15/14","0/11/15","0/13/15","15/15/15","6","17.5","29","50","500","1492","2496","3650","Smack Down, Superpower, Meteor Beam","Smack Down, Superpower, Meteor Beam","Smack Down, Superpower, Meteor Beam","Smack Down, Superpower, Meteor Beam","524;525;526","526"
"527","Woobat","Woobat","FALSE","746",,,,"0/15/15",,,,"19.5",,,,"496",,,,"Confusion, Aerial Ace, Psyshock",,,,"527;528","527;528"
"528","Swoobat","Woobat","FALSE","462","313",,,"2/15/14","0/15/9",,,"11","38",,,"500","1499",,,"Confusion, Psychic Fangs, Aerial Ace","Confusion, Fly, Psychic Fangs",,,"527;528","528"
"529","Drilbur","Drilbur","FALSE","719","676",,,"0/15/14","10/15/15",,,"14","49.5",,,"500","1499",,,"Mud Slap, Drill Run, Rock Tomb","Mud Slap, Drill Run, Rock Tomb",,,"529;530","529;530"
"529","Drilbur (Shadow)","Drilbur","TRUE","618","686",,,"0/15/14","10/15/15",,,"14","49.5",,,"500","1499",,,"Mud Slap, Drill Run, Rock Tomb","Mud Slap, Drill Run, Rock Tomb",,,"529;530","529;530"
"530","Excadrill","Drilbur","FALSE","188","185","208","103","0/14/11","2/15/14","0/15/15","15/15/15","6","17","28.5","50","500","1494","2490","3667","Mud Shot, Drill Run, Rock Slide","Mud Shot, Drill Run, Rock Slide","Mud Shot, Drill Run, Rock Slide","Mud Shot, Drill Run, Rock Slide","529;530","530"
"530","Excadrill (Shadow)","Drilbur","TRUE","321","134","173","87","0/14/11","2/15/14","0/15/15","15/15/15","6","17","28.5","50","500","1494","2490","3667","Mud Shot, Drill Run, Rock Slide","Mud Shot, Drill Run, Rock Slide","Mud Shot, Drill Run, Rock Slide","Mud Shot, Drill Run, Rock Slide","529;530","530"
"531","Audino","Audino","FALSE","1174","934","706",,"0/12/10","0/15/13","15/15/14",,"12","41","50",,"498","1499","1902",,"Zen Headbutt, Disarming Voice, Hyper Beam","Zen Headbutt, Disarming Voice, Hyper Beam","Zen Headbutt, Disarming Voice, Hyper Beam",,"531","531"
"532","Timburr","Timburr","FALSE","1165","941",,,"0/12/15","15/15/15",,,"15","50",,,"500","1487",,,"Low Kick, Brick Break, Rock Tomb","Low Kick, Brick Break, Rock Tomb",,,"532;533;534","532;533;534"
"533","Gurdurr","Timburr","FALSE","688","580","482","539","0/12/10","1/15/15","15/15/14","15/15/15","9","26","50","50","500","1491","2452","2452","Poison Jab, Stone Edge, Brick Break","Poison Jab, Brick Break, Stone Edge","Poison Jab, Stone Edge, Brick Break","Poison Jab, Stone Edge, Brick Break","532;533;534","533;534"
"534","Conkeldurr","Timburr","FALSE","227","180","153","91","0/6/10","3/15/14","0/15/12","15/15/15","6","16.5","28","50","494","1495","2498","3773","Counter, Dynamic Punch, Brutal Swing","Counter, Dynamic Punch, Brutal Swing","Counter, Dynamic Punch, Brutal Swing","Counter, Brutal Swing, Dynamic Punch","532;533;534","534"
"535","Tympole","Tympole","FALSE","606",,,,"0/15/10",,,,"24.5",,,,"498",,,,"Bubble, Mud Bomb, Water Pulse",,,,"535;536;537","535;536;537"
"536","Palpitoad","Tympole","FALSE","916","505",,,"0/12/8","9/15/15",,,"14.5","49.5",,,"499","1497",,,"Mud Shot, Earth Power, Water Pulse","Mud Shot, Earth Power, Water Pulse",,,"535;536;537","536;537"
"537","Seismitoad","Tympole","FALSE","779","512","267","329","1/15/13","1/15/15","0/15/12","15/15/15","7.5","22","44.5","50","500","1498","2495","2899","Mud Shot, Earth Power, Sludge Bomb","Mud Shot, Earth Power, Sludge Bomb","Mud Shot, Earth Power, Sludge Bomb","Mud Shot, Earth Power, Muddy Water","535;536;537","537"
"538","Throh","Throh","FALSE","1122","911","668","553","2/15/14","2/15/15","0/14/15","15/15/15","7.5","22","45","50","497","1493","2495","2896","Low Kick, Body Slam, Brick Break","Low Kick, Body Slam, Brick Break","Low Kick, Body Slam, Brick Break","Low Kick, Body Slam, Brick Break","538","538"
"538","Throh (Shadow)","Throh","TRUE","1125","912","678","554","2/15/14","2/15/15","0/14/15","15/15/15","7.5","22","45","50","497","1493","2495","2896","Low Kick, Body Slam, Brick Break","Low Kick, Body Slam, Brick Break","Low Kick, Body Slam, Brick Break","Low Kick, Body Slam, Brick Break","538","538"
"539","Sawk","Sawk","FALSE","555","651","538","415","0/14/8","0/15/15","0/15/11","15/15/15","7","20","37.5","50","498","1500","2497","3152","Poison Jab, Body Slam, Brick Break","Poison Jab, Body Slam, Brick Break","Poison Jab, Body Slam, Brick Break","Poison Jab, Body Slam, Brick Break","539","539"
"539","Sawk (Shadow)","Sawk","TRUE","821","503","483","387","0/14/8","0/15/15","0/15/11","15/15/15","7","20","37.5","50","498","1500","2497","3152","Poison Jab, Body Slam, Focus Blast","Poison Jab, Body Slam, Brick Break","Poison Jab, Body Slam, Brick Break","Poison Jab, Body Slam, Brick Break","539","539"
"540","Sewaddle","Sewaddle","FALSE","765",,,,"0/15/11",,,,"21",,,,"497",,,,"Bug Bite, Silver Wind, Energy Ball",,,,"540;541;542","540;541;542"
"541","Swadloon","Sewaddle","FALSE","804","593",,,"0/15/14","12/15/14",,,"14.5","49.5",,,"498","1500",,,"Bug Bite, Silver Wind, Energy Ball","Bug Bite, Energy Ball, Silver Wind",,,"540;541;542","541;542"
"542","Leavanny","Sewaddle","FALSE","390","405","293","361","0/11/15","0/13/14","0/12/14","15/15/15","7.5","22","44","50","500","1499","2497","2917","Razor Leaf, Leaf Blade, X-Scissor","Razor Leaf, Leaf Blade, X-Scissor","Bug Bite, Leaf Blade, X-Scissor","Bug Bite, Leaf Blade, X-Scissor","540;541;542","542"
"543","Venipede","Venipede","FALSE","775",,,,"0/14/14",,,,"29.5",,,,"499",,,,"Poison Sting, Sludge Bomb, Signal Beam",,,,"543;544;545","543;544;545"
"544","Whirlipede","Venipede","FALSE","589","864",,,"0/15/9","15/15/15",,,"18","50",,,"500","1293",,,"Poison Sting, Sludge Bomb, Signal Beam","Poison Sting, Sludge Bomb, Signal Beam",,,"543;544;545","544;545"
"545","Scolipede","Venipede","FALSE","516","493","318","466","0/10/11","1/15/14","0/15/15","15/15/15","8","23","47.5","50","500","1495","2500","2766","Poison Jab, X-Scissor, Sludge Bomb","Poison Jab, X-Scissor, Sludge Bomb","Poison Jab, X-Scissor, Sludge Bomb","Poison Jab, X-Scissor, Sludge Bomb","543;544;545","545"
"546","Cottonee","Cottonee","FALSE","79",,,,"0/15/15",,,,"30.5",,,,"495",,,,"Charm, Grass Knot, Seed Bomb",,,,"546;547","546;547"
"547","Whimsicott","Cottonee","FALSE","413","74","279",,"1/15/13","0/14/15","15/15/14",,"9.5","28.5","50",,"500","1490","2277",,"Fairy Wind, Seed Bomb, Moonblast","Fairy Wind, Seed Bomb, Moonblast","Fairy Wind, Grass Knot, Moonblast",,"546;547","547"
"548","Petilil","Petilil","FALSE","1141",,,,"1/15/15",,,,"19",,,,"499",,,,"Hidden Power (Grass), Energy Ball, Seed Bomb",,,,"548;549","548;549"
"549","Lilligant","Petilil","FALSE","843","811","640","581","1/15/13","0/15/15","0/13/14","15/15/15","7.5","22","44.5","50","499","1491","2499","2883","Charm, Petal Blizzard, Hyper Beam","Charm, Petal Blizzard, Hyper Beam","Charm, Petal Blizzard, Hyper Beam","Magical Leaf, Petal Blizzard, Hyper Beam","548;549","549"
"550","Basculin","Basculin","FALSE","557","498","543",,"2/15/14","0/11/15","15/15/15",,"9","27.5","50",,"498","1495","2363",,"Water Gun, Aqua Tail, Muddy Water","Water Gun, Aqua Tail, Muddy Water","Water Gun, Aqua Tail, Muddy Water",,"550;902","550;902"
"551","Sandile","Sandile","FALSE","731",,,,"0/15/11",,,,"19",,,,"500",,,,"Mud Slap, Crunch, Dig",,,,"551;552;553","551;552;553"
"552","Krokorok","Sandile","FALSE","759","753",,,"0/15/15","6/15/15",,,"13.5","49",,,"498","1492",,,"Mud Slap, Crunch, Earthquake","Mud Slap, Crunch, Earthquake",,,"551;552;553","552;553"
"553","Krookodile","Sandile","FALSE","925","713","489","188","0/13/5","0/13/14","0/13/15","15/15/15","6.5","18.5","31.5","50","497","1498","2500","3444","Snarl, Crunch, Earthquake","Snarl, Crunch, Earthquake","Snarl, Crunch, Earthquake","Snarl, Crunch, Earthquake","551;552;553","553"
"554","Darumaka","Darumaka","FALSE","489","625",,,"0/13/14","2/15/14",,,"13.5","50",,,"496","1499",,,"Fire Fang, Fire Punch, Flame Charge","Fire Fang, Fire Punch, Flame Charge",,,"554;555","554;555"
"554","Darumaka (Galarian)","Darumaka","FALSE","837","747",,,"0/13/14","2/15/14",,,"13.5","50",,,"496","1499",,,"Ice Fang, Ice Punch, Ice Beam","Ice Fang, Ice Punch, Ice Beam",,,"554;555","554;555"
"554","Darumaka (Shadow)","Darumaka","TRUE",,"558",,,,"2/15/14",,,,"50",,,,"1499",,,,"Fire Fang, Fire Punch, Flame Charge",,,"554;555","554;555"
"555","Darmanitan (Galarian)","Darumaka","FALSE","897","837","659","278","9/15/14","0/15/11","0/13/15","15/15/15","6","18","30","50","496","1497","2488","3511","Ice Fang, Avalanche, Superpower","Ice Fang, Avalanche, Superpower","Ice Fang, Avalanche, Superpower","Ice Fang, Avalanche, Superpower","554;555","555"
"555","Darmanitan (Standard)","Darumaka","FALSE","751","457","249","175","9/15/14","0/15/11","0/13/15","15/15/15","6","18","30","50","496","1497","2488","3511","Incinerate, Rock Slide, Overheat","Incinerate, Rock Slide, Overheat","Incinerate, Rock Slide, Overheat","Incinerate, Rock Slide, Overheat","554;555","555"
"555","Darmanitan (Standard) (Shadow)","Darumaka","TRUE",,"487","300","178",,"0/15/11","0/13/15","15/15/15",,"18","30","50",,"1497","2488","3511",,"Incinerate, Rock Slide, Overheat","Incinerate, Rock Slide, Overheat","Incinerate, Rock Slide, Overheat","554;555","555"
"556","Maractus","Maractus","FALSE","1095","793","560","582","0/14/10","0/13/14","9/15/15","15/15/15","8.5","25","50","50","498","1498","2496","2571","Bullet Seed, Aerial Ace, Petal Blizzard","Bullet Seed, Aerial Ace, Petal Blizzard","Bullet Seed, Aerial Ace, Petal Blizzard","Bullet Seed, Aerial Ace, Petal Blizzard","556","556"
"557","Dwebble","Dwebble","FALSE","525","697",,,"1/15/15","15/15/15",,,"16","50",,,"498","1384",,,"Smack Down, X-Scissor, Rock Blast","Smack Down, X-Scissor, Rock Blast",,,"557;558","557;558"
"557","Dwebble (Shadow)","Dwebble","TRUE","418","698",,,"1/15/15","15/15/15",,,"16","50",,,"498","1384",,,"Smack Down, X-Scissor, Rock Blast","Smack Down, X-Scissor, Rock Blast",,,"557;558","557;558"
"558","Crustle","Dwebble","FALSE","647","574","375","385","3/15/13","0/13/13","0/14/15","15/15/15","7.5","22.5","45","50","499","1499","2490","2874","Smack Down, X-Scissor, Rock Slide","Smack Down, X-Scissor, Rock Slide","Smack Down, X-Scissor, Rock Slide","Fury Cutter, X-Scissor, Rock Slide","557;558","558"
"558","Crustle (Shadow)","Dwebble","TRUE","544","575","403","355","3/15/13","0/13/13","0/14/15","15/15/15","7.5","22.5","45","50","499","1499","2490","2874","Smack Down, X-Scissor, Rock Slide","Smack Down, X-Scissor, Rock Slide","Smack Down, X-Scissor, Rock Slide","Fury Cutter, X-Scissor, Rock Slide","557;558","558"
"559","Scraggy","Scraggy","FALSE","800","648",,,"0/15/9","11/15/15",,,"14.5","49.5",,,"499","1494",,,"Feint Attack, Foul Play, Brick Break","Feint Attack, Foul Play, Brick Break",,,"559;560","559;560"
"560","Scrafty","Scraggy","FALSE","27","95","52","320","0/15/13","0/8/15","9/15/15","15/15/15","8.5","25.5","50","50","500","1489","2497","2581","Counter, Foul Play, Power-Up Punch","Counter, Foul Play, Thunder Punch","Counter, Foul Play, Thunder Punch","Counter, Foul Play, Thunder Punch","559;560","560"
"561","Sigilyph","Sigilyph","FALSE","1099","887","657","580","0/15/15","1/15/14","0/13/15","15/15/15","7.5","22","44.5","50","498","1500","2489","2883","Air Slash, Ancient Power, Signal Beam","Air Slash, Ancient Power, Signal Beam","Air Slash, Ancient Power, Signal Beam","Air Slash, Ancient Power, Signal Beam","561","561"
"562","Yamask","Yamask","FALSE","707",,,,"0/10/15",,,,"21",,,,"498",,,,"Astonish, Shadow Ball, Dark Pulse",,,,"562;563;867","562;563;867"
"562","Yamask (Galarian)","Yamask","FALSE","947",,,,"0/10/15",,,,"21",,,,"498",,,,"Astonish, Rock Tomb, Night Shade",,,,"562;563;867","562;563;867"
"563","Cofagrigus","Cofagrigus","FALSE","393","114","68","397","0/15/15","0/11/14","10/15/15","15/15/15","8.5","25.5","50","50","497","1500","2492","2570","Shadow Claw, Shadow Ball, Dark Pulse","Shadow Claw, Shadow Ball, Dark Pulse","Shadow Claw, Shadow Ball, Dark Pulse","Shadow Claw, Shadow Ball, Dark Pulse","562;563","563"
"564","Tirtouga","Tirtouga","FALSE","387","420",,,"1/15/14","0/14/15",,,"13","49.5",,,"499","1494",,,"Water Gun, Surf, Body Slam","Water Gun, Surf, Body Slam",,,"564;565","564;565"
"565","Carracosta","Tirtouga","FALSE","457","492","399","362","0/9/12","1/14/15","1/14/15","15/15/15","7.5","21.5","42","50","499","1497","2486","2964","Water Gun, Surf, Body Slam","Water Gun, Surf, Body Slam","Water Gun, Surf, Body Slam","Water Gun, Surf, Body Slam","564;565","565"
"566","Archen","Archen","FALSE","624","554",,,"3/15/15","0/15/14",,,"10","31",,,"497","1497",,,"Wing Attack, Ancient Power, Dragon Claw","Wing Attack, Ancient Power, Dragon Claw",,,"566;567","566;567"
"567","Archeops","Archen","FALSE","739","564","418","215","0/9/6","1/15/15","1/15/15","15/15/15","6","16.5","27.5","50","496","1494","2499","3766","Wing Attack, Ancient Power, Dragon Claw","Wing Attack, Ancient Power, Dragon Claw","Wing Attack, Dragon Claw, Ancient Power","Wing Attack, Dragon Claw, Ancient Power","566;567","567"
"568","Trubbish","Trubbish","FALSE","1187",,,,"0/14/12",,,,"20.5",,,,"500",,,,"Take Down, Seed Bomb, Gunk Shot",,,,"568;569","568;569"
"569","Garbodor","Trubbish","FALSE","682","711","550","570","0/2/14","0/13/13","3/15/15","15/15/15","8.5","24.5","50","50","498","1498","2499","2651","Infestation, Body Slam, Seed Bomb","Infestation, Body Slam, Seed Bomb","Infestation, Body Slam, Seed Bomb","Infestation, Body Slam, Seed Bomb","568;569","569"
"570","Zorua","Zorua","FALSE","1074",,,,"1/15/11",,,,"16.5",,,,"495",,,,"Feint Attack, Foul Play, Aerial Ace",,,,"570;571","570;571"
"571","Zoroark","Zorua","FALSE","1032","769","529","431","0/13/11","1/15/15","1/15/15","15/15/15","7.5","21.5","42","50","500","1497","2500","2907","Shadow Claw, Foul Play, Sludge Bomb","Shadow Claw, Foul Play, Sludge Bomb","Shadow Claw, Foul Play, Flamethrower","Shadow Claw, Foul Play, Flamethrower","570;571","571"
"572","Minccino","Minccino","FALSE","629",,,,"0/15/10",,,,"23.5",,,,"497",,,,"Charm, Aqua Tail, Thunderbolt",,,,"572;573","572;573"
"573","Cinccino","Minccino","FALSE","787","806","613","566","0/15/13","2/15/14","12/15/15","15/15/15","8.5","25","50","50","498","1499","2490","2535","Charm, Aqua Tail, Thunderbolt","Charm, Aqua Tail, Thunderbolt","Charm, Aqua Tail, Thunderbolt","Charm, Aqua Tail, Thunderbolt","572;573","573"
"574","Gothita","Gothita","FALSE","905",,,,"0/15/11",,,,"21.5",,,,"500",,,,"Confusion, Psyshock, Psychic",,,,"574;575;576","574;575;576"
"575","Gothorita","Gothita","FALSE","999","739",,,"2/14/14","0/15/14",,,"12","43",,,"498","1498",,,"Confusion, Future Sight, Psychic","Confusion, Future Sight, Psychic",,,"574;575;576","575;576"
"575","Gothorita (Shadow)","Gothita","TRUE",,"746",,,,"0/15/14",,,,"43",,,,"1498",,,,"Confusion, Future Sight, Psychic",,,"574;575;576","575;576"
"576","Gothitelle","Gothita","FALSE","998","665","408","517","0/13/15","0/15/15","0/14/15","15/15/15","8","23.5","49.5","50","498","1498","2488","2735","Confusion, Rock Slide, Future Sight","Confusion, Rock Slide, Future Sight","Confusion, Rock Slide, Future Sight","Confusion, Rock Slide, Future Sight","574;575;576","576"
"576","Gothitelle (Shadow)","Gothita","TRUE",,"702","506","533",,"0/15/15","0/14/15","15/15/15",,"23.5","49.5","50",,"1498","2488","2735",,"Confusion, Rock Slide, Future Sight","Confusion, Rock Slide, Future Sight","Confusion, Rock Slide, Future Sight","574;575;576","576"
"577","Solosis","Solosis","FALSE","1161","952",,,"0/14/15","9/15/15",,,"14","50",,,"499","1497",,,"Hidden Power (Psychic), Psyshock, Thunder","Hidden Power (Psychic), Psyshock, Thunder",,,"577;578;579","577;578;579"
"577","Solosis (Shadow)","Solosis","TRUE",,"945",,,,"9/15/15",,,,"50",,,,"1497",,,,"Hidden Power (Psychic), Psyshock, Thunder",,,"577;578;579","577;578;579"
"578","Duosion","Solosis","FALSE","1162","950",,,"0/11/15","0/15/13",,,"9.5","28",,,"500","1493",,,"Hidden Power (Psychic), Psyshock, Thunder","Hidden Power (Psychic), Psyshock, Thunder",,,"577;578;579","578;579"
"578","Duosion (Shadow)","Solosis","TRUE",,"948",,,,"0/15/13",,,,"28",,,,"1493",,,,"Hidden Power (Psychic), Psyshock, Thunder",,,"577;578;579","578;579"
"579","Reuniclus","Solosis","FALSE","1172","957","689","536","3/15/15","2/15/14","0/13/14","15/15/15","6.5","19","34.5","50","499","1500","2497","3309","Hidden Power (Fighting), Future Sight, Shadow Ball","Hidden Power (Fighting), Future Sight, Shadow Ball","Hidden Power (Psychic), Shadow Ball, Future Sight","Hidden Power (Ice), Shadow Ball, Future Sight","577;578;579","579"
"579","Reuniclus (Shadow)","Solosis","TRUE",,"944","697","546",,"2/15/14","0/13/14","15/15/15",,"19","34.5","50",,"1500","2497","3309",,"Hidden Power (Psychic), Future Sight, Shadow Ball","Hidden Power (Psychic), Shadow Ball, Future Sight","Hidden Power (Ice), Shadow Ball, Future Sight","577;578;579","579"
"580","Ducklett","Ducklett","FALSE","55",,,,"0/15/15",,,,"24",,,,"500",,,,"Wing Attack, Bubble Beam, Brave Bird",,,,"580;581","580;581"
"580","Ducklett (Shadow)","Ducklett","TRUE","115",,,,"0/15/15",,,,"24",,,,"500",,,,"Wing Attack, Bubble Beam, Brave Bird",,,,"580;581","580;581"
"581","Swanna","Ducklett","FALSE","1101","617","446",,"2/15/15","1/15/15","15/15/15",,"9","27","50",,"496","1498","2361",,"Air Slash, Hurricane, Ice Beam","Air Slash, Fly, Ice Beam","Water Gun, Fly, Ice Beam",,"580;581","581"
"581","Swanna (Shadow)","Ducklett","TRUE","894","509","546",,"2/15/15","1/15/15","15/15/15",,"9","27","50",,"496","1498","2361",,"Water Gun, Hurricane, Ice Beam","Water Gun, Fly, Ice Beam","Air Slash, Fly, Ice Beam",,"580;581","581"
"582","Vanillite","Vanillite","FALSE","738",,,,"0/14/11",,,,"19.5",,,,"499",,,,"Powder Snow, Icy Wind, Signal Beam",,,,"582;583;584","582;583;584"
"583","Vanillish","Vanillite","FALSE","976","703",,,"1/15/15","0/14/15",,,"12","43",,,"499","1499",,,"Frost Breath, Icy Wind, Signal Beam","Frost Breath, Icy Wind, Signal Beam",,,"582;583;584","583;584"
