"ID","Pokemon","Family","Shadow","Little_Rank","Great_Rank","Ultra_Rank","Master_Rank","Little_IVs","Great_IVs","Ultra_IVs","Master_IVs","Little_Level","Great_Level","Ultra_Level","Master_Level","Little_CP","Great_CP","Ultra_CP","Master_CP","Little_MoveSet","Great_MoveSet","Ultra_MoveSet","Master_MoveSet","Evo_Fam","Evo_Next"
"1","Bulbasaur","Bulbasaur","FALSE",,"804",,,,"15/15/15",,,,"50",,,,"1260",,,,"Vine Whip, Power Whip, Sludge Bomb",,,"1;2;3","1;2;3"
"1","Bulbasaur (Shadow)","Bulbasaur","TRUE",,"855",,,,"15/15/15",,,,"50",,,,"1260",,,,"Vine Whip, Power Whip, Sludge Bomb",,,"1;2;3","1;2;3"
"2","Ivysaur","Bulbasaur","FALSE",,"273",,,,"0/13/14",,,,"38.5",,,,"1493",,,,"Vine Whip, Power Whip, Sludge Bomb",,,"1;2;3","2;3"
"2","Ivysaur (Shadow)","Bulbasaur","TRUE",,"360",,,,"0/13/14",,,,"38.5",,,,"1497",,,,"Vine Whip, Power Whip, Sludge Bomb",,,"1;2;3","2;3"
"3","Venusaur","Bulbasaur","FALSE",,"84","94","262",,"0/14/11","1/15/14","15/15/15",,"21","39","50",,"1496","2499","3075",,"Vine Whip, Frenzy Plant, Sludge Bomb","Vine Whip, Frenzy Plant, Sludge Bomb","Vine Whip, Frenzy Plant, Sludge Bomb","1;2;3","3"
"3","Venusaur (Shadow)","Bulbasaur","TRUE",,"102","78","267",,"0/14/11","1/15/14","15/15/15",,"21","39","50",,"1496","2499","3075",,"Vine Whip, Frenzy Plant, Sludge Bomb","Vine Whip, Frenzy Plant, Sludge Bomb","Vine Whip, Frenzy Plant, Sludge Bomb","1;2;3","3"
"4","Charmander","Charmander","FALSE","214",,,,"0/15/11",,,,"20.5",,,,"500",,,,"Ember, Flame Charge, Flamethrower",,,,"4;5;6","4;5;6"
"4","Charmander (Shadow)","Charmander","TRUE","175",,,,"0/15/11",,,,"20.5",,,,"500",,,,"Ember, Flame Charge, Flamethrower",,,,"4;5;6","4;5;6"
"5","Charmeleon","Charmander","FALSE","245","794",,,"1/15/15","0/13/15",,,"11.5","40",,,"500","1496",,,"Ember, Fire Punch, Flamethrower","Ember, Fire Punch, Return",,,"4;5;6","5;6"
"5","Charmeleon (Shadow)","Charmander","TRUE","205","708",,,"1/15/15","0/13/15",,,"11.5","40",,,"500","1496",,,"Ember, Fire Punch, Flamethrower","Ember, Fire Punch, Flamethrower",,,"4;5;6","5;6"
"6","Charizard","Charmander","FALSE","126","393","233","176","6/15/14","0/15/13","0/13/15","15/15/15","6.5","19.5","35","50","496","1488","2497","3266","Fire Spin, Blast Burn, Dragon Claw","Fire Spin, Blast Burn, Dragon Claw","Dragon Breath, Blast Burn, Dragon Claw","Dragon Breath, Blast Burn, Dragon Claw","4;5;6","6"
"6","Charizard (Shadow)","Charmander","TRUE",,"264","284","182",,"0/15/13","0/13/15","15/15/15",,"19.5","35","50",,"1488","2497","3266",,"Fire Spin, Blast Burn, Dragon Claw","Dragon Breath, Blast Burn, Dragon Claw","Dragon Breath, Blast Burn, Dragon Claw","4;5;6","6"
"8","Wartortle","Squirtle","FALSE",,"524",,,,"0/14/15",,,,"50",,,,"1496",,,,"Water Gun, Ice Beam, Hydro Pump",,,"7;8;9","8;9"
"8","Wartortle (Shadow)","Squirtle","TRUE",,"671",,,,"0/14/15",,,,"50",,,,"1496",,,,"Water Gun, Ice Beam, Hydro Pump",,,"7;8;9","8;9"
"9","Blastoise","Squirtle","FALSE",,"146","51","276",,"1/15/15","0/12/15","15/15/15",,"23","48.5","50",,"1492","2495","2788",,"Water Gun, Hydro Cannon, Ice Beam","Water Gun, Hydro Cannon, Ice Beam","Water Gun, Hydro Cannon, Ice Beam","7;8;9","9"
"9","Blastoise (Shadow)","Squirtle","TRUE",,"231","108","284",,"1/15/15","0/12/15","15/15/15",,"23","48.5","50",,"1492","2495","2788",,"Water Gun, Hydro Cannon, Ice Beam","Water Gun, Hydro Cannon, Ice Beam","Water Gun, Hydro Cannon, Ice Beam","7;8;9","9"
"10","Caterpie","Caterpie","FALSE","343",,,,"15/15/15",,,,"50",,,,"494",,,,"Bug Bite, Struggle, NA",,,,"10;11;12","10;11;12"
"11","Metapod","Caterpie","FALSE","323",,,,"14/15/15",,,,"50",,,,"500",,,,"Bug Bite, Struggle, NA",,,,"10;11;12","11;12"
"12","Butterfree","Caterpie","FALSE","368","953",,,"0/14/14","0/13/15",,,"10.5","33",,,"498","1494",,,"Bug Bite, Bug Buzz, Signal Beam","Confusion, Bug Buzz, Signal Beam",,,"10;11;12","12"
"15","Beedrill","Weedle","FALSE",,"181","576",,,"0/13/14","15/15/15",,,"32.5","50",,,"1494","2087",,,"Poison Jab, X-Scissor, Drill Run","Poison Jab, Drill Run, X-Scissor",,"13;14;15","15"
"15","Beedrill (Shadow)","Weedle","TRUE",,"227","562",,,"0/13/14","15/15/15",,,"32.5","50",,,"1494","2087",,,"Poison Jab, X-Scissor, Drill Run","Poison Jab, Drill Run, X-Scissor",,"13;14;15","15"
"17","Pidgeotto","Pidgey","FALSE",,"656",,,,"15/15/15",,,,"50",,,,"1350",,,,"Wing Attack, Aerial Ace, Return",,,"16;17;18","17;18"
"17","Pidgeotto (Shadow)","Pidgey","TRUE",,"810",,,,"15/15/15",,,,"50",,,,"1350",,,,"Wing Attack, Aerial Ace, Twister",,,"16;17;18","17;18"
"18","Pidgeot","Pidgey","FALSE",,"322","223","521",,"0/14/14","15/15/15","15/15/15",,"27","50","50",,"1494","2407","2407",,"Gust, Feather Dance, Brave Bird","Gust, Feather Dance, Brave Bird","Gust, Brave Bird, Aerial Ace","16;17;18","18"
"18","Pidgeot (Shadow)","Pidgey","TRUE",,"453","297","528",,"0/14/14","15/15/15","15/15/15",,"27","50","50",,"1494","2407","2407",,"Gust, Brave Bird, Aerial Ace","Gust, Brave Bird, Aerial Ace","Gust, Brave Bird, Aerial Ace","16;17;18","18"
"20","Raticate","Rattata","FALSE",,"618",,,,"0/14/15",,,,"36.5",,,,"1494",,,,"Quick Attack, Hyper Fang, Dig",,,"19;20","20"
"20","Raticate (Alolan)","Rattata","FALSE",,"167","677",,,"0/13/14","15/15/15",,,"39","50",,,"1496","1927",,,"Quick Attack, Crunch, Return","Quick Attack, Crunch, Hyper Fang",,"19;20","20"
"20","Raticate (Alolan) (Shadow)","Rattata","TRUE",,"224","676",,,"0/13/14","15/15/15",,,"39","50",,,"1496","1927",,,"Quick Attack, Crunch, Hyper Beam","Quick Attack, Crunch, Hyper Fang",,"19;20","20"
"20","Raticate (Shadow)","Rattata","TRUE",,"683",,,,"0/14/15",,,,"36.5",,,,"1494",,,,"Quick Attack, Hyper Fang, Dig",,,"19;20","20"
"22","Fearow","Spearow","FALSE",,"838","660",,,"0/15/14","15/15/15",,,"28.5","50",,,"1497","2257",,,"Steel Wing, Fly, Drill Run","Steel Wing, Fly, Drill Run",,"21;22","22"
"24","Arbok","Ekans","FALSE",,"857","690",,,"0/11/14","15/15/14",,,"30.5","50",,,"1495","2171",,,"Dragon Tail, Dark Pulse, Sludge Wave","Dragon Tail, Dark Pulse, Sludge Wave",,"23;24","24"
"24","Arbok (Shadow)","Ekans","TRUE",,"885","702",,,"0/11/14","15/15/14",,,"30.5","50",,,"1495","2171",,,"Dragon Tail, Dark Pulse, Sludge Wave","Dragon Tail, Dark Pulse, Sludge Wave",,"23;24","24"
"25","Pikachu","Pikachu","FALSE","189",,,,"1/15/15",,,,"21",,,,"498",,,,"Thunder Shock, Wild Charge, Surf",,,,"25;26;172","25;26;172"
"26","Raichu","Pikachu","FALSE","361","403","326",,"0/11/8","0/15/14","15/15/14",,"9","26","50",,"494","1495","2467",,"Volt Switch, Wild Charge, Trailblaze","Volt Switch, Wild Charge, Brick Break","Volt Switch, Brick Break, Wild Charge",,"25;26;172","26;172"
"26","Raichu (Alolan)","Pikachu","FALSE",,"346","237","535",,"1/15/15","8/15/14","15/15/15",,"24.5","50","50",,"1499","2500","2585",,"Volt Switch, Wild Charge, Trailblaze","Volt Switch, Trailblaze, Wild Charge","Volt Switch, Wild Charge, Thunder Punch","25;26;172","26;172"
"27","Sandshrew","Sandshrew","FALSE",,"614",,,,"15/15/15",,,,"50",,,,"1426",,,,"Sand Attack, Dig, Rock Slide",,,"27;28","27;28"
"27","Sandshrew (Alolan)","Sandshrew","FALSE",,"226",,,,"15/15/15",,,,"50",,,,"1462",,,,"Powder Snow, Night Slash, Blizzard",,,"27;28","27;28"
"27","Sandshrew (Alolan) (Shadow)","Sandshrew","TRUE",,"427",,,,"15/15/15",,,,"50",,,,"1462",,,,"Powder Snow, Night Slash, Blizzard",,,"27;28","27;28"
"27","Sandshrew (Shadow)","Sandshrew","TRUE",,"588",,,,"15/15/15",,,,"50",,,,"1426",,,,"Sand Attack, Dig, Rock Slide",,,"27;28","27;28"
"28","Sandslash","Sandshrew","FALSE",,"313","193","333",,"0/14/15","2/14/15","15/15/15",,"24","50","50",,"1493","2492","2684",,"Sand Attack, Scorching Sands, Night Slash","Sand Attack, Night Slash, Scorching Sands","Sand Attack, Night Slash, Scorching Sands","27;28","28"
"28","Sandslash (Alolan)","Sandshrew","FALSE",,"24","86","229",,"0/14/14","0/14/15","15/15/15",,"23.5","49","50",,"1500","2499","2750",,"Powder Snow, Ice Punch, Drill Run","Shadow Claw, Ice Punch, Drill Run","Powder Snow, Drill Run, Ice Punch","27;28","28"
"28","Sandslash (Alolan) (Shadow)","Sandshrew","TRUE",,"36","77","188",,"0/14/14","0/14/15","15/15/15",,"23.5","49","50",,"1500","2499","2750",,"Powder Snow, Ice Punch, Drill Run","Shadow Claw, Ice Punch, Drill Run","Powder Snow, Drill Run, Ice Punch","27;28","28"
"28","Sandslash (Shadow)","Sandshrew","TRUE",,"197","147","320",,"0/14/15","2/14/15","15/15/15",,"24","50","50",,"1493","2492","2684",,"Sand Attack, Night Slash, Scorching Sands","Sand Attack, Night Slash, Scorching Sands","Sand Attack, Night Slash, Scorching Sands","27;28","28"
"30","Nidorina","Nidoran-f","FALSE",,"111",,,,"15/15/15",,,,"50",,,,"1480",,,,"Poison Sting, Poison Fang, Thunderbolt",,,"29;30;31","30;31"
"30","Nidorina (Shadow)","Nidoran-f","TRUE",,"129",,,,"15/15/15",,,,"50",,,,"1480",,,,"Poison Sting, Poison Fang, Dig",,,"29;30;31","30;31"
"31","Nidoqueen","Nidoran-f","FALSE",,"133","60","294",,"0/15/12","0/14/15","15/15/15",,"23","47","50",,"1499","2500","2812",,"Poison Jab, Earth Power, Poison Fang","Poison Jab, Poison Fang, Earth Power","Poison Jab, Earth Power, Poison Fang","29;30;31","31"
"31","Nidoqueen (Shadow)","Nidoran-f","TRUE",,"125","56","278",,"0/15/12","0/14/15","15/15/15",,"23","47","50",,"1499","2500","2812",,"Poison Jab, Earth Power, Poison Fang","Poison Jab, Poison Fang, Earth Power","Poison Jab, Earth Power, Poison Fang","29;30;31","31"
"33","Nidorino","Nidoran-m","FALSE",,"460",,,,"8/15/15",,,,"49.5",,,,"1500",,,,"Poison Sting, Sludge Bomb, Dig",,,"32;33;34","33;34"
"33","Nidorino (Shadow)","Nidoran-m","TRUE",,"452",,,,"8/15/15",,,,"49.5",,,,"1500",,,,"Poison Sting, Sludge Bomb, Dig",,,"32;33;34","33;34"
"34","Nidoking","Nidoran-m","FALSE",,"711","551","464",,"0/14/15","0/14/14","15/15/15",,"22","44","50",,"1498","2486","2902",,"Double Kick, Sand Tomb, Earth Power","Double Kick, Sand Tomb, Earth Power","Poison Jab, Earth Power, Megahorn","32;33;34","34"
"34","Nidoking (Shadow)","Nidoran-m","TRUE",,"623","493","486",,"0/14/15","0/14/14","15/15/15",,"22","44","50",,"1498","2486","2902",,"Double Kick, Sand Tomb, Earth Power","Double Kick, Sand Tomb, Earth Power","Poison Jab, Earth Power, Megahorn","32;33;34","34"
"35","Clefairy","Clefairy","FALSE","415","972",,,"0/12/15","15/15/15",,,"17.5","50",,,"500","1306",,,"Zen Headbutt, Disarming Voice, Swift","Zen Headbutt, Swift, Disarming Voice",,,"35;36;173","35;36;173"
"36","Clefable","Clefairy","FALSE","60","13","4","233","0/14/11","0/13/15","0/15/13","15/15/15","8","23.5","49","50","500","1499","2497","2755","Fairy Wind, Meteor Mash, Swift","Fairy Wind, Moonblast, Swift","Fairy Wind, Swift, Moonblast","Fairy Wind, Swift, Meteor Mash","35;36;173","36;173"
"37","Vulpix","Vulpix","FALSE","41",,,,"0/15/14",,,,"23",,,,"500",,,,"Ember, Weather Ball (Fire), Body Slam",,,,"37;38","37;38"
"37","Vulpix (Shadow)","Vulpix","TRUE","114",,,,"0/15/14",,,,"23",,,,"500",,,,"Ember, Weather Ball (Fire), Body Slam",,,,"37;38","37;38"
"38","Ninetales","Vulpix","FALSE","29","144","61","377","0/13/14","0/15/15","9/15/15","15/15/15","8.5","25","50","50","498","1494","2495","2577","Fire Spin, Weather Ball (Fire), Scorching Sands","Fire Spin, Weather Ball (Fire), Overheat","Fire Spin, Weather Ball (Fire), Overheat","Fire Spin, Weather Ball (Fire), Scorching Sands","37;38","38"
"38","Ninetales (Alolan)","Vulpix","FALSE",,"81","104","231",,"0/14/12","7/15/15","15/15/15",,"25","50","50",,"1498","2500","2610",,"Powder Snow, Weather Ball (Ice), Dazzling Gleam","Powder Snow, Weather Ball (Ice), Dazzling Gleam","Powder Snow, Weather Ball (Ice), Psyshock","37;38","38"
"38","Ninetales (Alolan) (Shadow)","Vulpix","TRUE",,"89","58","194",,"0/14/12","7/15/15","15/15/15",,"25","50","50",,"1498","2500","2610",,"Powder Snow, Weather Ball (Ice), Dazzling Gleam","Powder Snow, Weather Ball (Ice), Dazzling Gleam","Powder Snow, Weather Ball (Ice), Psyshock","37;38","38"
"38","Ninetales (Shadow)","Vulpix","TRUE","76","177","57","352","0/13/14","0/15/15","9/15/15","15/15/15","8.5","25","50","50","498","1494","2495","2577","Fire Spin, Weather Ball (Fire), Scorching Sands","Fire Spin, Weather Ball (Fire), Overheat","Fire Spin, Weather Ball (Fire), Overheat","Fire Spin, Weather Ball (Fire), Scorching Sands","37;38","38"
"40","Wigglytuff","Jigglypuff","FALSE",,"58","268",,,"0/15/12","15/15/15",,,"30","50",,,"1495","2178",,,"Charm, Icy Wind, Swift","Charm, Disarming Voice, Icy Wind",,"39;40;174","40;174"
"42","Golbat","Zubat","FALSE",,"397","521",,,"0/15/15","15/15/15",,,"29","50",,,"1498","2234",,,"Wing Attack, Poison Fang, Shadow Ball","Wing Attack, Poison Fang, Shadow Ball",,"41;42;169","42;169"
"42","Golbat (Shadow)","Zubat","TRUE",,"331","472",,,"0/15/15","15/15/15",,,"29","50",,,"1498","2234",,,"Wing Attack, Poison Fang, Shadow Ball","Wing Attack, Poison Fang, Shadow Ball",,"41;42;169","42;169"
"43","Oddish","Oddish","FALSE","215","760",,,"0/15/13","15/15/15",,,"16","50",,,"500","1389",,,"Razor Leaf, Seed Bomb, Sludge Bomb","Razor Leaf, Seed Bomb, Sludge Bomb",,,"43;44;45","43;44;45"
"43","Oddish (Shadow)","Oddish","TRUE","199","688",,,"0/15/13","15/15/15",,,"16","50",,,"500","1389",,,"Razor Leaf, Seed Bomb, Sludge Bomb","Razor Leaf, Seed Bomb, Sludge Bomb",,,"43;44;45","43;44;45"
"44","Gloom","Oddish","FALSE","204","599",,,"0/15/13","0/12/14",,,"11.5","39.5",,,"498","1500",,,"Razor Leaf, Sludge Bomb, Moonblast","Razor Leaf, Sludge Bomb, Petal Blizzard",,,"43;44;45","44;45"
"44","Gloom (Shadow)","Oddish","TRUE","196","485",,,"0/15/13","0/12/14",,,"11.5","39.5",,,"498","1500",,,"Razor Leaf, Sludge Bomb, Moonblast","Razor Leaf, Sludge Bomb, Petal Blizzard",,,"43;44;45","44;45"
"45","Vileplume","Oddish","FALSE","229","637","588","549","0/14/15","0/15/14","0/15/14","15/15/15","7.5","22","44","50","499","1498","2494","2893","Razor Leaf, Sludge Bomb, Moonblast","Razor Leaf, Sludge Bomb, Petal Blizzard","Razor Leaf, Sludge Bomb, Moonblast","Razor Leaf, Sludge Bomb, Moonblast","43;44;45","45"
"45","Vileplume (Shadow)","Oddish","TRUE",,"502","578","527",,"0/15/14","0/15/14","15/15/15",,"22","44","50",,"1498","2494","2893",,"Razor Leaf, Sludge Bomb, Moonblast","Razor Leaf, Sludge Bomb, Moonblast","Razor Leaf, Sludge Bomb, Moonblast","43;44;45","45"
"47","Parasect","Paras","FALSE",,"522","658",,,"0/13/15","15/15/14",,,"32","50",,,"1495","2102",,,"Fury Cutter, X-Scissor, Cross Poison","Fury Cutter, X-Scissor, Cross Poison",,"46;47","47"
"49","Venomoth","Venonat","FALSE",,"701","643",,,"0/13/15","15/15/15",,,"27.5","50",,,"1499","2354",,,"Infestation, Poison Fang, Bug Buzz","Confusion, Poison Fang, Silver Wind",,"48;49","49"
"49","Venomoth (Shadow)","Venonat","TRUE",,"716","667",,,"0/13/15","15/15/15",,,"27.5","50",,,"1499","2354",,,"Infestation, Poison Fang, Bug Buzz","Confusion, Poison Fang, Silver Wind",,"48;49","49"
"50","Diglett","Diglett","FALSE","197",,,,"1/15/13",,,,"29.5",,,,"499",,,,"Mud Slap, Mud Bomb, Rock Tomb",,,,"50;51","50;51"
"50","Diglett (Shadow)","Diglett","TRUE","154",,,,"1/15/13",,,,"29.5",,,,"499",,,,"Mud Slap, Mud Bomb, Rock Tomb",,,,"50;51","50;51"
"51","Dugtrio","Diglett","FALSE","222","270",,,"0/13/12","0/14/15",,,"12.5","44",,,"497","1495",,,"Mud Slap, Mud Bomb, Stone Edge","Mud Slap, Mud Bomb, Stone Edge",,,"50;51","51"
"51","Dugtrio (Alolan)","Diglett","FALSE",,"241",,,,"0/14/15",,,,"29.5",,,,"1497",,,,"Mud Slap, Mud Bomb, Iron Head",,,"50;51","51"
"51","Dugtrio (Alolan) (Shadow)","Diglett","TRUE",,"155",,,,"0/14/15",,,,"29.5",,,,"1497",,,,"Mud Slap, Mud Bomb, Iron Head",,,"50;51","51"
"51","Dugtrio (Shadow)","Diglett","TRUE","146","254",,,"0/13/12","0/14/15",,,"12.5","44",,,"497","1495",,,"Mud Slap, Mud Bomb, Stone Edge","Mud Slap, Mud Bomb, Stone Edge",,,"50;51","51"
"52","Meowth (Galarian)","Meowth","FALSE","75",,,,"0/15/9",,,,"19.5",,,,"499",,,,"Metal Claw, Night Slash, Trailblaze",,,,"52;53;863","52;53;863"
"53","Persian","Meowth","FALSE","325","823",,,"0/15/12","0/14/13",,,"11.5","39",,,"494","1496",,,"Feint Attack, Night Slash, Power Gem","Feint Attack, Night Slash, Power Gem",,,"52;53;863","53"
"53","Persian (Alolan)","Meowth","FALSE",,"832",,,,"1/15/15",,,,"34.5",,,,"1498",,,,"Feint Attack, Foul Play, Play Rough",,,"52;53;863","53"
"53","Persian (Shadow)","Meowth","TRUE","358","809",,,"0/15/12","0/14/13",,,"11.5","39",,,"494","1496",,,"Feint Attack, Night Slash, Power Gem","Feint Attack, Night Slash, Power Gem",,,"52;53;863","53"
"55","Golduck","Psyduck","FALSE",,"400","295","421",,"0/10/14","0/13/13","15/15/15",,"23.5","48.5","50",,"1499","2496","2770",,"Water Gun, Cross Chop, Liquidation","Water Gun, Cross Chop, Liquidation","Water Gun, Cross Chop, Liquidation","54;55","55"
"55","Golduck (Shadow)","Psyduck","TRUE",,"302","263","405",,"0/10/14","0/13/13","15/15/15",,"23.5","48.5","50",,"1499","2496","2770",,"Water Gun, Cross Chop, Liquidation","Water Gun, Cross Chop, Liquidation","Water Gun, Cross Chop, Liquidation","54;55","55"
"56","Mankey","Mankey","FALSE",,"603",,,,"15/15/15",,,,"50",,,,"1317",,,,"Karate Chop, Cross Chop, Brick Break",,,"56;57;979","56;57;979"
"57","Primeape","Mankey","FALSE",,"113","59","380",,"1/15/14","7/15/15","15/15/15",,"24.5","50","50",,"1497","2490","2586",,"Karate Chop, Ice Punch, Close Combat","Karate Chop, Night Slash, Close Combat","Karate Chop, Close Combat, Cross Chop","56;57;979","57;979"
"58","Growlithe","Growlithe","FALSE","180","757",,,"0/10/15","15/15/15",,,"16","50",,,"499","1405",,,"Ember, Flamethrower, Body Slam","Ember, Body Slam, Flamethrower",,,"58;59","58;59"
"58","Growlithe (Hisuian)","Growlithe","FALSE",,"842",,,,"15/15/14",,,,"50",,,,"1495",,,,"Ember, Rock Slide, Crunch",,,"58;59","58;59"
"58","Growlithe (Shadow)","Growlithe","TRUE","164","722",,,"0/10/15","15/15/15",,,"16","50",,,"499","1405",,,"Ember, Flamethrower, Body Slam","Ember, Body Slam, Flamethrower",,,"58;59","58;59"
"59","Arcanine","Growlithe","FALSE","376","648","554","282","0/8/14","0/14/15","0/15/15","15/15/15","6.5","18.5","31.5","50","498","1497","2497","3425","Snarl, Wild Charge, Psychic Fangs","Snarl, Wild Charge, Psychic Fangs","Snarl, Crunch, Flamethrower","Snarl, Wild Charge, Psychic Fangs","58;59","59"
"59","Arcanine (Hisuian)","Growlithe","FALSE",,"835","617","340",,"0/14/10","0/10/15","15/15/15",,"18","30","50",,"1498","2485","3556",,"Snarl, Wild Charge, Rock Slide","Snarl, Rock Slide, Crunch","Snarl, Wild Charge, Rock Slide","58;59","59"
"59","Arcanine (Shadow)","Growlithe","TRUE",,"611","427","255",,"0/14/15","0/15/15","15/15/15",,"18.5","31.5","50",,"1497","2497","3425",,"Snarl, Wild Charge, Psychic Fangs","Snarl, Wild Charge, Psychic Fangs","Snarl, Wild Charge, Psychic Fangs","58;59","59"
"61","Poliwhirl","Poliwag","FALSE",,"373",,,,"6/15/15",,,,"49.5",,,,"1500",,,,"Bubble, Scald, Mud Bomb",,,"60;61;62","61;62"
"61","Poliwhirl (Shadow)","Poliwag","TRUE",,"356",,,,"6/15/15",,,,"49.5",,,,"1500",,,,"Bubble, Scald, Mud Bomb",,,"60;61;62","61;62"
"62","Poliwrath","Poliwag","FALSE",,"160","43","238",,"0/14/15","0/14/14","15/15/15",,"22","44","50",,"1500","2494","2923",,"Counter, Scald, Icy Wind","Counter, Icy Wind, Scald","Counter, Scald, Icy Wind","60;61;62","62"
"62","Poliwrath (Shadow)","Poliwag","TRUE",,"193","82","243",,"0/14/15","0/14/14","15/15/15",,"22","44","50",,"1500","2494","2923",,"Counter, Scald, Icy Wind","Counter, Icy Wind, Scald","Counter, Scald, Icy Wind","60;61;62","62"
"64","Kadabra","Abra","FALSE",,"970",,,,"2/15/14",,,,"27",,,,"1496",,,,"Psycho Cut, Shadow Ball, Return",,,"63;64;65","64;65"
"65","Alakazam","Abra","FALSE",,"875","623","366",,"1/15/15","0/14/15","15/15/15",,"18","30.5","50",,"1499","2500","3456",,"Psycho Cut, Fire Punch, Shadow Ball","Psycho Cut, Fire Punch, Shadow Ball","Psycho Cut, Fire Punch, Shadow Ball","63;64;65","65"
"65","Alakazam (Shadow)","Abra","TRUE",,"840","615","336",,"1/15/15","0/14/15","15/15/15",,"18","30.5","50",,"1499","2500","3456",,"Psycho Cut, Fire Punch, Shadow Ball","Psycho Cut, Fire Punch, Shadow Ball","Psycho Cut, Fire Punch, Shadow Ball","63;64;65","65"
"66","Machop","Machop","FALSE","37","166",,,"2/15/14","15/15/15",,,"15","50",,,"499","1445",,,"Karate Chop, Cross Chop, Brick Break","Karate Chop, Cross Chop, Return",,,"66;67;68","66;67;68"
"66","Machop (Shadow)","Machop","TRUE","13","171",,,"2/15/14","15/15/15",,,"15","50",,,"499","1445",,,"Karate Chop, Cross Chop, Brick Break","Karate Chop, Cross Chop, Brick Break",,,"66;67;68","66;67;68"
"67","Machoke","Machop","FALSE","20","92","221",,"0/15/10","0/15/14","15/15/15",,"9.5","28","50",,"499","1498","2296",,"Karate Chop, Cross Chop, Dynamic Punch","Karate Chop, Cross Chop, Return","Karate Chop, Cross Chop, Dynamic Punch",,"66;67;68","67;68"
"67","Machoke (Shadow)","Machop","TRUE","16","23","131",,"0/15/10","0/15/14","15/15/15",,"9.5","28","50",,"499","1498","2296",,"Karate Chop, Cross Chop, Dynamic Punch","Karate Chop, Cross Chop, Dynamic Punch","Karate Chop, Cross Chop, Dynamic Punch",,"66;67;68","67;68"
"68","Machamp","Machop","FALSE","27","33","30","144","0/7/11","0/14/11","0/15/14","15/15/15","6.5","18.5","31","50","499","1497","2491","3455","Karate Chop, Stone Edge, Cross Chop","Karate Chop, Cross Chop, Stone Edge","Karate Chop, Cross Chop, Stone Edge","Karate Chop, Cross Chop, Rock Slide","66;67;68","68"
"68","Machamp (Shadow)","Machop","TRUE",,"19","9","109",,"0/14/11","0/15/14","15/15/15",,"18.5","31","50",,"1497","2491","3455",,"Karate Chop, Cross Chop, Stone Edge","Karate Chop, Cross Chop, Stone Edge","Karate Chop, Cross Chop, Stone Edge","66;67;68","68"
"70","Weepinbell","Bellsprout","FALSE",,"581",,,,"1/15/15",,,,"40.5",,,,"1493",,,,"Bullet Seed, Power Whip, Sludge Bomb",,,"69;70;71","70;71"
"70","Weepinbell (Shadow)","Bellsprout","TRUE",,"561",,,,"1/15/15",,,,"40.5",,,,"1497",,,,"Bullet Seed, Power Whip, Sludge Bomb",,,"69;70;71","70;71"
"71","Victreebel","Bellsprout","FALSE",,"200","218","439",,"1/15/15","0/15/12","15/15/15",,"23","48.5","50",,"1500","2498","2748",,"Magical Leaf, Leaf Blade, Sludge Bomb","Magical Leaf, Leaf Blade, Sludge Bomb","Magical Leaf, Leaf Blade, Sludge Bomb","69;70;71","71"
"71","Victreebel (Shadow)","Bellsprout","TRUE",,"308","165","402",,"1/15/15","0/15/12","15/15/15",,"23","48.5","50",,"1500","2498","2748",,"Magical Leaf, Leaf Blade, Acid Spray","Magical Leaf, Leaf Blade, Sludge Bomb","Magical Leaf, Leaf Blade, Sludge Bomb","69;70;71","71"
"72","Tentacool","Tentacool","FALSE",,"891",,,,"15/15/15",,,,"50",,,,"1176",,,,"Poison Sting, Water Pulse, Wrap",,,"72;73","72;73"
"72","Tentacool (Shadow)","Tentacool","TRUE",,"880",,,,"15/15/15",,,,"50",,,,"1176",,,,"Poison Sting, Water Pulse, Wrap",,,"72;73","72;73"
"73","Tentacruel","Tentacool","FALSE",,"145","44","364",,"1/15/14","0/13/15","15/15/15",,"23.5","50","50",,"1496","2493","2738",,"Poison Jab, Acid Spray, Scald","Poison Jab, Scald, Blizzard","Poison Jab, Scald, Sludge Wave","72;73","73"
"73","Tentacruel (Shadow)","Tentacool","TRUE",,"151","65","382",,"1/15/14","0/13/15","15/15/15",,"23.5","50","50",,"1496","2493","2738",,"Poison Jab, Acid Spray, Scald","Poison Jab, Scald, Blizzard","Poison Jab, Scald, Sludge Wave","72;73","73"
"74","Geodude","Geodude","FALSE",,"847",,,,"15/15/15",,,,"50",,,,"1462",,,,"Rock Throw, Rock Slide, Dig",,,"74;75;76","74;75;76"
"74","Geodude (Alolan)","Geodude","FALSE",,"742",,,,"15/15/15",,,,"50",,,,"1462",,,,"Volt Switch, Rock Slide, Thunderbolt",,,"74;75;76","74;75;76"
"74","Geodude (Alolan) (Shadow)","Geodude","TRUE",,"718",,,,"15/15/15",,,,"50",,,,"1462",,,,"Volt Switch, Rock Slide, Thunderbolt",,,"74;75;76","74;75;76"
"74","Geodude (Shadow)","Geodude","TRUE",,"750",,,,"15/15/15",,,,"50",,,,"1462",,,,"Rock Throw, Rock Slide, Dig",,,"74;75;76","74;75;76"
"75","Graveler","Geodude","FALSE",,"632","659",,,"0/14/15","15/15/15",,,"30.5","50",,,"1500","2145",,,"Mud Slap, Stone Edge, Dig","Mud Slap, Stone Edge, Dig",,"74;75;76","75;76"
"75","Graveler (Alolan)","Geodude","FALSE",,"445","592",,,"0/14/15","15/15/15",,,"30.5","50",,,"1500","2145",,,"Volt Switch, Stone Edge, Rock Blast","Volt Switch, Stone Edge, Rock Blast",,"74;75;76","75;76"
"75","Graveler (Alolan) (Shadow)","Geodude","TRUE",,"390","561",,,"0/14/15","15/15/15",,,"30.5","50",,,"1500","2145",,,"Volt Switch, Stone Edge, Rock Blast","Volt Switch, Stone Edge, Rock Blast",,"74;75;76","75;76"
"75","Graveler (Shadow)","Geodude","TRUE",,"641","661",,,"0/14/15","15/15/15",,,"30.5","50",,,"1500","2145",,,"Mud Slap, Stone Edge, Dig","Mud Slap, Stone Edge, Dig",,"74;75;76","75;76"
"76","Golem","Geodude","FALSE",,"440","273","187",,"1/14/15","0/15/15","15/15/15",,"19","33.5","50",,"1497","2498","3334",,"Mud Slap, Stone Edge, Rock Blast","Mud Slap, Stone Edge, Rock Blast","Mud Slap, Stone Edge, Rock Blast","74;75;76","76"
"76","Golem (Alolan)","Geodude","FALSE",,"260","168","196",,"1/14/15","0/15/15","15/15/15",,"19","33.5","50",,"1497","2498","3334",,"Rollout, Wild Charge, Rock Blast","Rollout, Rock Blast, Wild Charge","Rollout, Wild Charge, Stone Edge","74;75;76","76"
"76","Golem (Alolan) (Shadow)","Geodude","TRUE",,"216","121","199",,"1/14/15","0/15/15","15/15/15",,"19","33.5","50",,"1497","2498","3334",,"Rollout, Wild Charge, Rock Blast","Rollout, Wild Charge, Rock Blast","Rollout, Wild Charge, Stone Edge","74;75;76","76"
"76","Golem (Shadow)","Geodude","TRUE",,"342","244","191",,"1/14/15","0/15/15","15/15/15",,"19","33.5","50",,"1497","2498","3334",,"Mud Slap, Stone Edge, Rock Blast","Mud Slap, Stone Edge, Rock Blast","Mud Slap, Stone Edge, Rock Blast","74;75;76","76"
"77","Ponyta","Ponyta","FALSE",,"730",,,,"0/15/14",,,,"37.5",,,,"1500",,,,"Ember, Flame Charge, Stomp",,,"77;78","77;78"
"77","Ponyta (Galarian)","Ponyta","FALSE","387","824",,,"0/12/11","0/15/14",,,"11.5","37.5",,,"500","1500",,,"Psycho Cut, Swift, Play Rough","Psycho Cut, Swift, Play Rough",,,"77;78","77;78"
"78","Rapidash","Ponyta","FALSE",,"380","130","338",,"0/13/15","0/15/14","15/15/15",,"23","47","50",,"1498","2499","2782",,"Incinerate, Drill Run, Flame Charge","Incinerate, Drill Run, Flame Charge","Incinerate, Drill Run, Flame Charge","77;78","78"
