"ID","Pokemon","Family","Shadow","Little_Rank","Great_Rank","Ultra_Rank","Master_Rank","Little_IVs","Great_IVs","Ultra_IVs","Master_IVs","Little_Level","Great_Level","Ultra_Level","Master_Level","Little_CP","Great_CP","Ultra_CP","Master_CP","Little_MoveSet","Great_MoveSet","Ultra_MoveSet","Master_MoveSet","Evo_Fam","Evo_Next"
"143","Snorlax (Shadow)","Snorlax","TRUE",,"219","283","66",,"1/15/14","0/12/15","15/15/15",,"17.5","29.5","50",,"1498","2491","3647",,"Lick, Body Slam, Superpower","Lick, Body Slam, Earthquake","Lick, Body Slam, Superpower","143;446","143;446"
"144","Articuno","Articuno","FALSE",,"349","144","131",,"0/15/15","0/13/15","15/15/15",,"18.5","32","50",,"1500","2496","3450",,"Ice Shard, Icy Wind, Ancient Power","Ice Shard, Icy Wind, Ancient Power","Ice Shard, Triple Axel, Ancient Power","144","144"
"144","Articuno (Galarian)","Articuno","FALSE",,"627","532","214",,"0/15/14","0/15/12","15/15/15",,"15.5","26","50",,"1498","2494","4059",,"Psycho Cut, Ancient Power, Brave Bird","Psycho Cut, Ancient Power, Brave Bird","Psycho Cut, Ancient Power, Brave Bird","144","144"
"144","Articuno (Shadow)","Articuno","TRUE",,"408","198","106",,"0/15/15","0/13/15","15/15/15",,"18.5","32","50",,"1500","2496","3450",,"Ice Shard, Icy Wind, Ancient Power","Ice Shard, Icy Wind, Ancient Power","Ice Shard, Triple Axel, Ancient Power","144","144"
"145","Zapdos","Zapdos","FALSE",,"248","149","82",,"0/12/12","0/13/13","15/15/15",,"16","26.5","50",,"1495","2498","3987",,"Thunder Shock, Drill Peck, Thunder","Thunder Shock, Drill Peck, Thunderbolt","Thunder Shock, Drill Peck, Thunderbolt","145","145"
"145","Zapdos (Galarian)","Zapdos","FALSE",,"606","413","140",,"3/15/14","1/15/15","15/15/15",,"15.5","26","50",,"1495","2492","4012",,"Counter, Ancient Power, Brave Bird","Counter, Ancient Power, Brave Bird","Counter, Ancient Power, Brave Bird","145","145"
"145","Zapdos (Shadow)","Zapdos","TRUE",,"152","96","60",,"0/12/12","0/13/13","15/15/15",,"16","26.5","50",,"1495","2498","3987",,"Thunder Shock, Drill Peck, Thunderbolt","Thunder Shock, Drill Peck, Thunderbolt","Thunder Shock, Drill Peck, Thunderbolt","145","145"
"146","Moltres","Moltres","FALSE",,"602","599","207",,"1/15/14","0/14/12","15/15/15",,"16","27","50",,"1493","2500","3917",,"Fire Spin, Sky Attack, Ancient Power","Fire Spin, Sky Attack, Overheat","Wing Attack, Sky Attack, Overheat","146","146"
"146","Moltres (Galarian)","Moltres","FALSE",,"57","32","15",,"0/13/12","1/15/15","15/15/15",,"18","29.5","50",,"1493","2492","3580",,"Sucker Punch, Ancient Power, Brave Bird","Sucker Punch, Ancient Power, Payback","Sucker Punch, Ancient Power, Payback","146","146"
"146","Moltres (Shadow)","Moltres","TRUE",,"568","412","122",,"1/15/14","0/14/12","15/15/15",,"16","27","50",,"1493","2500","3917",,"Fire Spin, Sky Attack, Ancient Power","Fire Spin, Sky Attack, Ancient Power","Fire Spin, Sky Attack, Ancient Power","146","146"
"148","Dragonair","Dratini","FALSE",,"105",,,,"1/15/15",,,,"34",,,,"1497",,,,"Dragon Breath, Aqua Tail, Body Slam",,,"147;148;149","148;149"
"148","Dragonair (Shadow)","Dratini","TRUE",,"86",,,,"1/15/15",,,,"34",,,,"1497",,,,"Dragon Breath, Body Slam, Aqua Tail",,,"147;148;149","148;149"
"149","Dragonite","Dratini","FALSE",,"132","87","16",,"3/15/14","0/13/15","15/15/15",,"14.5","24.5","50",,"1495","2499","4287",,"Dragon Breath, Dragon Claw, Superpower","Dragon Breath, Dragon Claw, Superpower","Dragon Breath, Dragon Claw, Superpower","147;148;149","149"
"149","Dragonite (Shadow)","Dratini","TRUE",,"103","40","19",,"3/15/14","0/13/15","15/15/15",,"14.5","24.5","50",,"1495","2499","4287",,"Dragon Breath, Dragon Claw, Superpower","Dragon Breath, Dragon Claw, Superpower","Dragon Breath, Dragon Claw, Superpower","147;148;149","149"
"150","Mewtwo","Mewtwo","FALSE",,,"482","31",,,"1/15/13","15/15/15",,,"22","50",,,"2494","4724",,,"Psycho Cut, Psystrike, Shadow Ball","Psycho Cut, Psystrike, Shadow Ball","150","150"
"150","Mewtwo (Armored)","Mewtwo","FALSE",,,"125","159",,,"0/12/13","15/15/15",,,"30","50",,,"2499","3603",,,"Confusion, Psystrike, Dynamic Punch","Confusion, Psystrike, Dynamic Punch","150","150"
"150","Mewtwo (Shadow)","Mewtwo","TRUE",,"424","416","23",,"4/15/15","1/15/13","15/15/15",,"13","22","50",,"1500","2494","4724",,"Psycho Cut, Psystrike, Thunderbolt","Psycho Cut, Psystrike, Shadow Ball","Psycho Cut, Psystrike, Shadow Ball","150","150"
"151","Mew","Mew","FALSE",,"292","206","94",,"0/10/13","0/15/10","15/15/15",,"17.5","29","50",,"1498","2493","3691",,"Shadow Claw, Wild Charge, Surf","Shadow Claw, Dragon Claw, Wild Charge","Shadow Claw, Surf, Wild Charge","151","151"
"153","Bayleef","Chikorita","FALSE",,"366",,,,"3/15/14",,,,"50",,,,"1494",,,,"Magical Leaf, Ancient Power, Energy Ball",,,"152;153;154","153;154"
"153","Bayleef (Shadow)","Chikorita","TRUE",,"409",,,,"3/15/14",,,,"50",,,,"1494",,,,"Magical Leaf, Ancient Power, Energy Ball",,,"152;153;154","153;154"
"154","Meganium","Chikorita","FALSE",,"75","85","319",,"0/10/15","0/14/15","15/15/15",,"24","50","50",,"1499","2500","2725",,"Vine Whip, Frenzy Plant, Earthquake","Vine Whip, Frenzy Plant, Earthquake","Vine Whip, Frenzy Plant, Earthquake","152;153;154","154"
"154","Meganium (Shadow)","Chikorita","TRUE",,"120","70","361",,"0/10/15","0/14/15","15/15/15",,"24","50","50",,"1499","2500","2725",,"Vine Whip, Frenzy Plant, Earthquake","Vine Whip, Frenzy Plant, Earthquake","Vine Whip, Frenzy Plant, Earthquake","152;153;154","154"
"156","Quilava","Cyndaquil","FALSE",,"791",,,,"0/13/15",,,,"40",,,,"1496",,,,"Ember, Flame Charge, Dig",,,"155;156;157","156;157"
"156","Quilava (Shadow)","Cyndaquil","TRUE",,"795",,,,"0/13/15",,,,"40",,,,"1496",,,,"Ember, Flame Charge, Dig",,,"155;156;157","156;157"
"157","Typhlosion","Cyndaquil","FALSE",,"252","132","161",,"0/15/13","0/13/15","15/15/15",,"19.5","35","50",,"1488","2497","3266",,"Incinerate, Blast Burn, Thunder Punch","Incinerate, Blast Burn, Thunder Punch","Incinerate, Blast Burn, Thunder Punch","155;156;157","157"
"157","Typhlosion (Hisuian)","Cyndaquil","FALSE",,"594","399","203",,"0/11/12","1/15/14","15/15/15",,"19","32","50",,"1500","2499","3385",,"Hex, Fire Punch, Shadow Ball","Hex, Fire Punch, Shadow Ball","Hex, Shadow Ball, Fire Punch","155;156;157","157"
"157","Typhlosion (Shadow)","Cyndaquil","TRUE",,"194","151","164",,"0/15/13","0/13/15","15/15/15",,"19.5","35","50",,"1488","2497","3266",,"Incinerate, Blast Burn, Thunder Punch","Incinerate, Blast Burn, Thunder Punch","Incinerate, Blast Burn, Thunder Punch","155;156;157","157"
"158","Totodile","Totodile","FALSE",,"925",,,,"15/15/15",,,,"50",,,,"1279",,,,"Water Gun, Crunch, Water Pulse",,,"158;159;160","158;159;160"
"158","Totodile (Shadow)","Totodile","TRUE",,"938",,,,"15/15/15",,,,"50",,,,"1279",,,,"Water Gun, Crunch, Water Pulse",,,"158;159;160","158;159;160"
"159","Croconaw","Totodile","FALSE",,"519",,,,"0/13/15",,,,"37.5",,,,"1499",,,,"Water Gun, Crunch, Ice Punch",,,"158;159;160","159;160"
"159","Croconaw (Shadow)","Totodile","TRUE",,"446",,,,"0/13/15",,,,"37.5",,,,"1499",,,,"Water Gun, Crunch, Ice Punch",,,"158;159;160","159;160"
"160","Feraligatr","Totodile","FALSE",,"3","8","45",,"0/11/13","1/15/14","15/15/15",,"20","35.5","50",,"1493","2496","3230",,"Shadow Claw, Hydro Cannon, Ice Beam","Shadow Claw, Hydro Cannon, Ice Beam","Shadow Claw, Hydro Cannon, Ice Beam","158;159;160","160"
"160","Feraligatr (Shadow)","Totodile","TRUE",,"5","2","55",,"0/11/13","1/15/14","15/15/15",,"20","35.5","50",,"1493","2496","3230",,"Shadow Claw, Hydro Cannon, Ice Beam","Shadow Claw, Hydro Cannon, Ice Beam","Shadow Claw, Hydro Cannon, Ice Beam","158;159;160","160"
"162","Furret","Sentret","FALSE",,"211","630",,,"1/15/14","15/15/14",,,"35.5","50",,,"1500","1987",,,"Sucker Punch, Brick Break, Dig","Sucker Punch, Brick Break, Dig",,"161;162","162"
"163","Hoothoot","Hoothoot","FALSE","32",,,,"0/15/14",,,,"33.5",,,,"499",,,,"Feint Attack, Aerial Ace, Night Shade",,,,"163;164","163;164"
"164","Noctowl","Hoothoot","FALSE","224","243","310","550","2/14/14","1/14/15","15/15/15","15/15/15","9.5","28.5","50","50","499","1494","2288","2288","Wing Attack, Sky Attack, Shadow Ball","Wing Attack, Sky Attack, Night Shade","Wing Attack, Night Shade, Sky Attack","Wing Attack, Sky Attack, Shadow Ball","163;164","164"
"166","Ledian","Ledyba","FALSE",,"388",,,,"13/15/15",,,,"50",,,,"1500",,,,"Counter, Aerial Ace, Dynamic Punch",,,"165;166","166"
"166","Ledian (Shadow)","Ledyba","TRUE",,"350",,,,"13/15/15",,,,"50",,,,"1500",,,,"Counter, Aerial Ace, Dynamic Punch",,,"165;166","166"
"168","Ariados","Spinarak","FALSE",,"78",,,,"0/14/15",,,,"35",,,,"1497",,,,"Poison Sting, Lunge, Trailblaze",,,"167;168","168"
"169","Crobat","Zubat","FALSE",,"565","414","417",,"0/15/12","0/15/14","15/15/15",,"21.5","41.5","50",,"1496","2500","2992",,"Air Slash, Poison Fang, Shadow Ball","Air Slash, Poison Fang, Shadow Ball","Air Slash, Cross Poison, Shadow Ball","41;42;169","169"
"169","Crobat (Shadow)","Zubat","TRUE",,"577","318","398",,"0/15/12","0/15/14","15/15/15",,"21.5","41.5","50",,"1496","2500","2992",,"Air Slash, Poison Fang, Shadow Ball","Air Slash, Poison Fang, Shadow Ball","Air Slash, Cross Poison, Shadow Ball","41;42;169","169"
"170","Chinchou","Chinchou","FALSE","296","781",,,"0/13/15","15/15/15",,,"18","50",,,"500","1265",,,"Bubble, Thunderbolt, Water Pulse","Bubble, Thunderbolt, Water Pulse",,,"170;171","170;171"
"171","Lanturn","Chinchou","FALSE","125","69","222","483","0/10/12","0/13/14","15/15/15","15/15/15","9.5","28","50","50","499","1496","2357","2357","Water Gun, Surf, Thunderbolt","Water Gun, Surf, Thunderbolt","Spark, Surf, Thunderbolt","Water Gun, Surf, Thunderbolt","170;171","171"
"172","Pichu","Pikachu","FALSE","252",,,,"9/15/15",,,,"50",,,,"492",,,,"Thunder Shock, Thunder Punch, Disarming Voice",,,,"25;26;172","172"
"173","Cleffa","Clefairy","FALSE","418",,,,"0/15/15",,,,"32.5",,,,"500",,,,"Zen Headbutt, Swift, Grass Knot",,,,"35;36;173","173"
"175","Togepi","Togepi","FALSE","319",,,,"1/15/15",,,,"34",,,,"499",,,,"Peck, Ancient Power, Psyshock",,,,"175;176;468","175;176;468"
"176","Togetic","Togepi","FALSE","48","65","591",,"0/15/11","0/14/14","15/15/15",,"11.5","38.5","50",,"499","1496","1931",,"Fairy Wind, Aerial Ace, Ancient Power","Fairy Wind, Aerial Ace, Dazzling Gleam","Fairy Wind, Aerial Ace, Ancient Power",,"175;176;468","176;468"
"177","Natu","Natu","FALSE","265",,,,"1/15/15",,,,"17.5",,,,"500",,,,"Quick Attack, Drill Peck, Psyshock",,,,"177;178","177;178"
"177","Natu (Shadow)","Natu","TRUE","286",,,,"1/15/15",,,,"17.5",,,,"500",,,,"Quick Attack, Drill Peck, Psyshock",,,,"177;178","177;178"
"178","Xatu","Natu","FALSE","390","884","656","602","0/13/5","0/13/15","15/15/15","15/15/15","9","26","50","50","500","1499","2474","2474","Air Slash, Aerial Ace, Future Sight","Air Slash, Aerial Ace, Future Sight","Air Slash, Aerial Ace, Future Sight","Air Slash, Aerial Ace, Future Sight","177;178","178"
"178","Xatu (Shadow)","Natu","TRUE","378","850","645","601","0/13/5","0/13/15","15/15/15","15/15/15","9","26","50","50","500","1499","2474","2474","Air Slash, Aerial Ace, Future Sight","Air Slash, Aerial Ace, Future Sight","Air Slash, Aerial Ace, Future Sight","Air Slash, Aerial Ace, Future Sight","177;178","178"
"180","Flaaffy","Mareep","FALSE",,"868",,,,"0/15/14",,,,"47",,,,"1497",,,,"Charge Beam, Trailblaze, Power Gem",,,"179;180;181","180;181"
"180","Flaaffy (Shadow)","Mareep","TRUE",,"898",,,,"0/15/14",,,,"47",,,,"1497",,,,"Charge Beam, Trailblaze, Power Gem",,,"179;180;181","180;181"
"181","Ampharos","Mareep","FALSE",,"309","178","261",,"0/13/11","0/13/15","15/15/15",,"20","36","50",,"1499","2499","3225",,"Volt Switch, Brutal Swing, Trailblaze","Volt Switch, Brutal Swing, Trailblaze","Volt Switch, Brutal Swing, Thunder Punch","179;180;181","181"
"181","Ampharos (Shadow)","Mareep","TRUE",,"268","155","272",,"0/13/11","0/13/15","15/15/15",,"20","36","50",,"1499","2499","3225",,"Volt Switch, Brutal Swing, Trailblaze","Volt Switch, Brutal Swing, Trailblaze","Volt Switch, Brutal Swing, Thunder Punch","179;180;181","181"
"182","Bellossom","Bellossom","FALSE","144","213","294","491","0/14/13","1/14/14","9/15/15","15/15/15","8.5","25","50","50","498","1499","2498","2578","Bullet Seed, Leaf Blade, Dazzling Gleam","Bullet Seed, Leaf Blade, Return","Bullet Seed, Leaf Blade, Return","Bullet Seed, Leaf Blade, Return","43;44;182","182"
"182","Bellossom (Shadow)","Bellossom","TRUE","183","203","264","510","0/14/13","1/14/14","9/15/15","15/15/15","8.5","25","50","50","498","1499","2498","2578","Bullet Seed, Leaf Blade, Dazzling Gleam","Bullet Seed, Leaf Blade, Dazzling Gleam","Bullet Seed, Leaf Blade, Dazzling Gleam","Bullet Seed, Leaf Blade, Dazzling Gleam","43;44;182","182"
"184","Azumarill","Marill","FALSE",,"9","629",,,"0/15/15","15/15/15",,,"45.5","50",,,"1498","1795",,,"Bubble, Ice Beam, Play Rough","Bubble, Play Rough, Ice Beam",,"183;184;298","184;298"
"185","Sudowoodo","Sudowoodo","FALSE","331","680","497","547","0/13/14","0/14/11","15/15/15","15/15/15","9","27","50","50","498","1496","2428","2428","Counter, Meteor Beam, Trailblaze","Counter, Meteor Beam, Trailblaze","Counter, Meteor Beam, Trailblaze","Counter, Meteor Beam, Trailblaze","185;438","185;438"
"185","Sudowoodo (Shadow)","Sudowoodo","TRUE","302","786","586","558","0/13/14","0/14/11","15/15/15","15/15/15","9","27","50","50","498","1496","2428","2428","Counter, Meteor Beam, Trailblaze","Counter, Meteor Beam, Trailblaze","Counter, Meteor Beam, Trailblaze","Counter, Meteor Beam, Trailblaze","185;438","185;438"
"186","Politoed","Politoed","FALSE",,"223","133","346",,"0/15/11","0/15/14","15/15/15",,"23.5","48.5","50",,"1498","2498","2769",,"Mud Shot, Weather Ball (Water), Earthquake","Mud Shot, Surf, Blizzard","Bubble, Weather Ball (Water), Ice Beam","60;61;186","186"
"186","Politoed (Shadow)","Politoed","TRUE",,"179","93","325",,"0/15/11","0/15/14","15/15/15",,"23.5","48.5","50",,"1498","2498","2769",,"Mud Shot, Weather Ball (Water), Earthquake","Mud Shot, Weather Ball (Water), Blizzard","Bubble, Weather Ball (Water), Ice Beam","60;61;186","186"
"189","Jumpluff","Hoppip","FALSE",,"17","542",,,"0/14/14","15/15/15",,,"43","50",,,"1500","1850",,,"Fairy Wind, Aerial Ace, Energy Ball","Fairy Wind, Aerial Ace, Acrobatics",,"187;188;189","189"
"189","Jumpluff (Shadow)","Hoppip","TRUE",,"6","506",,,"0/14/14","15/15/15",,,"43","50",,,"1500","1850",,,"Fairy Wind, Aerial Ace, Energy Ball","Fairy Wind, Aerial Ace, Acrobatics",,"187;188;189","189"
"190","Aipom","Aipom","FALSE",,"421",,,,"14/15/14",,,,"49.5",,,,"1500",,,,"Astonish, Swift, Aerial Ace",,,"190;424","190;424"
"190","Aipom (Shadow)","Aipom","TRUE",,"352",,,,"14/15/14",,,,"49.5",,,,"1500",,,,"Astonish, Swift, Aerial Ace",,,"190;424","190;424"
"192","Sunflora","Sunkern","FALSE",,"696","605",,,"0/15/14","15/15/15",,,"26.5","50",,,"1492","2421",,,"Bullet Seed, Leaf Storm, Sludge Bomb","Bullet Seed, Sludge Bomb, Leaf Storm",,"191;192","192"
"193","Yanma","Yanma","FALSE",,"703",,,,"0/14/15",,,,"49.5",,,,"1498",,,,"Quick Attack, Aerial Ace, Silver Wind",,,"193;469","193;469"
"194","Wooper","Wooper","FALSE","35",,,,"0/15/15",,,,"35.5",,,,"500",,,,"Mud Shot, Mud Bomb, Body Slam",,,,"194;195","194;195"
"194","Wooper (Shadow)","Wooper","TRUE","44",,,,"0/15/15",,,,"35.5",,,,"500",,,,"Mud Shot, Mud Bomb, Body Slam",,,,"194;195","194;195"
"195","Quagsire","Wooper","FALSE","22","32","287","492","0/5/14","0/15/14","15/15/15","15/15/15","10","29","50","50","498","1494","2252","2252","Mud Shot, Aqua Tail, Stone Edge","Mud Shot, Aqua Tail, Stone Edge","Mud Shot, Aqua Tail, Stone Edge","Mud Shot, Aqua Tail, Mud Bomb","194;195","195"
"195","Quagsire (Shadow)","Wooper","TRUE","23","10","225","480","0/5/14","0/15/14","15/15/15","15/15/15","10","29","50","50","498","1494","2252","2252","Mud Shot, Stone Edge, Aqua Tail","Mud Shot, Aqua Tail, Stone Edge","Mud Shot, Aqua Tail, Stone Edge","Mud Shot, Aqua Tail, Mud Bomb","194;195","195"
"196","Espeon","Eevee","FALSE","384","676","557","315","3/15/15","0/15/15","1/15/15","15/15/15","6","17.5","29","50","497","1491","2500","3583","Confusion, Psychic Fangs, Shadow Ball","Confusion, Psychic Fangs, Shadow Ball","Confusion, Psychic Fangs, Shadow Ball","Confusion, Psychic Fangs, Shadow Ball","133;196","196"
"197","Umbreon","Eevee","FALSE","17","82","71","356","0/12/3","0/15/14","15/15/15","15/15/15","9.5","27.5","50","50","498","1497","2416","2416","Snarl, Last Resort, Foul Play","Snarl, Foul Play, Last Resort","Snarl, Foul Play, Last Resort","Snarl, Foul Play, Last Resort","133;197","197"
"198","Murkrow","Murkrow","FALSE",,"775",,,,"0/15/14",,,,"43.5",,,,"1498",,,,"Feint Attack, Drill Peck, Foul Play",,,"198;430","198;430"
"198","Murkrow (Shadow)","Murkrow","TRUE",,"768",,,,"0/15/14",,,,"43.5",,,,"1498",,,,"Feint Attack, Drill Peck, Foul Play",,,"198;430","198;430"
"199","Slowking","Slowking","FALSE",,"553","397","484",,"0/13/15","0/14/14","15/15/15",,"22.5","45.5","50",,"1493","2499","2877",,"Water Gun, Surf, Psychic","Water Gun, Surf, Psychic","Confusion, Surf, Scald","79;199","199"
"199","Slowking (Galarian)","Slowking","FALSE",,"828","540","456",,"0/14/13","0/15/14","15/15/15",,"21","39.5","50",,"1498","2493","3072",,"Hex, Surf, Shadow Ball","Hex, Surf, Shadow Ball","Confusion, Surf, Shadow Ball","79;199","199"
"199","Slowking (Shadow)","Slowking","TRUE",,"584","483","502",,"0/13/15","0/14/14","15/15/15",,"22.5","45.5","50",,"1493","2499","2877",,"Water Gun, Surf, Psychic","Water Gun, Surf, Psychic","Confusion, Surf, Scald","79;199","199"
"200","Misdreavus","Misdreavus","FALSE",,"425","610",,,"1/15/15","15/15/14",,,"29.5","50",,,"1498","2178",,,"Psywave, Dark Pulse, Shadow Sneak","Astonish, Dark Pulse, Shadow Sneak",,"200;429","200;429"
"200","Misdreavus (Shadow)","Misdreavus","TRUE",,"466","593",,,"1/15/15","15/15/14",,,"29.5","50",,,"1498","2178",,,"Astonish, Dark Pulse, Shadow Sneak","Astonish, Dark Pulse, Shadow Sneak",,"200;429","200;429"
"201","Unown","Unown","FALSE",,"975",,,,"15/15/15",,,,"50",,,,"1339",,,,"Hidden Power (Psychic), Struggle, NA",,,"201","201"
"202","Wobbuffet","Wobbuffet","FALSE","34","385",,,"0/15/9","15/15/15",,,"21.5","50",,,"500","1160",,,"Counter, Mirror Coat, NA","Counter, Return, Mirror Coat",,,"202;360","202;360"
"202","Wobbuffet (Shadow)","Wobbuffet","TRUE","84","638",,,"0/15/9","15/15/15",,,"21.5","50",,,"496","1160",,,"Counter, Mirror Coat, Frustration","Counter, Mirror Coat, Frustration",,,"202;360","202;360"
"203","Girafarig","Girafarig","FALSE",,"330","444",,,"0/15/12","15/15/15",,,"28","50",,,"1486","2314",,,"Confusion, Psychic Fangs, Trailblaze","Double Kick, Psychic Fangs, Trailblaze",,"203;981","203;981"
"203","Girafarig (Shadow)","Girafarig","TRUE",,"341","388",,,"0/15/12","15/15/15",,,"28","50",,,"1486","2314",,,"Confusion, Psychic Fangs, Trailblaze","Double Kick, Psychic Fangs, Trailblaze",,"203;981","203;981"
"204","Pineco","Pineco","FALSE",,"952",,,,"15/15/15",,,,"50",,,,"1253",,,,"Bug Bite, Rock Tomb, Return",,,"204;205","204;205"
"204","Pineco (Shadow)","Pineco","TRUE",,"934",,,,"15/15/15",,,,"50",,,,"1253",,,,"Bug Bite, Rock Tomb, Sand Tomb",,,"204;205","204;205"
"205","Forretress","Pineco","FALSE",,"265","174","508",,"0/9/15","9/15/15","15/15/15",,"25.5","50","50",,"1496","2499","2580",,"Volt Switch, Earthquake, Mirror Shot","Volt Switch, Earthquake, Mirror Shot","Volt Switch, Mirror Shot, Heavy Slam","204;205","205"
"205","Forretress (Shadow)","Pineco","TRUE",,"329","241","506",,"0/9/15","9/15/15","15/15/15",,"25.5","50","50",,"1496","2499","2580",,"Volt Switch, Earthquake, Mirror Shot","Volt Switch, Earthquake, Mirror Shot","Volt Switch, Mirror Shot, Heavy Slam","204;205","205"
"206","Dunsparce","Dunsparce","FALSE",,"16","559",,,"0/14/12","15/15/15",,,"40","50",,,"1496","1909",,,"Rollout, Drill Run, Rock Slide","Rollout, Drill Run, Rock Slide",,"206;982","206;982"
"207","Gligar","Gligar","FALSE",,"135","590",,,"0/15/12","15/15/15",,,"33","50",,,"1493","2099",,,"Fury Cutter, Aerial Ace, Dig","Fury Cutter, Night Slash, Aerial Ace",,"207;472","207;472"
"207","Gligar (Shadow)","Gligar","TRUE",,"104","598",,,"0/15/12","15/15/15",,,"33","50",,,"1493","2099",,,"Fury Cutter, Aerial Ace, Dig","Wing Attack, Aerial Ace, Night Slash",,"207;472","207;472"
"208","Steelix","Onix","FALSE","90","39","21","244","2/15/14","0/14/15","2/15/15","15/15/15","8","24","49.5","50","497","1493","2497","2729","Dragon Tail, Breaking Swipe, Crunch","Dragon Tail, Psychic Fangs, Crunch","Dragon Tail, Psychic Fangs, Crunch","Dragon Tail, Breaking Swipe, Psychic Fangs","95;208","208"
"208","Steelix (Shadow)","Onix","TRUE","74","55","17","279","2/15/14","0/14/15","2/15/15","15/15/15","8","24","49.5","50","497","1493","2497","2729","Dragon Tail, Breaking Swipe, Crunch","Dragon Tail, Psychic Fangs, Crunch","Dragon Tail, Psychic Fangs, Crunch","Dragon Tail, Breaking Swipe, Psychic Fangs","95;208","208"
"209","Snubbull","Snubbull","FALSE",,"912",,,,"15/15/14",,,,"50",,,,"1399",,,,"Tackle, Crunch, Brick Break",,,"209;210","209;210"
"209","Snubbull (Shadow)","Snubbull","TRUE",,"914",,,,"15/15/14",,,,"50",,,,"1399",,,,"Tackle, Crunch, Brick Break",,,"209;210","209;210"
"210","Granbull","Snubbull","FALSE",,"438","344","409",,"0/15/15","0/15/14","15/15/15",,"22","44","50",,"1494","2490","2885",,"Charm, Close Combat, Crunch","Charm, Close Combat, Crunch","Snarl, Close Combat, Crunch","209;210","210"
"210","Granbull (Shadow)","Snubbull","TRUE",,"280","277","355",,"0/15/15","0/15/14","15/15/15",,"22","44","50",,"1494","2490","2885",,"Charm, Close Combat, Crunch","Charm, Close Combat, Crunch","Snarl, Close Combat, Crunch","209;210","210"
"211","Qwilfish","Qwilfish","FALSE","72","35","220",,"6/15/15","0/12/14","15/15/15",,"9","28","50",,"499","1490","2318",,"Poison Sting, Aqua Tail, Ice Beam","Poison Sting, Aqua Tail, Ice Beam","Poison Sting, Aqua Tail, Ice Beam",,"211;904","211;904"
"211","Qwilfish (Hisuian)","Qwilfish","FALSE",,"121","142",,,"0/15/15","15/15/15",,,"26.5","50",,,"1497","2415",,,"Poison Sting, Aqua Tail, Shadow Ball","Poison Jab, Aqua Tail, Dark Pulse",,"211;904","211;904"
"212","Scizor","Scyther","FALSE",,"185","196","197",,"1/15/15","0/15/15","15/15/15",,"18.5","32","50",,"1497","2498","3393",,"Fury Cutter, Night Slash, Trailblaze","Fury Cutter, Night Slash, Trailblaze","Fury Cutter, Night Slash, X-Scissor","123;212","212"
"212","Scizor (Shadow)","Scyther","TRUE",,"208","179","183",,"1/15/15","0/15/15","15/15/15",,"18.5","32","50",,"1497","2498","3393",,"Fury Cutter, Night Slash, Trailblaze","Fury Cutter, Night Slash, Trailblaze","Bullet Punch, Night Slash, Iron Head","123;212","212"
"213","Shuckle","Shuckle","FALSE","1",,,,"15/15/15",,,,"50",,,,"458",,,,"Rock Throw, Stone Edge, Rock Blast",,,,"213","213"
"213","Shuckle (Shadow)","Shuckle","TRUE","2",,,,"15/15/15",,,,"50",,,,"458",,,,"Rock Throw, Stone Edge, Rock Blast",,,,"213","213"
"214","Heracross","Heracross","FALSE",,"642","373","206",,"0/15/15","0/14/13","15/15/15",,"18","30.5","50",,"1497","2500","3506",,"Counter, Megahorn, Rock Blast","Counter, Rock Blast, Megahorn","Counter, Close Combat, Rock Blast","214","214"
"215","Sneasel","Sneasel","FALSE","350","731","604",,"0/11/10","1/15/14","15/15/15",,"9.5","27.5","50",,"500","1499","2319",,"Ice Shard, Avalanche, Foul Play","Ice Shard, Avalanche, Foul Play","Ice Shard, Avalanche, Foul Play",,"215;461","215;461"
"215","Sneasel (Hisuian)","Sneasel","FALSE",,"361","359",,,"1/15/14","15/15/15",,,"27.5","50",,,"1499","2319",,,"Poison Jab, Close Combat, Aerial Ace","Poison Jab, Close Combat, Aerial Ace",,"215;461","215;461"
"215","Sneasel (Hisuian) (Shadow)","Sneasel","TRUE",,"359","345",,,"1/15/14","15/15/15",,,"27.5","50",,,"1499","2319",,,"Poison Jab, Close Combat, Aerial Ace","Poison Jab, Close Combat, Aerial Ace",,"215;461","215;461"
"215","Sneasel (Shadow)","Sneasel","TRUE","317","764","637",,"0/11/10","1/15/14","15/15/15",,"9.5","27.5","50",,"500","1499","2319",,"Ice Shard, Avalanche, Foul Play","Ice Shard, Avalanche, Foul Play","Ice Shard, Avalanche, Foul Play",,"215;461","215;461"
"216","Teddiursa","Teddiursa","FALSE",,"681",,,,"15/15/14",,,,"50",,,,"1482",,,,"Lick, Swift, Cross Chop",,,"216;217;901","216;217;901"
"216","Teddiursa (Shadow)","Teddiursa","TRUE",,"604",,,,"15/15/14",,,,"50",,,,"1482",,,,"Lick, Swift, Cross Chop",,,"216;217;901","216;217;901"
"217","Ursaring","Teddiursa","FALSE",,"101","136","151",,"0/14/15","0/15/13","15/15/15",,"19","33.5","50",,"1499","2500","3329",,"Shadow Claw, Swift, Close Combat","Shadow Claw, Swift, Close Combat","Shadow Claw, Close Combat, Swift","216;217;901","217;901"
"217","Ursaring (Shadow)","Teddiursa","TRUE",,"56","49","104",,"0/14/15","0/15/13","15/15/15",,"19","33.5","50",,"1499","2500","3329",,"Shadow Claw, Swift, Close Combat","Shadow Claw, Swift, Close Combat","Shadow Claw, Swift, Close Combat","216;217;901","217;901"
"219","Magcargo","Slugma","FALSE",,"369","635",,,"0/15/14","15/15/15",,,"38.5","50",,,"1492","1924",,,"Incinerate, Rock Tomb, Overheat","Incinerate, Stone Edge, Overheat",,"218;219","219"
"220","Swinub","Swinub","FALSE","66",,,,"0/15/15",,,,"27.5",,,,"499",,,,"Powder Snow, Icy Wind, Body Slam",,,,"220;221;473","220;221;473"
"220","Swinub (Shadow)","Swinub","TRUE","78",,,,"0/15/15",,,,"27.5",,,,"499",,,,"Powder Snow, Icy Wind, Body Slam",,,,"220;221;473","220;221;473"
"221","Piloswine","Swinub","FALSE","210","234","158","288","4/15/15","0/15/10","5/15/12","15/15/15","8","24.5","50","50","500","1497","2498","2652","Powder Snow, Avalanche, High Horsepower","Powder Snow, Avalanche, High Horsepower","Powder Snow, Avalanche, High Horsepower","Powder Snow, Avalanche, High Horsepower","220;221;473","221;473"
