"ID","Pokemon","Family","Shadow","Great_Rank","Little_Rank","Ultra_Rank","Master_Rank","Great_IVs","Little_IVs","Ultra_IVs","Master_IVs","Great_Level","Little_Level","Ultra_Level","Master_Level","Great_CP","Little_CP","Ultra_CP","Master_CP","Great_MoveSet","Little_MoveSet","Ultra_MoveSet","Master_MoveSet","Evo_Fam","Evo_Next"
"748","Toxapex","Mareanie","FALSE",,"232",,,,"0/13/10",,,,"12",,,,"497",,,,"Poison Jab, Brine, Sludge Wave",,,"747;748","748"
"751","Dewpider","Dewpider","FALSE",,"99",,,,"0/15/15",,,,"29.5",,,,"499",,,,"Bug Bite, Water Pulse, Bubble Beam",,,"751;752","751;752"
"752","Araquanid","Dewpider","FALSE",,"233",,,,"0/5/14",,,,"11",,,,"499",,,,"Bug Bite, Bug Buzz, Water Pulse",,,"751;752","752"
"755","Morelull","Morelull","FALSE",,"135",,,,"0/13/14",,,,"19.5",,,,"500",,,,"Astonish, Seed Bomb, Dazzling Gleam",,,"755;756","755;756"
"756","Shiinotic","Morelull","FALSE",,"192",,,,"0/10/14",,,,"10.5",,,,"500",,,,"Astonish, Moonblast, Seed Bomb",,,"755;756","756"
"757","Salandit","Salandit","FALSE",,"275",,,,"0/13/15",,,,"17.5",,,,"500",,,,"Poison Jab, Flamethrower, Poison Fang",,,"757;758","757;758"
"758","Salazzle","Salandit","FALSE",,"228",,,,"6/15/14",,,,"7.5",,,,"500",,,,"Incinerate, Poison Fang, Fire Blast",,,"757;758","758"
"759","Stufful","Stufful","FALSE",,"315",,,,"0/13/15",,,,"14.5",,,,"497",,,,"Tackle, Superpower, Stomp",,,"759;760","759;760"
"760","Bewear","Stufful","FALSE",,"134",,,,"8/15/15",,,,"6",,,,"498",,,,"Shadow Claw, Superpower, Stomp",,,"759;760","760"
"761","Bounsweet","Bounsweet","FALSE",,"165",,,,"11/15/14",,,,"50",,,,"496",,,,"Razor Leaf, Energy Ball, Draining Kiss",,,"761;762;763","761;762;763"
"762","Steenee","Bounsweet","FALSE",,"168",,,,"0/15/15",,,,"27.5",,,,"499",,,,"Razor Leaf, Triple Axel, Grass Knot",,,"761;762;763","762;763"
"763","Tsareena","Bounsweet","FALSE",,"322",,,,"0/15/15",,,,"6.5",,,,"500",,,,"Magical Leaf, Triple Axel, Grass Knot",,,"761;762;763","763"
"765","Oranguru","Oranguru","FALSE",,"236",,,,"0/15/9",,,,"8",,,,"499",,,,"Confusion, Brutal Swing, Trailblaze",,,"765","765"
"766","Passimian","Passimian","FALSE",,"105",,,,"0/8/14",,,,"6.5",,,,"500",,,,"Counter, Close Combat, Brutal Swing",,,"766","766"
"767","Wimpod","Wimpod","FALSE",,"346",,,,"6/15/13",,,,"50",,,,"495",,,,"Struggle Bug, Bug Buzz, NA",,,"767;768","767;768"
"768","Golisopod","Wimpod","FALSE",,"50",,,,"7/14/13",,,,"6",,,,"499",,,,"Shadow Claw, X-Scissor, Liquidation",,,"767;768","768"
"776","Turtonator","Turtonator","FALSE",,"130",,,,"5/14/13",,,,"8.5",,,,"499",,,,"Incinerate, Flamethrower, Overheat",,,"776","776"
"777","Togedemaru","Togedemaru","FALSE",,"251",,,,"0/8/15",,,,"9",,,,"499",,,,"Thunder Shock, Wild Charge, Gyro Ball",,,"777","777"
"780","Drampa","Drampa","FALSE",,"243",,,,"4/15/14",,,,"6.5",,,,"500",,,,"Dragon Breath, Fly, Outrage",,,"780","780"
"782","Jangmo-o","Jangmo-o","FALSE",,"91",,,,"0/15/11",,,,"21",,,,"496",,,,"Dragon Tail, Dragon Claw, Brick Break",,,"782;783;784","782;783;784"
"783","Hakamo-o","Jangmo-o","FALSE",,"36",,,,"0/15/13",,,,"11.5",,,,"500",,,,"Dragon Tail, Dragon Claw, Brick Break",,,"782;783;784","783;784"
"784","Kommo-o","Jangmo-o","FALSE",,"119",,,,"0/12/9",,,,"6",,,,"499",,,,"Dragon Tail, Close Combat, Dragon Claw",,,"782;783;784","784"
"810","Grookey","Grookey","FALSE",,"209",,,,"0/15/15",,,,"18",,,,"498",,,,"Razor Leaf, Grass Knot, Energy Ball",,,"810;811;812","810;811;812"
"811","Thwackey","Grookey","FALSE",,"219",,,,"3/15/15",,,,"10",,,,"500",,,,"Razor Leaf, Grass Knot, Energy Ball",,,"810;811;812","811;812"
"812","Rillaboom","Grookey","FALSE",,"241",,,,"0/4/15",,,,"6",,,,"494",,,,"Razor Leaf, Grass Knot, Earth Power",,,"810;811;812","812"
"813","Scorbunny","Scorbunny","FALSE",,"220",,,,"0/14/13",,,,"18",,,,"500",,,,"Fire Spin, Flame Charge, Flamethrower",,,"813;814;815","813;814;815"
"814","Raboot","Scorbunny","FALSE",,"216",,,,"0/15/13",,,,"10.5",,,,"498",,,,"Fire Spin, Flame Charge, Flamethrower",,,"813;814;815","814;815"
"815","Cinderace","Scorbunny","FALSE",,"250",,,,"0/9/13",,,,"6.5",,,,"499",,,,"Fire Spin, Flame Charge, Focus Blast",,,"813;814;815","815"
"816","Sobble","Sobble","FALSE",,"273",,,,"0/14/13",,,,"18",,,,"500",,,,"Water Gun, Surf, Water Pulse",,,"816;817;818","816;817;818"
"817","Drizzile","Sobble","FALSE",,"291",,,,"0/14/15",,,,"10",,,,"498",,,,"Water Gun, Surf, Water Pulse",,,"816;817;818","817;818"
"818","Inteleon","Sobble","FALSE",,"377",,,,"0/14/13",,,,"6.5",,,,"500",,,,"Water Gun, Surf, Shadow Ball",,,"816;817;818","818"
"819","Skwovet","Skwovet","FALSE",,"190",,,,"0/15/14",,,,"21.5",,,,"497",,,,"Bullet Seed, Body Slam, Crunch",,,"819;820","819;820"
"820","Greedent","Skwovet","FALSE",,"138",,,,"4/15/15",,,,"8",,,,"499",,,,"Mud Shot, Body Slam, Crunch",,,"819;820","820"
"831","Wooloo","Wooloo","FALSE",,"124",,,,"0/15/15",,,,"29.5",,,,"500",,,,"Tackle, Wild Charge, Stomp",,,"831;832","831;832"
"832","Dubwool","Wooloo","FALSE",,"89",,,,"0/9/12",,,,"9",,,,"496",,,,"Double Kick, Wild Charge, Body Slam",,,"831;832","832"
"862","Obstagoon","Zigzagoon","FALSE",,"93",,,,"0/9/9",,,,"7.5",,,,"500",,,,"Counter, Night Slash, Cross Chop",,,"263;264;862","862"
"863","Perrserker","Meowth","FALSE",,"141",,,,"0/15/15",,,,"8",,,,"498",,,,"Shadow Claw, Close Combat, Trailblaze",,,"52;53;863","863"
"865","Sirfetch'd","Farfetchd","FALSE",,"182",,,,"0/10/15",,,,"6.5",,,,"499",,,,"Fury Cutter, Close Combat, Leaf Blade",,,"83;865","865"
"866","Mr. Rime","Mr-mime","FALSE",,"340",,,,"0/5/14",,,,"7",,,,"499",,,,"Ice Shard, Triple Axel, Ice Punch",,,"122;439;866","439;866"
"867","Runerigus","Runerigus","FALSE",,"47",,,,"0/15/15",,,,"8.5",,,,"497",,,,"Shadow Claw, Brutal Swing, Shadow Ball",,,"562;867","867"
"870","Falinks","Falinks","FALSE",,"201",,,,"4/15/13",,,,"8",,,,"500",,,,"Counter, Superpower, Megahorn",,,"870","870"
"874","Stonjourner","Stonjourner","FALSE",,"271",,,,"1/15/15",,,,"6",,,,"499",,,,"Rock Throw, Stone Edge, Rock Slide",,,"874","874"
"885","Dreepy","Dreepy","FALSE",,"348",,,,"0/15/13",,,,"26",,,,"495",,,,"Astonish, Struggle, NA",,,"885;886;887","885;886;887"
"886","Drakloak","Dreepy","FALSE",,"198",,,,"1/15/15",,,,"11.5",,,,"500",,,,"Astonish, Shadow Ball, Outrage",,,"885;886;887","886;887"
"887","Dragapult","Dreepy","FALSE",,"96",,,,"0/14/15",,,,"5.5",,,,"499",,,,"Astonish, Breaking Swipe, Shadow Ball",,,"885;886;887","887"
"1111","Select a Pokemon","Select a Pokemon","FALSE","","","","","","","","","","","","","","","","","","","","","1111","1111"
"1111","Select a Pokemon","Select a Pokemon","TRUE","","","","","","","","","","","","","","","","","","","","","1111","1111"
"1112","Select a Shadow Pokemon","Select a Shadow Pokemon","FALSE","","","","","","","","","","","","","","","","","","","","","1112","1112"
"1112","Select a Shadow Pokemon","Select a Shadow Pokemon","TRUE","","","","","","","","","","","","","","","","","","","","","1112","1112"
