"ID","Pokemon","Family","Shadow","Little_Rank","Great_Rank","Ultra_Rank","Master_Rank","Little_IVs","Great_IVs","Ultra_IVs","Master_IVs","Little_Level","Great_Level","Ultra_Level","Master_Level","Little_CP","Great_CP","Ultra_CP","Master_CP","Little_MoveSet","Great_MoveSet","Ultra_MoveSet","Master_MoveSet","Evo_Fam","Evo_Next"
"320","Wailmer (Shadow)","Wailmer","TRUE","162","229",,,"0/12/15","0/15/15",,,"13.5","50",,,"500","1500",,,"Water Gun, Scald, Body Slam","Water Gun, Scald, Body Slam",,,"320;321","320;321"
"321","Wailord","Wailmer","FALSE","193","506","467","498","0/14/12","0/15/14","9/15/15","15/15/15","8.5","25","50","50","499","1500","2499","2577","Water Gun, Surf, Scald","Water Gun, Surf, Scald","Water Gun, Scald, Blizzard","Water Gun, Surf, Scald","320;321","321"
"321","Wailord (Shadow)","Wailmer","TRUE","230","533","529","516","0/14/12","0/15/14","9/15/15","15/15/15","8.5","25","50","50","499","1500","2499","2577","Water Gun, Surf, Scald","Water Gun, Surf, Scald","Water Gun, Scald, Blizzard","Water Gun, Surf, Scald","320;321","321"
"323","Camerupt","Numel","FALSE",,"607","336",,,"0/14/13","15/15/15",,,"26","50",,,"1499","2479",,,"Incinerate, Earth Power, Overheat","Incinerate, Earth Power, Overheat",,"322;323","323"
"323","Camerupt (Shadow)","Numel","TRUE",,"629","410",,,"0/14/13","15/15/15",,,"26","50",,,"1499","2479",,,"Incinerate, Earth Power, Overheat","Incinerate, Earth Power, Overheat",,"322;323","323"
"324","Torkoal","Torkoal","FALSE","217","492","439","539","0/5/13","0/15/15","15/15/15","15/15/15","9.5","27.5","50","50","498","1491","2366","2366","Fire Spin, Overheat, Earthquake","Fire Spin, Overheat, Earthquake","Fire Spin, Overheat, Earthquake","Fire Spin, Overheat, Earthquake","324","324"
"325","Spoink","Spoink","FALSE",,"974",,,,"15/15/15",,,,"49.5",,,,"1495",,,,"Zen Headbutt, Shadow Ball, Return",,,"325;326","325;326"
"325","Spoink (Shadow)","Spoink","TRUE",,"969",,,,"15/15/15",,,,"49.5",,,,"1495",,,,"Zen Headbutt, Shadow Ball, Mirror Coat",,,"325;326","325;326"
"326","Grumpig","Spoink","FALSE",,"903","620","597",,"1/14/15","3/14/15","15/15/15",,"24","50","50",,"1498","2493","2679",,"Extrasensory, Shadow Ball, Psychic","Extrasensory, Shadow Ball, Psychic","Extrasensory, Shadow Ball, Psychic","325;326","326"
"326","Grumpig (Shadow)","Spoink","TRUE",,"935","639","604",,"1/14/15","3/14/15","15/15/15",,"24","50","50",,"1498","2493","2679",,"Extrasensory, Shadow Ball, Psychic","Extrasensory, Shadow Ball, Psychic","Extrasensory, Shadow Ball, Psychic","325;326","326"
"327","Spinda","Spinda","FALSE",,"235",,,,"15/15/14",,,,"50",,,,"1380",,,,"Sucker Punch, Icy Wind, Dig",,,"327","327"
"328","Trapinch","Trapinch","FALSE","359","801",,,"0/15/14","15/15/15",,,"15","50",,,"500","1441",,,"Sand Attack, Scorching Sands, Crunch","Sand Attack, Scorching Sands, Crunch",,,"328;329;330","328;329;330"
"328","Trapinch (Shadow)","Trapinch","TRUE","354","819",,,"0/15/14","15/15/15",,,"15","50",,,"500","1441",,,"Sand Attack, Scorching Sands, Crunch","Sand Attack, Scorching Sands, Crunch",,,"328;329;330","328;329;330"
"329","Vibrava","Trapinch","FALSE","157","625",,,"0/15/13","15/15/15",,,"16","50",,,"498","1384",,,"Dragon Breath, Scorching Sands, Bug Buzz","Dragon Breath, Sand Tomb, Bug Buzz",,,"328;329;330","329;330"
"329","Vibrava (Shadow)","Trapinch","TRUE","92","572",,,"0/15/13","15/15/15",,,"16","50",,,"498","1384",,,"Dragon Breath, Scorching Sands, Bug Buzz","Dragon Breath, Sand Tomb, Bug Buzz",,,"328;329;330","329;330"
"330","Flygon","Trapinch","FALSE","113","165","109","296","0/8/6","0/15/9","0/13/15","15/15/15","7.5","21.5","41","50","498","1499","2497","3008","Sand Attack, Dragon Claw, Scorching Sands","Dragon Tail, Scorching Sands, Dragon Claw","Dragon Tail, Dragon Claw, Scorching Sands","Sand Attack, Dragon Claw, Scorching Sands","328;329;330","330"
"330","Flygon (Shadow)","Trapinch","TRUE",,"161","73","277",,"0/15/9","0/13/15","15/15/15",,"21.5","41","50",,"1499","2497","3008",,"Dragon Tail, Dragon Claw, Scorching Sands","Dragon Tail, Dragon Claw, Scorching Sands","Sand Attack, Dragon Claw, Scorching Sands","328;329;330","330"
"332","Cacturne","Cacnea","FALSE",,"415","199",,,"0/14/15","6/15/15",,,"24.5","50",,,"1498","2495",,,"Sucker Punch, Trailblaze, Dark Pulse","Sucker Punch, Trailblaze, Dark Pulse",,"331;332","332"
"332","Cacturne (Shadow)","Cacnea","TRUE",,"354","259",,,"0/14/15","6/15/15",,,"24.5","50",,,"1498","2495",,,"Sucker Punch, Trailblaze, Dark Pulse","Sucker Punch, Trailblaze, Dark Pulse",,"331;332","332"
"334","Altaria","Swablu","FALSE",,"168","293","529",,"0/14/15","15/15/15","15/15/15",,"29","50","50",,"1498","2266","2266",,"Dragon Breath, Sky Attack, Moonblast","Dragon Breath, Sky Attack, Moonblast","Dragon Breath, Sky Attack, Moonblast","333;334","334"
"335","Zangoose","Zangoose","FALSE",,"253","187","342",,"0/15/10","0/15/15","15/15/15",,"23.5","48","50",,"1494","2498","2733",,"Shadow Claw, Close Combat, Night Slash","Shadow Claw, Close Combat, Night Slash","Shadow Claw, Close Combat, Night Slash","335","335"
"336","Seviper","Seviper","FALSE",,"442","474",,,"0/15/12","15/15/15",,,"27","50",,,"1500","2380",,,"Poison Jab, Poison Fang, Crunch","Poison Jab, Crunch, Poison Fang",,"336","336"
"337","Lunatone","Lunatone","FALSE","277","321","205","424","0/5/15","0/15/14","6/15/14","15/15/15","8.5","24.5","49.5","50","499","1494","2497","2631","Psywave, Rock Slide, Moonblast","Psywave, Rock Slide, Moonblast","Psywave, Rock Slide, Moonblast","Psywave, Rock Slide, Moonblast","337","337"
"338","Solrock","Solrock","FALSE","269","337","251","459","0/5/15","0/15/14","6/15/14","15/15/15","8.5","24.5","49.5","50","499","1494","2497","2631","Psywave, Rock Slide, Psychic","Psywave, Rock Slide, Psychic","Psywave, Rock Slide, Psychic","Psywave, Rock Slide, Psychic","338","338"
"339","Barboach","Barboach","FALSE","28",,,,"0/15/13",,,,"25",,,,"499",,,,"Mud Shot, Aqua Tail, Mud Bomb",,,,"339;340","339;340"
"339","Barboach (Shadow)","Barboach","TRUE","8",,,,"0/15/13",,,,"25",,,,"499",,,,"Mud Shot, Aqua Tail, Mud Bomb",,,,"339;340","339;340"
"340","Whiscash","Barboach","FALSE","9","70","190","451","0/11/11","0/14/13","15/15/14","15/15/15","9.5","28","50","50","498","1490","2346","2346","Mud Shot, Scald, Mud Bomb","Mud Shot, Mud Bomb, Scald","Mud Shot, Mud Bomb, Scald","Mud Shot, Mud Bomb, Scald","339;340","340"
"340","Whiscash (Shadow)","Barboach","TRUE","21","47","186","452","0/11/11","0/14/13","15/15/14","15/15/15","9.5","28","50","50","498","1490","2346","2346","Mud Shot, Mud Bomb, Scald","Mud Shot, Mud Bomb, Scald","Mud Shot, Mud Bomb, Scald","Mud Shot, Mud Bomb, Scald","339;340","340"
"341","Corphish","Corphish","FALSE","314","860",,,"0/14/12","15/15/15",,,"16","50",,,"500","1391",,,"Bubble, Scald, Razor Shell","Bubble, Scald, Razor Shell",,,"341;342","341;342"
"341","Corphish (Shadow)","Corphish","TRUE","290","797",,,"0/14/12","15/15/15",,,"16","50",,,"500","1391",,,"Bubble, Scald, Razor Shell","Bubble, Scald, Razor Shell",,,"341;342","341;342"
"342","Crawdaunt","Corphish","FALSE","184","508","302","332","6/15/14","2/15/14","0/15/15","15/15/15","7.5","22.5","46","50","497","1497","2496","2797","Snarl, Night Slash, Scald","Snarl, Night Slash, Scald","Snarl, Night Slash, Crabhammer","Snarl, Night Slash, Scald","341;342","342"
"342","Crawdaunt (Shadow)","Corphish","TRUE",,"450","276","295",,"2/15/14","0/15/15","15/15/15",,"22.5","46","50",,"1497","2496","2797",,"Snarl, Night Slash, Scald","Snarl, Night Slash, Scald","Snarl, Night Slash, Scald","341;342","342"
"343","Baltoy","Baltoy","FALSE","312",,,,"0/12/14",,,,"27",,,,"497",,,,"Confusion, Dig, Gyro Ball",,,,"343;344","343;344"
"344","Claydol","Baltoy","FALSE","195","334","395","511","0/13/11","0/14/15","15/15/14","15/15/15","10","29.5","50","50","495","1488","2229","2229","Mud Slap, Scorching Sands, Shadow Ball","Mud Slap, Ice Beam, Shadow Ball","Mud Slap, Scorching Sands, Ice Beam","Mud Slap, Scorching Sands, Ice Beam","343;344","344"
"345","Lileep","Lileep","FALSE",,"207",,,,"15/15/15",,,,"50",,,,"1460",,,,"Bullet Seed, Grass Knot, Ancient Power",,,"345;346","345;346"
"345","Lileep (Shadow)","Lileep","TRUE",,"266",,,,"15/15/15",,,,"50",,,,"1460",,,,"Bullet Seed, Grass Knot, Ancient Power",,,"345;346","345;346"
"346","Cradily","Lileep","FALSE",,"142","180","533",,"0/15/15","15/15/15","15/15/15",,"26","50","50",,"1498","2499","2499",,"Bullet Seed, Rock Slide, Grass Knot","Bullet Seed, Stone Edge, Grass Knot","Bullet Seed, Grass Knot, Stone Edge","345;346","346"
"346","Cradily (Shadow)","Lileep","TRUE",,"175","219","541",,"0/15/15","15/15/15","15/15/15",,"26","50","50",,"1498","2499","2499",,"Bullet Seed, Rock Slide, Grass Knot","Bullet Seed, Grass Knot, Stone Edge","Bullet Seed, Grass Knot, Stone Edge","345;346","346"
"347","Anorith","Anorith","FALSE",,"956",,,,"0/15/15",,,,"45",,,,"1500",,,,"Struggle Bug, Ancient Power, Cross Poison",,,"347;348","347;348"
"347","Anorith (Shadow)","Anorith","TRUE",,"957",,,,"0/15/15",,,,"45",,,,"1500",,,,"Struggle Bug, Ancient Power, Cross Poison",,,"347;348","347;348"
"348","Armaldo","Anorith","FALSE",,"658","568","384",,"0/9/15","2/15/15","15/15/15",,"20","35","50",,"1497","2495","3220",,"Fury Cutter, Rock Blast, Liquidation","Fury Cutter, Rock Blast, Liquidation","Fury Cutter, Rock Blast, Cross Poison","347;348","348"
"348","Armaldo (Shadow)","Anorith","TRUE",,"518","518","376",,"0/9/15","2/15/15","15/15/15",,"20","35","50",,"1497","2495","3220",,"Fury Cutter, Rock Blast, Liquidation","Fury Cutter, Rock Blast, Liquidation","Fury Cutter, Cross Poison, Rock Blast","347;348","348"
"349","Feebas","Feebas","FALSE","414",,,,"15/15/15",,,,"50",,,,"310",,,,"Tackle, Mirror Coat, NA",,,,"349;350","349;350"
"350","Milotic","Feebas","FALSE","170","395","202","171","0/14/14","0/15/11","0/13/15","15/15/15","6.5","19","33","50","500","1495","2493","3398","Waterfall, Surf, Blizzard","Dragon Tail, Surf, Blizzard","Dragon Tail, Surf, Blizzard","Dragon Tail, Surf, Blizzard","349;350","350"
"352","Kecleon","Kecleon","FALSE",,"327","468","518",,"0/15/15","15/15/14","15/15/15",,"28","50","50",,"1495","2314","2314",,"Sucker Punch, Aerial Ace, Ice Beam","Sucker Punch, Aerial Ace, Foul Play","Sucker Punch, Aerial Ace, Foul Play","352","352"
"354","Banette","Shuppet","FALSE",,"713","387",,,"0/14/15","6/15/15",,,"24.5","50",,,"1500","2499",,,"Shadow Claw, Shadow Ball, Thunder","Shadow Claw, Shadow Ball, Thunder",,"353;354","354"
"354","Banette (Shadow)","Shuppet","TRUE",,"813","490",,,"0/14/15","6/15/15",,,"24.5","50",,,"1500","2498",,,"Shadow Claw, Shadow Ball, Thunder","Shadow Claw, Shadow Ball, Thunder",,"353;354","354"
"355","Duskull","Duskull","FALSE","61",,,,"0/15/15",,,,"30",,,,"500",,,,"Astonish, Night Shade, Return",,,,"355;356;477","355;356;477"
"355","Duskull (Shadow)","Duskull","TRUE","58",,,,"0/15/15",,,,"30",,,,"500",,,,"Astonish, Night Shade, Shadow Sneak",,,,"355;356;477","355;356;477"
"356","Dusclops","Duskull","FALSE","136","301",,,"0/14/12","0/11/15",,,"12.5","45",,,"498","1498",,,"Hex, Shadow Punch, Ice Punch","Hex, Ice Punch, Poltergeist",,,"355;356;477","356;477"
"356","Dusclops (Shadow)","Duskull","TRUE","155","497",,,"0/14/12","0/11/15",,,"12.5","45",,,"498","1498",,,"Hex, Shadow Punch, Ice Punch","Hex, Ice Punch, Poltergeist",,,"355;356;477","356;477"
"357","Tropius","Tropius","FALSE",,"134","394","548",,"0/15/15","15/15/14","15/15/15",,"30","50","50",,"1494","2194","2194",,"Air Slash, Leaf Blade, Aerial Ace","Air Slash, Leaf Blade, Brutal Swing","Air Slash, Leaf Blade, Brutal Swing","357","357"
"358","Chimecho","Chimecho","FALSE",,"621","404","523",,"0/14/12","11/15/15","15/15/15",,"25.5","50","50",,"1500","2495","2554",,"Astonish, Psyshock, Shadow Ball","Astonish, Psyshock, Shadow Ball","Astonish, Psyshock, Shadow Ball","358;433","358;433"
"359","Absol","Absol","FALSE",,"890","648","500",,"0/15/15","0/15/14","15/15/15",,"22","44","50",,"1499","2491","2856",,"Snarl, Dark Pulse, Megahorn","Snarl, Dark Pulse, Megahorn","Snarl, Dark Pulse, Megahorn","359","359"
"359","Absol (Shadow)","Absol","TRUE",,"881","603","467",,"0/15/15","0/15/14","15/15/15",,"22","44","50",,"1499","2491","2856",,"Snarl, Dark Pulse, Megahorn","Snarl, Dark Pulse, Megahorn","Snarl, Dark Pulse, Megahorn","359","359"
"360","Wynaut","Wobbuffet","FALSE","42",,,,"5/15/15",,,,"50",,,,"493",,,,"Counter, Mirror Coat, NA",,,,"202;360","360"
"361","Snorunt","Snorunt","FALSE","110",,,,"0/15/13",,,,"23",,,,"500",,,,"Powder Snow, Avalanche, Shadow Ball",,,,"361;362","361;362"
"361","Snorunt (Shadow)","Snorunt","TRUE","156",,,,"0/15/13",,,,"23",,,,"500",,,,"Powder Snow, Avalanche, Shadow Ball",,,,"361;362","361;362"
"362","Glalie","Snorunt","FALSE","305","454","407","512","4/14/13","0/13/13","15/15/15","15/15/15","9","27.5","50","50","500","1498","2380","2380","Ice Shard, Avalanche, Shadow Ball","Ice Shard, Avalanche, Shadow Ball","Ice Shard, Avalanche, Shadow Ball","Ice Shard, Avalanche, Shadow Ball","361;362","362"
"362","Glalie (Shadow)","Snorunt","TRUE","333","470","484","507","4/14/13","0/13/13","15/15/15","15/15/15","9","27.5","50","50","500","1498","2380","2380","Ice Shard, Avalanche, Shadow Ball","Ice Shard, Avalanche, Shadow Ball","Ice Shard, Avalanche, Shadow Ball","Ice Shard, Avalanche, Shadow Ball","361;362","362"
"364","Sealeo","Spheal","FALSE",,"189","688",,,"0/15/14","15/15/15",,,"38","50",,,"1497","1938",,,"Powder Snow, Water Pulse, Body Slam","Powder Snow, Body Slam, Water Pulse",,"363;364;365","364;365"
"364","Sealeo (Shadow)","Spheal","TRUE",,"100","665",,,"0/15/14","15/15/15",,,"38","50",,,"1497","1938",,,"Powder Snow, Water Pulse, Body Slam","Powder Snow, Body Slam, Water Pulse",,"363;364;365","364;365"
"365","Walrein","Spheal","FALSE",,"26","46","120",,"0/12/15","0/15/15","15/15/15",,"21","39.5","50",,"1495","2500","3081",,"Powder Snow, Icicle Spear, Earthquake","Powder Snow, Icicle Spear, Earthquake","Powder Snow, Icicle Spear, Earthquake","363;364;365","365"
"365","Walrein (Shadow)","Spheal","TRUE",,"44","42","119",,"0/12/15","0/15/15","15/15/15",,"21","39.5","50",,"1495","2500","3081",,"Powder Snow, Icicle Spear, Earthquake","Powder Snow, Icicle Spear, Earthquake","Powder Snow, Icicle Spear, Earthquake","363;364;365","365"
"366","Clamperl","Clamperl","FALSE",,"692",,,,"15/15/14",,,,"50",,,,"1436",,,,"Water Gun, Body Slam, Water Pulse",,,"366;367","366;367"
"367","Huntail","Clamperl","FALSE",,"482","428","472",,"1/15/15","5/15/14","15/15/15",,"24","49.5","50",,"1498","2500","2645",,"Water Gun, Aqua Tail, Crunch","Water Gun, Aqua Tail, Crunch","Water Gun, Aqua Tail, Crunch","366;367","367"
"368","Gorebyss","Gorebyss","FALSE",,"929","680","589",,"0/15/15","0/15/12","15/15/15",,"22.5","46.5","50",,"1500","2494","2820",,"Water Gun, Water Pulse, Psychic","Water Gun, Water Pulse, Psychic","Water Gun, Water Pulse, Psychic","366;368","368"
"369","Relicanth","Relicanth","FALSE",,"196","159","313",,"1/15/15","0/11/15","15/15/15",,"22.5","47","50",,"1498","2497","2858",,"Water Gun, Aqua Tail, Ancient Power","Water Gun, Aqua Tail, Ancient Power","Water Gun, Aqua Tail, Ancient Power","369","369"
"372","Shelgon","Bagon","FALSE",,"478","582",,,"1/15/14","15/15/15",,,"28","50",,,"1493","2296",,,"Dragon Breath, Flamethrower, Twister","Dragon Breath, Flamethrower, Dragon Pulse",,"371;372;373","372;373"
"372","Shelgon (Shadow)","Bagon","TRUE",,"592","608",,,"1/15/14","15/15/15",,,"28","50",,,"1493","2296",,,"Dragon Breath, Flamethrower, Dragon Pulse","Dragon Breath, Flamethrower, Dragon Pulse",,"371;372;373","372;373"
"373","Salamence","Bagon","FALSE",,"513","267","86",,"0/10/14","1/15/14","15/15/15",,"15","24.5","50",,"1490","2500","4239",,"Dragon Tail, Fly, Outrage","Dragon Tail, Fly, Outrage","Dragon Tail, Fly, Outrage","371;372;373","373"
"373","Salamence (Shadow)","Bagon","TRUE",,"467","274","97",,"0/10/14","1/15/14","15/15/15",,"15","24.5","50",,"1490","2500","4239",,"Dragon Tail, Fly, Outrage","Dragon Tail, Fly, Outrage","Dragon Tail, Fly, Outrage","371;372;373","373"
"375","Metang","Beldum","FALSE",,"383","692",,,"0/13/15","15/15/14",,,"38","50",,,"1494","1946",,,"Metal Claw, Psyshock, Gyro Ball","Metal Claw, Psyshock, Gyro Ball",,"374;375;376","375;376"
"375","Metang (Shadow)","Beldum","TRUE",,"372","697",,,"0/13/15","15/15/14",,,"38","50",,,"1494","1946",,,"Metal Claw, Psyshock, Gyro Ball","Metal Claw, Psyshock, Gyro Ball",,"374;375;376","375;376"
"376","Metagross","Beldum","FALSE",,"782","539","54",,"2/15/15","0/15/13","15/15/15",,"14.5","24.5","50",,"1496","2493","4286",,"Bullet Punch, Meteor Mash, Psychic","Bullet Punch, Meteor Mash, Earthquake","Bullet Punch, Meteor Mash, Earthquake","374;375;376","376"
"376","Metagross (Shadow)","Beldum","TRUE",,"848","585","98",,"2/15/15","0/15/13","15/15/15",,"14.5","24.5","50",,"1496","2493","4286",,"Bullet Punch, Meteor Mash, Psychic","Bullet Punch, Meteor Mash, Psychic","Bullet Punch, Meteor Mash, Earthquake","374;375;376","376"
"377","Regirock","Regirock","FALSE",,"50","12","90",,"0/10/12","0/12/15","15/15/15",,"18.5","31","50",,"1497","2494","3530",,"Lock On, Stone Edge, Focus Blast","Lock On, Stone Edge, Focus Blast","Lock On, Stone Edge, Focus Blast","377","377"
"377","Regirock (Shadow)","Regirock","TRUE",,"88","24","77",,"0/10/12","0/12/15","15/15/15",,"18.5","31","50",,"1497","2494","3530",,"Lock On, Stone Edge, Focus Blast","Lock On, Stone Edge, Focus Blast","Lock On, Stone Edge, Focus Blast","377","377"
"378","Regice","Regice","FALSE",,"184","76","208",,"0/10/12","0/12/15","15/15/15",,"18.5","31","50",,"1497","2494","3530",,"Lock On, Blizzard, Earthquake","Lock On, Thunder, Blizzard","Lock On, Thunder, Earthquake","378","378"
"378","Regice (Shadow)","Regice","TRUE",,"351","114","230",,"0/10/12","0/12/15","15/15/15",,"18.5","31","50",,"1497","2494","3530",,"Lock On, Blizzard, Earthquake","Lock On, Thunder, Blizzard","Lock On, Thunder, Earthquake","378","378"
"379","Registeel","Registeel","FALSE",,"27","10","225",,"0/8/15","0/14/15","15/15/15",,"24","50","50",,"1499","2500","2766",,"Lock On, Focus Blast, Zap Cannon","Lock On, Focus Blast, Zap Cannon","Lock On, Focus Blast, Flash Cannon","379","379"
"379","Registeel (Shadow)","Registeel","TRUE",,"122","62","289",,"0/8/15","0/14/15","15/15/15",,"24","50","50",,"1499","2500","2766",,"Lock On, Focus Blast, Zap Cannon","Lock On, Focus Blast, Zap Cannon","Lock On, Focus Blast, Flash Cannon","379","379"
"380","Latias","Latias","FALSE",,"684","502","179",,"0/14/14","1/15/14","15/15/15",,"16","26.5","50",,"1499","2497","3968",,"Dragon Breath, Mist Ball, Thunder","Dragon Breath, Mist Ball, Thunder","Dragon Breath, Mist Ball, Outrage","380","380"
"380","Latias (Shadow)","Latias","TRUE",,"622","528","212",,"0/14/14","1/15/14","15/15/15",,"16","26.5","50",,"1499","2497","3968",,"Dragon Breath, Mist Ball, Thunder","Dragon Breath, Mist Ball, Thunder","Dragon Breath, Mist Ball, Outrage","380","380"
"381","Latios","Latios","FALSE",,"417","368","83",,"0/15/15","2/15/15","15/15/15",,"14.5","24","50",,"1497","2492","4310",,"Dragon Breath, Dragon Claw, Luster Purge","Dragon Breath, Dragon Claw, Luster Purge","Dragon Breath, Dragon Claw, Luster Purge","381","381"
"381","Latios (Shadow)","Latios","TRUE",,"344","300","51",,"0/15/15","2/15/15","15/15/15",,"14.5","24","50",,"1497","2492","4310",,"Dragon Breath, Dragon Claw, Luster Purge","Dragon Breath, Dragon Claw, Luster Purge","Dragon Breath, Dragon Claw, Luster Purge","381","381"
"382","Kyogre","Kyogre","FALSE",,,"596","57",,,"0/15/13","15/15/15",,,"22.5","50",,,"2500","4652",,,"Waterfall, Surf, Origin Pulse","Waterfall, Surf, Origin Pulse","382","382"
"382","Kyogre (Shadow)","Kyogre","TRUE",,"740","606","73",,"0/15/13","0/15/13","15/15/15",,"13.5","22.5","50",,"1500","2500","4652",,"Waterfall, Surf, Origin Pulse","Waterfall, Surf, Origin Pulse","Waterfall, Surf, Origin Pulse","382","382"
"383","Groudon","Groudon","FALSE",,,"485","32",,,"0/15/13","15/15/15",,,"22.5","50",,,"2500","4652",,,"Mud Shot, Precipice Blades, Fire Punch","Mud Shot, Fire Punch, Precipice Blades","383","383"
"383","Groudon (Shadow)","Groudon","TRUE",,"659","517","40",,"0/15/13","0/15/13","15/15/15",,"13.5","22.5","50",,"1500","2500","4652",,"Mud Shot, Precipice Blades, Fire Punch","Mud Shot, Precipice Blades, Fire Punch","Mud Shot, Precipice Blades, Fire Punch","383","383"
"384","Rayquaza","Rayquaza","FALSE",,"447","364","71",,"0/15/12","0/15/15","15/15/15",,"14.5","24","50",,"1496","2497","4336",,"Dragon Tail, Breaking Swipe, Dragon Ascent","Dragon Tail, Breaking Swipe, Dragon Ascent","Dragon Tail, Breaking Swipe, Dragon Ascent","384","384"
"385","Jirachi","Jirachi","FALSE",,"343","296","136",,"0/10/13","0/15/10","15/15/15",,"17.5","29","50",,"1498","2493","3691",,"Confusion, Doom Desire, Psychic","Confusion, Doom Desire, Dazzling Gleam","Confusion, Doom Desire, Psychic","385","385"
"386","Deoxys","Deoxys","FALSE",,,,"596",,,,"15/15/15",,,,"50",,,,"3573",,,,"Charge Beam, Psycho Boost, Thunderbolt","386","386"
"386","Deoxys (Defense)","Deoxys","FALSE",,"240","234","525",,"0/15/15","12/13/15","15/15/15",,"25.5","49.5","50",,"1491","2490","2570",,"Counter, Psycho Boost, Thunderbolt","Counter, Psycho Boost, Rock Slide","Counter, Psycho Boost, Rock Slide","386","386"
"386","Deoxys (Speed)","Deoxys","FALSE",,"950","709","585",,"0/14/14","1/14/15","15/15/15",,"19.5","34.5","50",,"1499","2492","3255",,"Charge Beam, Psycho Boost, Swift","Charge Beam, Psycho Boost, Swift","Charge Beam, Psycho Boost, Swift","386","386"
"387","Turtwig","Turtwig","FALSE",,"900",,,,"15/15/15",,,,"50",,,,"1342",,,,"Tackle, Body Slam, Seed Bomb",,,"387;388;389","387;388;389"
"387","Turtwig (Shadow)","Turtwig","TRUE",,"897",,,,"15/15/15",,,,"50",,,,"1342",,,,"Tackle, Body Slam, Seed Bomb",,,"387;388;389","387;388;389"
"388","Grotle","Turtwig","FALSE",,"567","689",,,"0/15/11","15/15/15",,,"31.5","50",,,"1497","2137",,,"Razor Leaf, Body Slam, Energy Ball","Razor Leaf, Body Slam, Energy Ball",,"387;388;389","388;389"
"388","Grotle (Shadow)","Turtwig","TRUE",,"471","675",,,"0/15/11","15/15/15",,,"31.5","50",,,"1497","2137",,,"Razor Leaf, Body Slam, Energy Ball","Razor Leaf, Body Slam, Energy Ball",,"387;388;389","388;389"
"389","Torterra","Turtwig","FALSE",,"620","614","428",,"0/11/13","0/15/15","15/15/15",,"19.5","34","50",,"1496","2493","3318",,"Razor Leaf, Frenzy Plant, Stone Edge","Razor Leaf, Frenzy Plant, Stone Edge","Razor Leaf, Frenzy Plant, Stone Edge","387;388;389","389"
"389","Torterra (Shadow)","Turtwig","TRUE",,"523","594","408",,"0/11/13","0/15/15","15/15/15",,"19.5","34","50",,"1496","2493","3318",,"Razor Leaf, Frenzy Plant, Stone Edge","Razor Leaf, Frenzy Plant, Stone Edge","Razor Leaf, Frenzy Plant, Stone Edge","387;388;389","389"
"391","Monferno","Chimchar","FALSE",,"844",,,,"0/15/14",,,,"43.5",,,,"1498",,,,"Ember, Flamethrower, Low Sweep",,,"390;391;392","391;392"
"391","Monferno (Shadow)","Chimchar","TRUE",,"834",,,,"0/15/14",,,,"43.5",,,,"1498",,,,"Ember, Flamethrower, Low Sweep",,,"390;391;392","391;392"
"392","Infernape","Chimchar","FALSE",,"613","319","324",,"0/13/15","1/15/14","15/15/15",,"21","39.5","50",,"1491","2500","3033",,"Fire Spin, Close Combat, Blast Burn","Fire Spin, Close Combat, Blast Burn","Fire Spin, Close Combat, Blast Burn","390;391;392","392"
"392","Infernape (Shadow)","Chimchar","TRUE",,"664","411","350",,"0/13/15","1/15/14","15/15/15",,"21","39.5","50",,"1491","2500","3033",,"Fire Spin, Close Combat, Blast Burn","Fire Spin, Close Combat, Blast Burn","Fire Spin, Close Combat, Blast Burn","390;391;392","392"
"393","Piplup","Piplup","FALSE",,"876",,,,"15/15/14",,,,"50",,,,"1215",,,,"Bubble, Drill Peck, Icy Wind",,,"393;394;395","393;394;395"
"393","Piplup (Shadow)","Piplup","TRUE",,"882",,,,"15/15/14",,,,"50",,,,"1215",,,,"Bubble, Drill Peck, Icy Wind",,,"393;394;395","393;394;395"
"394","Prinplup","Piplup","FALSE",,"441",,,,"0/15/14",,,,"38",,,,"1500",,,,"Bubble, Icy Wind, Hydro Pump",,,"393;394;395","394;395"
"394","Prinplup (Shadow)","Piplup","TRUE",,"570",,,,"0/15/14",,,,"38",,,,"1500",,,,"Bubble, Icy Wind, Hydro Pump",,,"393;394;395","394;395"
"395","Empoleon","Piplup","FALSE",,"156","167","218",,"0/13/15","1/15/14","15/15/15",,"19.5","34.5","50",,"1500","2488","3279",,"Metal Claw, Hydro Cannon, Drill Peck","Steel Wing, Hydro Cannon, Drill Peck","Metal Claw, Hydro Cannon, Flash Cannon","393;394;395","395"
"395","Empoleon (Shadow)","Piplup","TRUE",,"139","134","202",,"0/13/15","1/15/14","15/15/15",,"19.5","34.5","50",,"1500","2488","3279",,"Metal Claw, Hydro Cannon, Drill Peck","Steel Wing, Hydro Cannon, Drill Peck","Metal Claw, Hydro Cannon, Drill Peck","393;394;395","395"
"397","Staravia","Starly","FALSE",,"220",,,,"15/15/15",,,,"50",,,,"1468",,,,"Quick Attack, Brave Bird, Fly",,,"396;397;398","397;398"
"397","Staravia (Shadow)","Starly","TRUE",,"244",,,,"15/15/15",,,,"50",,,,"1468",,,,"Quick Attack, Brave Bird, Fly",,,"396;397;398","397;398"
"398","Staraptor","Starly","FALSE",,"261","214","348",,"0/13/13","2/15/14","15/15/15",,"20","35.5","50",,"1492","2498","3194",,"Quick Attack, Fly, Close Combat","Quick Attack, Fly, Close Combat","Quick Attack, Brave Bird, Close Combat","396;397;398","398"
"398","Staraptor (Shadow)","Starly","TRUE",,"274","68","359",,"0/13/13","2/15/14","15/15/15",,"20","35.5","50",,"1492","2498","3194",,"Quick Attack, Fly, Close Combat","Quick Attack, Fly, Close Combat","Quick Attack, Brave Bird, Close Combat","396;397;398","398"
"400","Bibarel","Bidoof","FALSE",,"564","678",,,"0/14/13","15/15/15",,,"33.5","50",,,"1499","2061",,,"Water Gun, Surf, Hyper Fang","Water Gun, Surf, Hyper Fang",,"399;400","400"
"400","Bibarel (Shadow)","Bidoof","TRUE",,"574","684",,,"0/14/13","15/15/15",,,"33.5","50",,,"1499","2061",,,"Water Gun, Surf, Hyper Fang","Water Gun, Surf, Hyper Fang",,"399;400","400"
"402","Kricketune","Kricketot","FALSE",,"472",,,,"0/15/15",,,,"39.5",,,,"1492",,,,"Fury Cutter, X-Scissor, Aerial Ace",,,"401;402","402"
